"655129","Issued-Temp.","30","04/10/2024","DBA: BEST BBQ                            BEST BBQ, INC.                              716 STATE ST ,                             SANTA BARBARA, CA  93101-3330","915 E HARVARD BLVD                              SANTA PAULA, CA  93060","PER","7","","12","4203","716 STATE ST","SANTA BARBARA","42","93101","915 E HARVARD BLVD","SANTA PAULA","93060","CA"
"655139","Issued-Temp.","30","04/10/2024","HY BROTHER SUSHI INC                             539 W TEFFT ST,                             NIPOMO, CA  93444-8949","","PER","","TOWER ESCROW 3600 WILSHIRE BLVD STE 426 LOS ANGELES, CA  90010-2608","13","4000","539 W TEFFT ST","NIPOMO","40","93444","","","",""
"655141","Issued-Temp.","30","04/10/2024","DBA: UNIQUE BITE EATERY                            UNIQUE BITE INC                              82900 AVE 42, F104,                             INDIO, CA  92203-9658","","FID","","","8","3309","82900 AVE 42, F104","INDIO","33","92203","","","",""
"655144","Issued-Temp.","30","04/10/2024","DBA: VIA MAESTRA 42                            BITAR RESTAURANT GROUP VM42, LLC                             3343 STATE ST,                             SANTA BARBARA, CA  93105-2623","","FID","","","12","4203","3343 STATE ST","SANTA BARBARA","42","93105","","","",""
"655150","Issued-Temp.","30","04/10/2024","DBA: LOCALS TAPROOM                            LOCALS TAPROOM LLC                              90 SAN MIGUEL ST,                             AVILA BEACH, CA  93424","PO BOX 441                              AVILA BEACH, CA  93424","PER","7","VIVA ESCROW! INC. 60 ALTA ST STE 102 ARCADIA, CA  91006","13","4000","90 SAN MIGUEL ST","AVILA BEACH","40","93424","PO BOX 441","AVILA BEACH","93424","CA"
"655160","Issued-Temp.","30","04/10/2024","DBA: FAR EAST JOINT WEST COVINA                            MENDOZA, EDWIN CUNANAN                             1230 LAKES DR, STE 104,                             WEST COVINA, CA  91790-3077","","PER","7","","2","1960","1230 LAKES DR, STE 104","WEST COVINA","19","91790","","","",""
"655161","Expired","30","12/13/2023","OCEANSIDE PLAZA VENTURE INC                             3804 PLAZA DR,                             OCEANSIDE, CA  92056-4623","10261 TRADEMARK ST, STE D                              RANCHO CUCAMONGA, CA  91730-5805","PER","","ALISON MCLOSKEY ESCROW 4820 EL CAJON BLVD SAN DIEGO, CA  92115-4695","9","3709","3804 PLAZA DR","OCEANSIDE","37","92056","10261 TRADEMARK ST, STE D","RANCHO CUCAMONGA","91730","CA"