"License Number","Status","Type| Dup","Expir. Date","Primary Owner and Premises Addr.","Mailing Addr.","Action","Conditions","Escrow","District Code","Geo Code","Prem Street","City","County","Zip Code","Mailing Street","Mailing City","Mailing Zip Code","Mailing State"
"634592","Issued-Temp.","30","04/10/2024","DBA: THE RUSE                            891 GROVE STREET LLC                              891 GROVE ST ,                             HEALDSBURG, CA  95448-4762","","EXC/PER/PRM","","CALIFORNIA BUSINESS ESCROW INC 1748 MAIN ST ESCALON, CA  95320-1927","27","4902","891 GROVE ST","HEALDSBURG","49","95448","","","",""
"634592","Issued-Temp.","30","04/10/2024","DBA: THE RUSE                            891 GROVE STREET LLC                              891 GROVE ST ,                             HEALDSBURG, CA  95448-4762","","EXC/PER/PRM","7","CALIFORNIA BUSINESS ESCROW INC 1748 MAIN ST ESCALON, CA  95320-1927","27","4902","891 GROVE ST","HEALDSBURG","49","95448","","","",""
"636663","Active","47 | 2","11/30/2024","DBA: WEDGEWOOD WEDDING AND EVENTS                            WEDGEWOOD BEVERAGE INC                             1855 & 1859 ABBY LN,                             ESCONDIDO, CA  92026","43385 BUSINESS PARK DR                              TEMECULA, CA  92590-3688","PER/PRM","7","","9","3705","1855 & 1859 ABBY LN","ESCONDIDO","37","92026","43385 BUSINESS PARK DR","TEMECULA","92590","CA"
"636663","Active","47 | 2","11/30/2024","DBA: WEDGEWOOD WEDDING AND EVENTS                            WEDGEWOOD BEVERAGE INC                             1855 & 1859 ABBY LN,                             ESCONDIDO, CA  92026","43385 BUSINESS PARK DR                              TEMECULA, CA  92590-3688","PER/PRM","7","","9","3705","1855 & 1859 ABBY LN","ESCONDIDO","37","92026","43385 BUSINESS PARK DR","TEMECULA","92590","CA"
"636663","Active","68 | 2","11/30/2024","DBA: WEDGEWOOD WEDDING AND EVENTS                            WEDGEWOOD BEVERAGE INC                             1855 & 1859 ABBY LN,                             ESCONDIDO, CA  92026","43385 BUSINESS PARK DR                              TEMECULA, CA  92590-3688","PER/PRM","7","","9","3705","1855 & 1859 ABBY LN","ESCONDIDO","37","92026","43385 BUSINESS PARK DR","TEMECULA","92590","CA"
"636663","Active","58 | 2","11/30/2024","DBA: WEDGEWOOD WEDDING AND EVENTS                            WEDGEWOOD BEVERAGE INC                             1855 & 1859 ABBY LN,                             ESCONDIDO, CA  92026","43385 BUSINESS PARK DR                              TEMECULA, CA  92590-3688","PER/PRM","7","","9","3705","1855 & 1859 ABBY LN","ESCONDIDO","37","92026","43385 BUSINESS PARK DR","TEMECULA","92590","CA"
"637180","Issued-Temp.","30","04/10/2024","DBA: HOOK & PLOW, THE                            KELLEHER RESTAURANT GROUP LLC                             1112A MANHATTAN AVE ,                             MANHATTAN BEACH, CA  90266-5313","540 24TH PL                               HERMOSA BEACH, CA  90254-2607","ORI","7","","3","1935","1112A MANHATTAN AVE","MANHATTAN BEACH","19","90266","540 24TH PL","HERMOSA BEACH","90254","CA"
"642870","Active","47 | 0","11/30/2024","EL REY TACO GRILL INC                             33950 ANGELS LN, STE C,                             WILDOMAR, CA  92595-8736","16687 ARROW BLVD, STE 100                              FONTANA, CA  92335-3412","ORI","5","","7","3326","33950 ANGELS LN, STE C","WILDOMAR","33","92595","16687 ARROW BLVD, STE 100","FONTANA","92335","CA"
"643576","Active","20 | 0","11/30/2024","DBA: FOOTHILL GAS                            EKAM OIL INC                              8166 FOOTHILL BLVD,                             RANCHO CUCAMONGA, CA  91730-3103","3940 E CALLOWAY DR                              ONTARIO, CA  91761-2636","PER/PRM","","INLAND EMPIRE ESCROW INC 12794 CENTRAL AVE CHINO, CA  91710","7","3615","8166 FOOTHILL BLVD","RANCHO CUCAMONGA","36","91730","3940 E CALLOWAY DR","ONTARIO","91761","CA"
"644202","Active","41 | 0","11/30/2024","DBA: SUPERNATURAL SEAFOOD                            SUPERNATURAL SEAFOOD, INC                             7094 MIRAMAR RD, STE 122,                             SAN DIEGO, CA  92121-2311","","PER","7","HERITAGE ESCROW COMPANY THE 2550 FIFTH AVE  STE 800  SAN DIEGO, CA  92103","9","3710","7094 MIRAMAR RD, STE 122","SAN DIEGO","37","92121","","","",""
"646929","Active","41 | 0","11/30/2024","DBA: N17 THE LANE                            MEZCLA GROUP LLC                              12821 WASHINGTON BLVD UNIT 103,                             CULVER CITY, CA  90066-5541","4664 BEETHOVEN ST                               LOS ANGELES, CA  90066","ORI","7","","4","1914","12821 WASHINGTON BLVD UNIT 103","CULVER CITY","19","90066","4664 BEETHOVEN ST","LOS ANGELES","90066","CA"
"647865","Active","41 | 0","11/30/2024","GOKIGENFAMILY, INC.                             4410 SEPULVEDA BLVD,                             CULVER CITY, CA  90230-4801","","ORI","7","","4","1914","4410 SEPULVEDA BLVD","CULVER CITY","19","90230","","","",""
"648242","Active","20 | 0","11/30/2024","DBA: LA MARKETA                            OROZCOANGUIANO, GONZALO                             2087 N MAIN ST,                             SALINAS, CA  93906","","PER","","INNOVATIVE ESCROW 28212 KELLY JOHNSON PKWY STE 110 VALENCIA, CA  91355","26","2708","2087 N MAIN ST","SALINAS","27","93906","","","",""
"648911","Active","47 | 1","11/30/2024","DBA: HOTEL PARADOX                            PYRAMID SANTA CRUZ MANAGEMENT L.P.                             611 OCEAN ST,                             SANTA CRUZ, CA  95060-4005","30 ROWES WHARF, STE 5300                              BOSTON, MA  02110","PER","7","","26","4402","611 OCEAN ST","SANTA CRUZ","44","95060","30 ROWES WHARF, STE 5300","BOSTON","02110","MA"
"648911","Active","77 | 1","11/30/2024","DBA: HOTEL PARADOX                            PYRAMID SANTA CRUZ MANAGEMENT L.P.                             611 OCEAN ST,                             SANTA CRUZ, CA  95060-4005","30 ROWES WHARF, STE 5300                              BOSTON, MA  02110","PER","7","","26","4402","611 OCEAN ST","SANTA CRUZ","44","95060","30 ROWES WHARF, STE 5300","BOSTON","02110","MA"
"649459","Active","41 | 0","11/30/2024","DBA: CALIFORNIA FISH GRILL                            CALIFORNIA FISH GRILL INVESTMENTS, LLC                             5502 BALBOA AVE,                             SAN DIEGO, CA  92111-2704","4041 MACARTHUR BLVD, STE 250                              NEWPORT BEACH, CA  92660","ORI","7","","10","3710","5502 BALBOA AVE","SAN DIEGO","37","92111","4041 MACARTHUR BLVD, STE 250","NEWPORT BEACH","92660","CA"
"650071","Active","47 | 0","11/30/2024","DBA: KABUKI JAPANESE RESTAURANT                            KBK91 LLC                             2675 E COLORADO BLVD,                             PASADENA, CA  91107-3725","","PER/PRM","","GENESIS CONSULTING INC 3435 WILSHIRE BLVD  STE 1030 LOS ANGELES, CA  90010","2","1943","2675 E COLORADO BLVD","PASADENA","19","91107","","","",""
"650224","Active","02 | 0","06/30/2024","DBA: ROCCA FAMILY VINEYARDS                            ROCCA FAMILY VINEYARDS INC                             129 DEVLIN RD,                             NAPA, CA  94558-6255","","ORI","7","","27","2800","129 DEVLIN RD","NAPA","28","94558","","","",""
"650254","Active","47 | 0","11/30/2024","DBA: KIMPTON HOTEL ENSO                            1800 SUTTER CONCESSIONS LLC                             1800 SUTTER ST,                             SAN FRANCISCO, CA  94115","101 CALIFORNIA ST, STE 980                              SAN FRANCISCO, CA  94111","PER","","CALIFORNIA BUSINESS ESCROW INC 1748 MAIN ST ESCALON, CA  95320-1927","24","3800","1800 SUTTER ST","SAN FRANCISCO","38","94115","101 CALIFORNIA ST, STE 980","SAN FRANCISCO","94111","CA"
"650696","Active","41 | 0","11/30/2024","DBA: SUSHI 2 VIENTOS                            SUSHI 2 VIENTOS                             370 VIA LAS BRISAS, STE 120,                             THOUSAND OAKS, CA  91320-7051","","ORI","7","","12","5607","370 VIA LAS BRISAS, STE 120","THOUSAND OAKS","56","91320","","","",""
"650812","Active","47 | 1","11/30/2024","DBA: LUCKY STRIKE HOLLYWOOD                            AMF BOWLING CENTERS INC                             6801 HOLLYWOOD BLVD, STE 143,                             LOS ANGELES, CA  90028-6138","7313 BELL CREEK RD                              MECHANICSVILLE, VA  23111","PER","7","CALIFORNIA BUSINESS ESCROW INC 1748 MAIN ST ESCALON, CA  95320-1927","4","1933","6801 HOLLYWOOD BLVD, STE 143","LOS ANGELES","19","90028","7313 BELL CREEK RD","MECHANICSVILLE","23111","VA"
"650812","Active","47 | 1","11/30/2024","DBA: LUCKY STRIKE HOLLYWOOD                            AMF BOWLING CENTERS INC                             6801 HOLLYWOOD BLVD, STE 143,                             LOS ANGELES, CA  90028-6138","7313 BELL CREEK RD                              MECHANICSVILLE, VA  23111","PER","7","CALIFORNIA BUSINESS ESCROW INC 1748 MAIN ST ESCALON, CA  95320-1927","4","1933","6801 HOLLYWOOD BLVD, STE 143","LOS ANGELES","19","90028","7313 BELL CREEK RD","MECHANICSVILLE","23111","VA"
"650812","Active","58 | 1","11/30/2024","DBA: LUCKY STRIKE HOLLYWOOD                            AMF BOWLING CENTERS INC                             6801 HOLLYWOOD BLVD, STE 143,                             LOS ANGELES, CA  90028-6138","7313 BELL CREEK RD                              MECHANICSVILLE, VA  23111","PER","7","CALIFORNIA BUSINESS ESCROW INC 1748 MAIN ST ESCALON, CA  95320-1927","4","1933","6801 HOLLYWOOD BLVD, STE 143","LOS ANGELES","19","90028","7313 BELL CREEK RD","MECHANICSVILLE","23111","VA"
"650813","Active","47 | 1","11/30/2024","DBA: LUCKY STRIKE LOS ANGELES                             AMF BOWLING CENTERS INC                             800 W OLYMPIC BLVD, # A250,                             LOS ANGELES, CA  90015-1360","7313 BELL CREEK RD                              MECHANICSVILLE, VA  23111","PER","7","CALIFORNIA BUSINESS ESCROW INC 1748 MAIN ST ESCALON, CA  95320-1927","4","1933","800 W OLYMPIC BLVD, # A250","LOS ANGELES","19","90015","7313 BELL CREEK RD","MECHANICSVILLE","23111","VA"
"650813","Active","47 | 1","11/30/2024","DBA: LUCKY STRIKE LOS ANGELES                             AMF BOWLING CENTERS INC                             800 W OLYMPIC BLVD, # A250,                             LOS ANGELES, CA  90015-1360","7313 BELL CREEK RD                              MECHANICSVILLE, VA  23111","PER","7","CALIFORNIA BUSINESS ESCROW INC 1748 MAIN ST ESCALON, CA  95320-1927","4","1933","800 W OLYMPIC BLVD, # A250","LOS ANGELES","19","90015","7313 BELL CREEK RD","MECHANICSVILLE","23111","VA"
"650813","Active","68 | 1","11/30/2024","DBA: LUCKY STRIKE LOS ANGELES                             AMF BOWLING CENTERS INC                             800 W OLYMPIC BLVD, # A250,                             LOS ANGELES, CA  90015-1360","7313 BELL CREEK RD                              MECHANICSVILLE, VA  23111","PER","7","CALIFORNIA BUSINESS ESCROW INC 1748 MAIN ST ESCALON, CA  95320-1927","4","1933","800 W OLYMPIC BLVD, # A250","LOS ANGELES","19","90015","7313 BELL CREEK RD","MECHANICSVILLE","23111","VA"
"650862","Active","41 | 0","11/30/2024","DBA: MORENA PROVISIONS                            CUTP, LP                             1122 MORENA BLVD,                             SAN DIEGO, CA  92110-3834","421 GRAPE ST                              SAN DIEGO, CA  92101","ORI","7","","10","3710","1122 MORENA BLVD","SAN DIEGO","37","92110","421 GRAPE ST","SAN DIEGO","92101","CA"
"650915","Issued-Temp.","30","04/10/2024","DBA: FINNEYS CRAFTHOUSE & KITCHEN                            FINNEY'S USA OPERATIONS, LLC                             580 VENTURA BLVD ,                             CAMARILLO, CA  93010","32107 LINDERO CANYON RD, #117                              WESTLAKE VILLAGE, CA  91361-4243","PER","5","","12","5608","580 VENTURA BLVD","CAMARILLO","56","93010","32107 LINDERO CANYON RD, #117","WESTLAKE VILLAGE","91361","CA"
"651115","Active","47 | 0","11/30/2024","DBA: TOAST CAFE & GRILL                            AJ'S CAFÉ INC                             1411 BIRD AVE,                             SAN JOSE, CA  95125-1855","","PER/PRM","7","ABC ESCROW 2222 DAMON STREET  LOS ANGELES, CA  90021","25","4313","1411 BIRD AVE","SAN JOSE","43","95125","","","",""
"651144","Active","41 | 0","11/30/2024","DBA: SUGAR TACO                            SUGAR TACO, LLC                              7257 MELROSE AVE,                             LOS ANGELES, CA  90046-7635","","ORI","7","","4","1933","7257 MELROSE AVE","LOS ANGELES","19","90046","","","",""
"651168","Active","47 | 1","11/30/2024","DBA: AUGUST HALL & FIFTH ARROW                            AH & GLCC LLC                             420 & 430 MASON ST,                             SAN FRANCISCO, CA  94102-1706","420 MASON ST                              SAN FRANCISCO, CA  94102-1706","PER","7","","24","3800","420 & 430 MASON ST","SAN FRANCISCO","38","94102","420 MASON ST","SAN FRANCISCO","94102","CA"
"651168","Active","47 | 1","11/30/2024","DBA: AUGUST HALL & FIFTH ARROW                            AH & GLCC LLC                             420 & 430 MASON ST,                             SAN FRANCISCO, CA  94102-1706","420 MASON ST                              SAN FRANCISCO, CA  94102-1706","PER","7","","24","3800","420 & 430 MASON ST","SAN FRANCISCO","38","94102","420 MASON ST","SAN FRANCISCO","94102","CA"
"651168","Active","58 | 1","11/30/2024","DBA: AUGUST HALL & FIFTH ARROW                            AH & GLCC LLC                             420 & 430 MASON ST,                             SAN FRANCISCO, CA  94102-1706","420 MASON ST                              SAN FRANCISCO, CA  94102-1706","PER","7","","24","3800","420 & 430 MASON ST","SAN FRANCISCO","38","94102","420 MASON ST","SAN FRANCISCO","94102","CA"
"651330","Active","47 | 0","11/30/2024","DBA: MIKAMI SUSHI                            OCEANIC MIKAMI LLC                             7325 CLAIREMONT MESA BLVD,                             SAN DIEGO, CA  92111","9685 VIA EXCELENICA , STE 208                              SAN DIEGO, CA  92111","PER/PRM","7","","10","3710","7325 CLAIREMONT MESA BLVD","SAN DIEGO","37","92111","9685 VIA EXCELENICA , STE 208","SAN DIEGO","92111","CA"
"651361","Active","41 | 0","11/30/2024","DBA: TAQUERIA LOS PERICOS                            GARCIA MATA, LEONEL                             380 N HIGHWAY 65,                             LINDSAY, CA  93247-2700","PO BOX 125                              DUCOR, CA  93218-0125","ORI","","","21","5403","380 N HIGHWAY 65","LINDSAY","54","93247","PO BOX 125","DUCOR","93218","CA"
"651442","Active","21 | 0","11/30/2024","SINGH, RANJODH                             7528 S FIGUEROA ST,                             LOS ANGELES, CA  90003-1737","1985 FIRESTONE BLVD                              LOS ANGELES, CA  90001-4155","PER","","UNITY ESCROW INC 3600 WILSHIRE BLVD STE 900 LOS ANGELES, CA  90010-2613","4","1933","7528 S FIGUEROA ST","LOS ANGELES","19","90003","1985 FIRESTONE BLVD","LOS ANGELES","90001","CA"
"651471","Active","17 | 1","11/30/2024","DBA: LIEU-DIT WINE & SPIRITS                            MERCANTILE & CO. LLC                             3721 ATLAS AVE,                             OAKLAND, CA  94619-1547","","ORI","7","","22","0109","3721 ATLAS AVE","OAKLAND","01","94619","","","",""
"651471","Active","18 | 1","11/30/2024","DBA: LIEU-DIT WINE & SPIRITS                            MERCANTILE & CO. LLC                             3721 ATLAS AVE,                             OAKLAND, CA  94619-1547","","ORI","7","","22","0109","3721 ATLAS AVE","OAKLAND","01","94619","","","",""
"651471","Active","20 | 0","11/30/2024","DBA: LIEU-DIT WINE & SPIRITS                            MERCANTILE & CO. LLC                             3721 ATLAS AVE,                             OAKLAND, CA  94619-1547","","ORI","7,I","","22","0109","3721 ATLAS AVE","OAKLAND","01","94619","","","",""
"651471","Active","09 | 1","11/30/2024","DBA: LIEU-DIT WINE & SPIRITS                            MERCANTILE & CO. LLC                             3721 ATLAS AVE,                             OAKLAND, CA  94619-1547","","ORI","7","","22","0109","3721 ATLAS AVE","OAKLAND","01","94619","","","",""
"651471","Active","12 | 1","11/30/2024","DBA: LIEU-DIT WINE & SPIRITS                            MERCANTILE & CO. LLC                             3721 ATLAS AVE,                             OAKLAND, CA  94619-1547","","ORI","7","","22","0109","3721 ATLAS AVE","OAKLAND","01","94619","","","",""
"651479","Active","21 | 0","11/30/2024","DBA: SAM'S CABLE CAR LOUNGE                            SIRHED GALLERY MARKET LLC                              222 POWELL ST,                             SAN FRANCISCO, CA  94102-2206","PO BOX 626                              BURLINGAME, CA  94011","PER","7","","24","3800","222 POWELL ST","SAN FRANCISCO","38","94102","PO BOX 626","BURLINGAME","94011","CA"
"651479","Active","48 | 0","11/30/2024","DBA: SAM'S CABLE CAR LOUNGE                            SIRHED GALLERY MARKET LLC                              222 POWELL ST,                             SAN FRANCISCO, CA  94102-2206","PO BOX 626                              BURLINGAME, CA  94011","PER","7","","24","3800","222 POWELL ST","SAN FRANCISCO","38","94102","PO BOX 626","BURLINGAME","94011","CA"
"651479","Active","48 | 0","11/30/2024","DBA: SAM'S CABLE CAR LOUNGE                            SIRHED GALLERY MARKET LLC                              222 POWELL ST,                             SAN FRANCISCO, CA  94102-2206","PO BOX 626                              BURLINGAME, CA  94011","PER","7","","24","3800","222 POWELL ST","SAN FRANCISCO","38","94102","PO BOX 626","BURLINGAME","94011","CA"
"652196","Active","47 | 0","11/30/2024","DBA: ZAIKA INDIAN BISTRO BAR                            ZAIKA INDIAN BISTRO BAR                             893 LIFESTYLE ST,                             MANTECA, CA  95337","","PER/PRM","","CALIFORNIA BUSINESS ESCROW, INC 1748 MAIN ST  ESCALON, CA  95320","29","3903","893 LIFESTYLE ST","MANTECA","39","95337","","","",""
"653183","Active","20 | 0","06/30/2024","DBA: 7 ELEVEN 29243F                            7 ELEVEN INC                             848 E EVELYN AVE,                             SUNNYVALE, CA  94086-6528","PO BOX 139044                              DALLAS, TX  75313-9044","PER","7","7 ELEVEN INC PO BOX 139044 ATTN: LICENSING DEPARTMENT DALLAS, TX  75313-9044","25","4316","848 E EVELYN AVE","SUNNYVALE","43","94086","PO BOX 139044","DALLAS","75313","TX"
"653281","Active","41 | 0","11/30/2024","DBA: BROOKLYN BOYZ PIZZA                            HANGIN IN THERE                             2183 VISTA WAY, STE B8,                             OCEANSIDE, CA  92054-5681","1313 SIMPSON WAY C                              ESCONDIDO, CA  92029","PER","7","ALLISON MCCLOSKEY ESCROW COMPANY 4820 EL CAJON BLVD SAN DIEGO, CA  92115-4695","9","3709","2183 VISTA WAY, STE B8","OCEANSIDE","37","92054","1313 SIMPSON WAY C","ESCONDIDO","92029","CA"
"653414","Active","20 | 0","10/31/2024","DBA: LA ESTRELLA MARKET                            LA ESTRELLA MARKET A&T CORP                              1615 E FLORENCE AVE,                             LOS ANGELES, CA  90001-2521","","FID","8","","4","1900","1615 E FLORENCE AVE","LOS ANGELES","19","90001","","","",""
"653467","Active","48 | 1","11/30/2024","DBA: NEW H LOUNGE THE                            ELLIS, TREVOR JULIUS                             472 BENICIA RD,                             VALLEJO, CA  94590-7131","472 BENICIA RD                              VALLEJO, CA  94590-7131","PER","7","OLD REPUBLIC TITLE 1000 BURNETT AVE STE 400 CONCORD, CA  94520-2088","22","4800","472 BENICIA RD","VALLEJO","48","94590","472 BENICIA RD","VALLEJO","94590","CA"
"653467","Active","58 | 1","11/30/2024","DBA: NEW H LOUNGE THE                            ELLIS, TREVOR JULIUS                             472 BENICIA RD,                             VALLEJO, CA  94590-7131","472 BENICIA RD                              VALLEJO, CA  94590-7131","PER","7","OLD REPUBLIC TITLE 1000 BURNETT AVE STE 400 CONCORD, CA  94520-2088","22","4800","472 BENICIA RD","VALLEJO","48","94590","472 BENICIA RD","VALLEJO","94590","CA"
"653507","Active","41 | 0","11/30/2024","DBA: TAYLORS SMOKEHOUSE                            ROLLIN MAC SHACK LLC                             421 MAZE BLVD,                             MODESTO, CA  95351-2650","","ORI","7","","29","5002","421 MAZE BLVD","MODESTO","50","95351","","","",""
"653644","Active","41 | 0","11/30/2024","DBA: KING COLE PIZZA                            YEOGANE ENTERPRISE, INC.                             612 S LORENA ST,                             LOS ANGELES, CA  90023-1644","","PER","","HANA ESCROW COMPANY INC 3580 WILSHIRE BLVD STE 1170 LOS ANGELES, CA  90010","4","1933","612 S LORENA ST","LOS ANGELES","19","90023","","","",""
"653706","Issued-Temp.","30","04/10/2024","DBA: MR LIQUOR PINOLE                            MR LIQUOR PINOLE INC                             1007 SAN PABLO AVE,                             PINOLE, CA  94564-2339","","PER","","BUSINESS & COMMERICAL SERVICE CENTER 3031 TISCH WY STE 310 SAN JOSE, CA  95128","22","0707","1007 SAN PABLO AVE","PINOLE","07","94564","","","",""
"653763","Active","21 | 0","11/30/2024","DBA: NEW STAR ELL                            FIVE ZERO ONE GROCERIES INC                             501 DIVISADERO ST,                             SAN FRANCISCO, CA  94117","2400 HOMER LN                              HAYWARD, CA  94545-4780","PER","7","OLD REPUBLIC TITLE COMPANY 1000 BURNETT AVE STE 400 CONCORD, CA  94520-2088","24","3800","501 DIVISADERO ST","SAN FRANCISCO","38","94117","2400 HOMER LN","HAYWARD","94545","CA"
"653797","Active","20 | 0","11/30/2024","DBA: LA PERLA MARKET CARNICERIA & TAQUERIA                            PARADISE LAST DROP LIQUOR INC                             871 E FLORIDA AVE,                             HEMET, CA  92543","6988 CANTERA WY                              FONTANA, CA  92336","PER","","TEAM ESCROW BP INC 6025 BEACH BLVD BUENA PARK, CA  90621-2304","7","3308","871 E FLORIDA AVE","HEMET","33","92543","6988 CANTERA WY","FONTANA","92336","CA"
"653807","Active","21 | 0","11/30/2024","DBA: VALLEY CENTER FOOD                            VALLEY CENTER MARKET LIQUOR INC                             27537 VALLEY CENTER RD,                             VALLEY CENTER, CA  92082","14109 CALLE DE VISTA                              VALLEY CENTER, CA  92082","PER","","AFFILIATE ESCROW 3914 MURPHY CANYON RD STE A144 SAN DIEGO, CA  92123","9","3700","27537 VALLEY CENTER RD","VALLEY CENTER","37","92082","14109 CALLE DE VISTA","VALLEY CENTER","92082","CA"
"653985","Active","20 | 0","11/30/2024","DBA: PARI MART GAS                            CALAVERAS PETROLEUM                             141 ST CHARLES ST,                             SAN ANDREAS, CA  95249","","PER","","BUSINESS & ESCROW SERVICE CENTER INC 3031 TISCH WAY 310 SAN JOSE, CA  95128","29","0500","141 ST CHARLES ST","SAN ANDREAS","05","95249","","","",""
"654125","Active","47 | 0","11/30/2024","DBA: O'CONNORS IRISH PUB                            OM MAYA PUB INC                             4130-34 PARAMOUNT BLVD,                             LAKEWOOD, CA  90712-3914","1112 AGNES PL                              CERRITOS, CA  90703","PER","7","R ESCROW 1205 E CHAPMAN AVE ORANGE, CA  92866","3","1929","4130-34 PARAMOUNT BLVD","LAKEWOOD","19","90712","1112 AGNES PL","CERRITOS","90703","CA"
"654175","Active","41 | 0","11/30/2024","DBA: I'APPART                            MELINAS CAFÉ LLC                             541 S SPRING ST, #112-113,                             LOS ANGELES, CA  90013-2305","541 S SPRING ST, #112-113                              LOS ANGELES, CA  90013-2305","PER","7","","4","1933","541 S SPRING ST, #112-113","LOS ANGELES","19","90013","541 S SPRING ST, #112-113","LOS ANGELES","90013","CA"
"654248","Issued-Temp.","30","04/12/2024","DBA: CIRCLE K                             LWS HIGHLAND GAS INC.                              2232 N VALENCIA AVE,                             SAN BERNARDINO, CA  92404","","PER","","STEWART TITLE GUARANTY COMPANY 1200 CALIFORNIA ST #140 REDLANDS, CA  92374","7","3610","2232 N VALENCIA AVE","SAN BERNARDINO","36","92404","","","",""
"654301","Active","41 | 0","11/30/2024","DBA: NORTHTOWN COFFEE                            ELVENSTAR EMPIRE LLC                             1603 G ST,                             ARCATA, CA  95521-5648","","ORI","7","","28","1201","1603 G ST","ARCATA","12","95521","","","",""
"654718","Issued-Temp.","30","04/10/2024","DBA: 7 ELEVEN #38969A                            7 ELEVEN INC                             4202 E KINGS CANYON RD,                             FRESNO, CA  93702-3602","PO BOX 219088, ATT: 7 ELEVEN LICENSING                              DALLAS , TX  75221-9088","PER","7","CALIFORNIA BUSINESS ESCROW INC 1748 MAIN ST ESCALON, CA  95320-1927","21","1005","4202 E KINGS CANYON RD","FRESNO","10","93702","PO BOX 219088, ATT: 7 ELEVEN LICENSING","DALLAS","75221","TX"
"655126","Issued-Temp.","30","04/10/2024","DBA: TANG JIP                            OH PAK, INC.                             1679 WILLOW PASS RD,                             CONCORD, CA  94519-2611","","PER","","HANA ESCROW COMPANY INC 6281 BEACH BLVD #333 BUENA PARK, CA  90621","22","0703","1679 WILLOW PASS RD","CONCORD","07","94519","","","",""
