"653752","PEND ACTIVE","41 | 0","12/12/2023","11/30/2024","DBA: MAMA CHO'S BBQ                        CHO BROS, INC.                          18911 LAKE CHABOT RD,                         CASTRO VALLEY, CA  94546-2931","","41-568952","7","","22","0100","18911 LAKE CHABOT RD","CASTRO VALLEY","01","94546","","","",""
"653770","PEND ACTIVE","41 | 0","12/11/2023","11/30/2024","DBA: WHITE PALACE                        WHITE PALACE INC                         15351 BROOKHURST ST, STE 101-107,                         WESTMINSTER, CA  92683","","41-283687","7","APEX ESCROW 15440 BEACH BLVD STE 131 WESTMINSTER, CA  92683-6240","11","3021","15351 BROOKHURST ST, STE 101-107","WESTMINSTER","30","92683","","","",""
"653776","PEND ACTIVE","20 | 0","12/11/2023","06/30/2024","DBA: 7 ELEVEN 16346F                        7 ELEVEN INC                         602 LAUREL ST,                         SANTA CRUZ, CA  95060","PO BOX 139044                              DALLAS, TX  75313-9044","20-214928","","7-ELEVEN INC PO BOX 139044 ATTEN: LICENSING DEPARTMENT DALLAS, TX  75313-9044","26","4402","602 LAUREL ST","SANTA CRUZ","44","95060","PO BOX 139044","DALLAS","75313","TX"
"653813","PEND ACTIVE","02 | 0","12/12/2023","06/30/2024","ARH ENTERPRISES LLC                         810 FOOTHILL BLVD,                         CALISTOGA, CA  94515-9665","PO BOX 754                              OCEAN SHORES, WA  98569","","7","","27","2801","810 FOOTHILL BLVD","CALISTOGA","28","94515","PO BOX 754","OCEAN SHORES","98569","WA"
"653842","PEND ACTIVE","48 | 0","12/11/2023","11/30/2024","DBA: HOLD FAST LOUNGE                        JENSEN, LINDA MARY                         529 SEABRIGHT AVE,                         SANTA CRUZ, CA  95062-3451","3210 CHURNSIDE LN                              SANTA CRUZ, CA  95062","48-521320","7","BUSINESS & ESCROW SERVICE CENTER 3031 TISCH WAY STE 310 SAN JOSE, CA  95128","26","4402","529 SEABRIGHT AVE","SANTA CRUZ","44","95062","3210 CHURNSIDE LN","SANTA CRUZ","95062","CA"
"653935","PEND ACTIVE","20 | 0","12/11/2023","11/30/2024","DBA: COALINGA ISLAND                        AHMED, MUSAID KAID                         600 E ELM AVE,                         COALINGA, CA  93210-1515","","20-436791","","TICOR TITLE 10000 STOCKDALE HWY #101 BAKERSFIELD, CA  93311","21","1002","600 E ELM AVE","COALINGA","10","93210","","","",""
"653950","PEND ACTIVE","21 | 0","12/12/2023","11/30/2024","DBA: MJ 11 MARKET                        SINGH, KULJINDER                         3464 MYERS ST,                         OROVILLE, CA  95966","","21-621900","7","FIRST AMERICAN TITLE COMPANY 415 CENTURY PARK DR. YUBA CITY, CA  95991","31","0400","3464 MYERS ST","OROVILLE","04","95966","","","",""
"653962","PEND WITHDRAWN","21 | 0","","","DBA: KWIK SERV                        NY KHANS LLC                         1675 N BEALE RD,                         MARYSVILLE, CA  95901-6925","","351809","7","BUSINESS & ESCROW SERVICE CENTER 3031 TISCH WAY 310 SAN JOSE, CA  95128","23","5800","1675 N BEALE RD","MARYSVILLE","58","95901","","","",""
"653994","PEND ACTIVE","41 | 0","12/11/2023","11/30/2024","DBA: TAQUERIA TECOMAN                        TAQUERIA TECOMAN LLC                         2003 EICH RD,                         EUREKA, CA  95503-6909","","","","","28","1200","2003 EICH RD","EUREKA","12","95503","","","",""
"654002","PEND ACTIVE","17 | 1","12/11/2023","11/30/2024","DBA: PROSPECTOR IMPORTS INC                        PROSPECTOR IMPORTS INC                         3309 E MIRALOMA AVE, STE 105,                         ANAHEIM, CA  92806-1942","","","","","11","3001","3309 E MIRALOMA AVE, STE 105","ANAHEIM","30","92806","","","",""
"654002","PEND ACTIVE","18 | 1","12/11/2023","11/30/2024","DBA: PROSPECTOR IMPORTS INC                        PROSPECTOR IMPORTS INC                         3309 E MIRALOMA AVE, STE 105,                         ANAHEIM, CA  92806-1942","","","","","11","3001","3309 E MIRALOMA AVE, STE 105","ANAHEIM","30","92806","","","",""
"654002","PEND ACTIVE","09 | 1","12/11/2023","11/30/2024","DBA: PROSPECTOR IMPORTS INC                        PROSPECTOR IMPORTS INC                         3309 E MIRALOMA AVE, STE 105,                         ANAHEIM, CA  92806-1942","","","","","11","3001","3309 E MIRALOMA AVE, STE 105","ANAHEIM","30","92806","","","",""
"654002","PEND ACTIVE","12 | 1","12/11/2023","11/30/2024","DBA: PROSPECTOR IMPORTS INC                        PROSPECTOR IMPORTS INC                         3309 E MIRALOMA AVE, STE 105,                         ANAHEIM, CA  92806-1942","","","","","11","3001","3309 E MIRALOMA AVE, STE 105","ANAHEIM","30","92806","","","",""
"654077","PEND ACTIVE","85 | 0","12/12/2023","11/30/2024","DBA: STEF'S WINES                        SALT, STEFANI MILLER                         1040A GARDENA RD,                         ENCINITAS, CA  92024-4604","","","7","","9","3718","1040A GARDENA RD","ENCINITAS","37","92024","","","",""
"654078","PEND ACTIVE","17 | 1","12/11/2023","11/30/2024","DBA: INDEPENDENCE WINE MARKETING                        INDEPENDENCE WINE MARKETING LLC                         3 SHARI CT,                         NOVATO, CA  94947-4920","","","7","","27","2110","3 SHARI CT","NOVATO","21","94947","","","",""
"654078","PEND ACTIVE","09 | 1","12/11/2023","11/30/2024","DBA: INDEPENDENCE WINE MARKETING                        INDEPENDENCE WINE MARKETING LLC                         3 SHARI CT,                         NOVATO, CA  94947-4920","","","7","","27","2110","3 SHARI CT","NOVATO","21","94947","","","",""
"654145","PEND ACTIVE","41 | 0","12/12/2023","11/30/2024","TENG WEI INC                         400 EAST F ST,                         OAKDALE, CA  95361-4064","","41-460593","","JOHN KHOO ATTORNEY AT LAW 3000 T ST STE 104 SACRAMENTO, CA  95816","29","5004","400 EAST F ST","OAKDALE","50","95361","","","",""
"654157","PEND ACTIVE","41 | 0","12/11/2023","11/30/2024","DBA: NEW YORK PIZZA AND GRILL                        HANJRAH BROTHER LLC                         1401 W EL MONTE WAY, STE 106,                         DINUBA, CA  93618-9165","1758 ASA GRAY WAY                              DINUBA, CA  93618","41-614294","","TICOR TITLE COMPANY 10000 STOCKDALE HWY STE 101 BAKERSFIELD, CA  93311","21","5401","1401 W EL MONTE WAY, STE 106","DINUBA","54","93618","1758 ASA GRAY WAY","DINUBA","93618","CA"
"654233","PEND ACTIVE","41 | 0","12/12/2023","11/30/2024","DBA: BIEN HEN SEAFOOD AND LAU                        3 OCEANS RESTAURANT LLC                         14092 MAGNOLIA ST, STE 121-122,                         WESTMINSTER, CA  92683-4765","","41-584958","7","APEX ESCROW 15440 BEACH BLVD STE 131 WESTMINSTER, CA  92683-6240","11","3021","14092 MAGNOLIA ST, STE 121-122","WESTMINSTER","30","92683","","","",""
"655013","PEND ACTIVE","79 | 0","12/11/2023","06/30/2024","DBA: SCENIC VALLEY RANCH LLC DBA BORREGO SPRINGS CFM                        SCENIC VALLEY RANCH LLC                         CHRISTMAS CIRCLE & PALM CANYON DR,                         BORREGO SPRINGS, CA  92004","27012 SCENIC VALLEY RD                              RAMONA, CA  92065-6785","","","","9","3700","CHRISTMAS CIRCLE & PALM CANYON DR","BORREGO SPRINGS","37","92004","27012 SCENIC VALLEY RD","RAMONA","92065","CA"
"655045","PEND ACTIVE","28 | 0","12/12/2023","06/30/2024","HIGHLANDS IMPORTERS LLC                         25544 E BYERS DRIVE,                         AURORA, CO  80018","PO BOX 54937                              LOS ANGELES, CA  90054","","","","75","9999","25544 E BYERS DRIVE","AURORA","","80018","PO BOX 54937","LOS ANGELES","90054","CA"