"License Number","Status Changed From/To","Type| Dup","Original Issue Date","Expir. Date","Primary Owner and Premises Addr.","Mailing Addr.","Transfer-From/To","Conditions","Escrow","District Code","Geo Code","Prem Street","City","County","Zip Code","Mailing Street","Mailing City","Mailing Zip Code","Mailing State"
"572786","ACTIVE CANCEL","02 | 0","02/01/2018","06/30/2023","DBA: HECKA GOODS LLC                        HECKA GOODS LLC                         3950 BRICKWAY BLVD,                         SANTA ROSA, CA  95403-1070","3950 BRICKWAY BLVD                              SANTA ROSA, CA  95403-1070","","","","27","4900","3950 BRICKWAY BLVD","SANTA ROSA","49","95403","3950 BRICKWAY BLVD","SANTA ROSA","95403","CA"
"588715","ACTIVE CANCEL","02 | 0","02/01/2018","06/30/2023","DBA: GRAVEL PIT WINES                        HECKA GOODS LLC                         3358 COFFEY LN, STE D,                         SANTA ROSA, CA  95403-7416","3950 BRICKWAY BLVD                              SANTA ROSA, CA  95403-1070","","","","27","4904","3358 COFFEY LN, STE D","SANTA ROSA","49","95403","3950 BRICKWAY BLVD","SANTA ROSA","95403","CA"
"591140","ACTIVE SUREND","47 | 0","07/09/2018","06/30/2024","DBA: GRACIAS MADRE                        GRACIAS MADRE, LLC                         2211 MISSION ST,                         SAN FRANCISCO, CA  94110-1811","","47-506398","7","CALIFORNIA BUSINESS ESCROW INC 1748 MAIN ST ESCALON, CA  95320-1927","24","3800","2211 MISSION ST","SAN FRANCISCO","38","94110","","","",""
"610225","ACTIVE SUREND","47 | 1","11/19/2020","10/31/2023","DBA: MADE BY MEG                        MEG METTLE & MOXIE INC                         234 S PACIFIC COAST HWY STE 101,                         REDONDO BEACH, CA  90277-3394","234 S PACIFIC COAST HWY STE 101                              REDONDO BEACH, CA  90277-3394","48-581965/ 47-647476, 47-647475","2,7","ABC ESCROW COMPANY 2222 DAMON STREET LOS ANGELES, CA  90021","3","1946","234 S PACIFIC COAST HWY STE 101","REDONDO BEACH","19","90277","234 S PACIFIC COAST HWY STE 101","REDONDO BEACH","90277","CA"
"610225","ACTIVE SUREND","58 | 1","11/19/2020","10/31/2023","DBA: MADE BY MEG                        MEG METTLE & MOXIE INC                         234 S PACIFIC COAST HWY STE 101,                         REDONDO BEACH, CA  90277-3394","234 S PACIFIC COAST HWY STE 101                              REDONDO BEACH, CA  90277-3394","48-581965/ 47-647476, 47-647475","2,7","ABC ESCROW COMPANY 2222 DAMON STREET LOS ANGELES, CA  90021","3","1946","234 S PACIFIC COAST HWY STE 101","REDONDO BEACH","19","90277","234 S PACIFIC COAST HWY STE 101","REDONDO BEACH","90277","CA"
"613563","ACTIVE CANCEL","41 | 0","02/19/2020","01/31/2024","DBA: GOURMET 88                        GOURMET 88 MANAGEMENT INC                         230 N SAN FERNANDO BLVD,                         BURBANK, CA  91502-1209","","","7","","5","1910","230 N SAN FERNANDO BLVD","BURBANK","19","91502","","","",""