"License Number","Status Changed From/To","Type| Dup","Original Issue Date","Expir. Date","Primary Owner and Premises Addr.","Mailing Addr.","Transfer-From/To","Conditions","Escrow","District Code","Geo Code","Prem Street","City","County","Zip Code","Mailing Street","Mailing City","Mailing Zip Code","Mailing State"
"219818","CANCEL ACTIVE","41 | 0","07/21/1988","08/31/2024","DBA: SUEHIRO CAFE                        SUEHIRO CAFE INC                         337 E 1ST ST,                         LOS ANGELES, CA  90012","400 S MAIN ST                              LOS ANGELES, CA  90013-1314","","7","","4","1933","337 E 1ST ST","LOS ANGELES","19","90012","400 S MAIN ST","LOS ANGELES","90013","CA"
"310401","ACTIVE CANCEL","20 | 0","10/20/1995","10/31/2023","DBA: MITCHELLS BURGER BOX & C MART                        MEZA, ALFREDO T                         81201 INDIO BLVD,                         INDIO, CA  92201","","20-274180","7","","8","3309","81201 INDIO BLVD","INDIO","33","92201","","","",""
"596019","ACTIVE CANCEL","17 | 0","09/28/2018","08/31/2023","DBA: ELEGANT WINES                        ELEGANT WINES, LLC                         40410 ARROYO SECO RD, BLDG E RM 3,                         SOLEDAD, CA  93960-9615","40410 ARROYO SECO RD                              SOLEDAD, CA  93960-9615","","","","26","2700","40410 ARROYO SECO RD, BLDG E RM 3","SOLEDAD","27","93960","40410 ARROYO SECO RD","SOLEDAD","93960","CA"
"612057","ACTIVE CANCEL","58 | 1","12/16/2019","11/30/2023","DBA: PASTRY SWAN BAKERY & CATERING, THE                        ALTITUDE ADJUSTMENT LLC                         70225 HIGHWAY 111, STE A,                         RANCHO MIRAGE, CA  92270-2997","","","","","8","3317","70225 HIGHWAY 111, STE A","RANCHO MIRAGE","33","92270","","","",""
"612057","ACTIVE CANCEL","41 | 1","12/16/2019","11/30/2023","DBA: PASTRY SWAN BAKERY & CATERING, THE                        ALTITUDE ADJUSTMENT LLC                         70225 HIGHWAY 111, STE A,                         RANCHO MIRAGE, CA  92270-2997","","","","","8","3317","70225 HIGHWAY 111, STE A","RANCHO MIRAGE","33","92270","","","",""