"646320","PEND ACTIVE","41 | 0","05/09/2023","04/30/2024","DBA: NA                        MARTINEZ CHAVEZ, RITA EMILIA                         10624 MERRITT ST,                         CASTROVILLE, CA  95012-3313","1318 MANZANO WY                              SALINAS, CA  93905","","","","26","2700","10624 MERRITT ST","CASTROVILLE","27","95012","1318 MANZANO WY","SALINAS","93905","CA"
"646412","PEND ACTIVE","20 | 0","05/08/2023","04/30/2024","DBA: ARCO 7188                        BP PRODUCTS NORTH AMERICA INC.                         2610 CONTRA LOMA BLVD,                         ANTIOCH, CA  94509-4227","2600 JAMES THORNTON WAY                              LOUISVILLE, KY  40245","20-590027","","CALIFORNIA BUSINESS ESCROW INC 1748 MAIN STREET ESCALON, CA  95320","22","0701","2610 CONTRA LOMA BLVD","ANTIOCH","07","94509","2600 JAMES THORNTON WAY","LOUISVILLE","40245","KY"
"646420","PEND ACTIVE","41 | 0","05/09/2023","04/30/2024","DBA: THE NOODLE SHOP                        HUNAN MAO'S RESTAURANT INC                         164 W 25TH AVE,                         SAN MATEO, CA  94403-2208","","41-581551","","BUSINESS & ESCROW SERVICE CENTER 3031 TISCH WAY 310 SAN JOSE, CA  95128","25","4113","164 W 25TH AVE","SAN MATEO","41","94403","","","",""
"646492","PEND ACTIVE","41 | 0","05/09/2023","04/30/2024","DBA: TEN RAKU                        RM 4177W, LLC                         4177 W 3RD ST,                         LOS ANGELES, CA  90020-3577","440 S OCCIDENTAL BLVD, UNIT 403                              LOS ANGELES, CA  90057","41-579648","7","HANA ESCROW 3580 WILSHIRE BLVD STE 1170 LOS ANGELES, CA  90010","4","1933","4177 W 3RD ST","LOS ANGELES","19","90020","440 S OCCIDENTAL BLVD, UNIT 403","LOS ANGELES","90057","CA"
"646554","PEND ACTIVE","41 | 0","05/08/2023","05/31/2024","DBA: CHUY'S FIESTAS TAQUERIA                         CHUY'S FIESTAS TAQUERIA INC                         710 POST ST,                         SAN FRANCISCO, CA  94109-6106","","41-637406","7","","24","3800","710 POST ST","SAN FRANCISCO","38","94109","","","",""
"646558","PEND ACTIVE","41 | 0","05/09/2023","04/30/2024","DBA: EASTSIDE DELI                        TRUCKEE RIVER RV INC.                         10068 HIRSCHDALE RD,                         TRUCKEE, CA  96161-4500","","","7","","23","2900","10068 HIRSCHDALE RD","TRUCKEE","29","96161","","","",""
"646575","PEND ACTIVE","41 | 0","05/09/2023","04/30/2024","DBA: DEUCES MARKET                        PENNINGTON PROVISIONS LLC                         1300 1STST, STE 222,                         NAPA, CA  94559-2950","","","","","27","2802","1300 1STST, STE 222","NAPA","28","94559","","","",""
"646604","PEND ACTIVE","02 | 0","05/08/2023","06/30/2024","NAKEDWINES.COM, INC.                         135 GASSER DR, STE A & C,                         NAPA, CA  94558-4051","PO BOX 2760                              NAPA, CA  94558-0275","","","","27","2802","135 GASSER DR, STE A & C","NAPA","28","94558","PO BOX 2760","NAPA","94558","CA"
"646629","PEND ACTIVE","20 | 0","05/09/2023","04/30/2024","DBA: SNAPPY FOOD                        NEES & GOLDEN INVESTMENT CORPORATION                         525 W NEES AVE,                         FRESNO, CA  93711-6275","","20-517287","","LENNAR TITLE, INC.  7555 N PALM AVENUE SUITE 210 FRESNO, CA  93711","21","1005","525 W NEES AVE","FRESNO","10","93711","","","",""
"646639","PEND ACTIVE","47 | 0","05/09/2023","06/30/2024","DBA: GORDITOS MEXICAN RESTAURANT                        ROMO, OTILIA BERUMEN                         1025 OLIVER RD,                         FAIRFIELD, CA  94534","","47-195136","","","22","4803","1025 OLIVER RD","FAIRFIELD","48","94534","","","",""
"646640","PEND ACTIVE","41 | 0","05/09/2023","04/30/2024","DBA: MARY'S PIZZA SHACK                        OLD WINERY RESTAURANT GROUP                         9010 BROOKS RD S,                         WINDSOR, CA  95492-7811","1406 OLD WINERY CT                              SONOMA, CA  95476","41-282401","","GREEN ESCROW SERVICE INC 2010 CROW CANYON PLACE STE 212 SAN RAMON, CA  94583","27","4909","9010 BROOKS RD S","WINDSOR","49","95492","1406 OLD WINERY CT","SONOMA","95476","CA"
"646645","PEND ACTIVE","47 | 0","05/09/2023","04/30/2024","DBA: BREAKFAST CLUB                        BREAKFAST CLUB MORGAN HILL LLC                         775 E DUNNE AVE,                         MORGAN HILL, CA  95037-4666","","47-595792","7","BUSINESS ESCROW SERVICE CENTER 3031 TISCH WAY STE 310 SAN JOSE, CA  95128","25","4310","775 E DUNNE AVE","MORGAN HILL","43","95037","","","",""
"646768","PEND ACTIVE","21 | 0","05/09/2023","04/30/2024","DBA: GOOD RIDDANCE                        47RONIN LLC                         1709 LINCOLN BLVD,                         VENICE, CA  90291-3907","","21-569352","7","TOWER ESCROW INC 3400 W OLYMPIC BLD STE 201 LOS ANGELES, CA  90019","3","1933","1709 LINCOLN BLVD","VENICE","19","90291","","","",""
"646795","PEND ACTIVE","41 | 0","05/09/2023","04/30/2024","DBA: JARDIN AUTENTICA COCINA                        JARDIN OC INC                         331 N TUSTIN ST,                         ORANGE, CA  92867-7720","","41-565384","7","","11","3014","331 N TUSTIN ST","ORANGE","30","92867","","","",""
"646862","PEND ACTIVE","42 | 0","05/09/2023","04/30/2024","DBA: SIERRA BILLIARDS                        SIERRA BILLIARDS, INC.                         6460 N BLACKSTONE AVE, STE 114,                         FRESNO, CA  93710-3513","7316 N BABIGAN AVE                              FRESNO, CA  93722-3495","","","","21","1005","6460 N BLACKSTONE AVE, STE 114","FRESNO","10","93710","7316 N BABIGAN AVE","FRESNO","93722","CA"
"646869","PEND ACTIVE","20 | 0","05/09/2023","04/30/2024","DBA: THE QUARTER                         MORENO VALLEY FUEL GROUP INC.                         12970 DAY ST,                         MORENO VALLEY, CA  92553-7000","4300 EDISON AVE                              CHINO, CA  91710-5411","20-587264","","BREWER CONSULTING, INC 26023 JEFFERSON AVE # D MURRIETA, CA  92562-6984","7","3321","12970 DAY ST","MORENO VALLEY","33","92553","4300 EDISON AVE","CHINO","91710","CA"
"646913","PEND ACTIVE","41 | 0","05/09/2023","04/30/2024","DBA: SIZZLER                        SIZZLER USA RESTAURANTS INC                         2121 W CALDWELL AVE,                         VISALIA, CA  93277","23352 MADERO RD, STE B                              MISSION VIEJO, CA  92691","41-351085","","","21","5406","2121 W CALDWELL AVE","VISALIA","54","93277","23352 MADERO RD, STE B","MISSION VIEJO","92691","CA"
"646980","PEND ACTIVE","41 | 0","05/08/2023","04/30/2024","DBA: Y2 DELI                        HUA & MING LLC                          46560 FREMONT BLVD , STE 101,                         FREMONT, CA  94538","","","","","22","0105","46560 FREMONT BLVD , STE 101","FREMONT","01","94538","","","",""
"647117","PEND ACTIVE","41 | 0","05/09/2023","04/30/2024","DBA: PLATFORM 909                        JKIMS INC                         15870 SOQUEL CANYON PKWY, STE M,                         CHINO HILLS, CA  91709","4334 WILD GINGER CIR                              YORBA LINDA, CA  92886-8403","41-622698","","CENTRAL ESCROW GROUP INC  1675 HANOVER RD  CITY OF INDUSTRY, CA  91748","7","3623","15870 SOQUEL CANYON PKWY, STE M","CHINO HILLS","36","91709","4334 WILD GINGER CIR","YORBA LINDA","92886","CA"
"647154","PEND ACTIVE","41 | 0","05/09/2023","04/30/2024","DBA: SUSHI ADACHI                        ORENO INC.                         668 BARBER LN,                         MILPITAS, CA  95035-7923","","","","","25","4308","668 BARBER LN","MILPITAS","43","95035","","","",""
"647190","PEND ACTIVE","41 | 0","05/09/2023","04/30/2024","DBA: LOS PACOS                        SIDHUBRAR INC                         5872 PACHECO BLVD,                         PACHECO, CA  94553-5614","","","","","22","0700","5872 PACHECO BLVD","PACHECO","07","94553","","","",""
"647220","PEND ACTIVE","41 | 0","05/08/2023","04/30/2024","DBA: OROSI PIZZA HOUSE, INC.                        OROSI PIZZA HOUSE, INC.                         41369 ROAD 128,                         OROSI, CA  93647-2208","","41-399709","","","21","5400","41369 ROAD 128","OROSI","54","93647","","","",""
"647331","PEND WITHDRAWN","47 | 0","","","DBA: HYATT PLACE & HYATT HOUSE SACRAMENTO INTL AIRPORT                        GB COMMERCIAL LLC                         4850 DUCKHORN DR,                         SACRAMENTO, CA  95834","","627415","7","ABC ESCROW 2222 DAMON ST  LOS ANGELES, CA  90021","23","3405","4850 DUCKHORN DR","SACRAMENTO","34","95834","","","",""
"647540","PEND WITHDRAWN","20 | 0","","","DBA: WEST MARKET                         CHARLES' INVESTMENTS AND VENTURES, LLC                          3300 W 8TH ST, STE 117,                         LOS ANGELES, CA  90005-2432","","597613","","UNITED ESCROW 3440 WILSHIRE BLVD STE 600 LOS ANGELES, CA  90010","4","1933","3300 W 8TH ST, STE 117","LOS ANGELES","19","90005","","","",""
"648119","PEND ACTIVE","84 | 0","05/09/2023","04/30/2024","DBA: DYING BREED BREWING @ TURLOCK CERTIFIED FARMERS MARKET                        DYING BREED BREWING LLC                         MAIN STREET, BETWEEN CENTER AND PALM,                         TURLOCK, CA  95380","963 SHEPARD CT , STE B                              OAKDALE, CA  95361","","","","29","5007","MAIN STREET, BETWEEN CENTER AND PALM","TURLOCK","50","95380","963 SHEPARD CT , STE B","OAKDALE","95361","CA"
"648244","PEND ACTIVE","26 | 0","05/09/2023","06/30/2024","DBA: IMPACT BREWS                        DSWDWK LLC                         4831 SPRING GROVE AVENUE,                         CINCINNATI, OH  45232","","","","","75","9999","4831 SPRING GROVE AVENUE","CINCINNATI","","45232","","","",""
"648286","PEND WITHDRAWN","21 | 0","","","DBA: FREETOWN MARKET                         FREETOWN HOLDINGS COMPANY                         2642 CRENSHAW BLVD,                         LOS ANGELES, CA  90016","","168048","7","WILSHIRE ESCROW CO 4270 WILSHIRE BLVD LOS ANGELES, CA  90010-3636","4","1933","2642 CRENSHAW BLVD","LOS ANGELES","19","90016","","","",""
"648291","PEND WITHDRAWN","21 | 0","","","DBA: SUNRISE MARKET                         LIQUOR INN INC                         15911 HIGHLAND AVE,                         FONTANA, CA  92336","15911 HIGHLAND AVE                              FONTANA, CA  92336","450183","","PRIMA ESCROW INC 3600 WILSHIRE BLVD STE 1028 LOS ANGELES, CA  90010-2614","7","3604","15911 HIGHLAND AVE","FONTANA","36","92336","15911 HIGHLAND AVE","FONTANA","92336","CA"