"625015","REVPEN AUTREV","41 | 0","07/26/2021","06/30/2023","DBA: SAL'S FAMOUS PIZZERIA                        SAL'S FAMOUS PIZZERIA-LAGUNA BEACH LLC                         610 N COAST HWY, STE 106,                         LAGUNA BEACH, CA  92651-1526","30 ENCORE CT                              NEWPORT BEACH, CA  92663-2364","","","","11","3011","610 N COAST HWY, STE 106","LAGUNA BEACH","30","92651","30 ENCORE CT","NEWPORT BEACH","92663","CA"
"625166","REVPEN AUTREV","02 | 0","07/15/2021","06/30/2023","DBA: 13TH & THIRD                        HAPPY FAIL, LLC                         14210 BACCHUS LANDING WAY, SUITE 201,                         HEALDSBURG, CA  95448-9827","","","7","","27","4900","14210 BACCHUS LANDING WAY, SUITE 201","HEALDSBURG","49","95448","","","",""
"625214","REVPEN AUTREV","02 | 0","03/30/2022","06/30/2023","DBA: WOODS BEER & WINE CO.                        SURFACE AREA, LLC                         751 6TH ST, STE A,                         SAN FRANCISCO, CA  94130-2110","422 CLIPPER COVE WAY, TREASURE ISLAND                              SAN FRANCISCO, CA  94130","","","","24","3800","751 6TH ST, STE A","SAN FRANCISCO","38","94130","422 CLIPPER COVE WAY, TREASURE ISLAND","SAN FRANCISCO","94130","CA"
"625420","REVPEN AUTREV","02 | 0","09/27/2021","06/30/2023","DBA: PARVANEH VINEYARDS                        MIDCITY INVESTMENTS LLC                         1207 E WASHINGTON BLVD,                         LOS ANGELES, CA  90021-3035","26816 WYATT LN                              STEVENSON RANCH, CA  91381-1002","","","","4","1933","1207 E WASHINGTON BLVD","LOS ANGELES","19","90021","26816 WYATT LN","STEVENSON RANCH","91381","CA"
"625441","ACTIVE REVPEN","41 | 0","08/05/2021","07/31/2023","DBA: FRIENDSHIP BBQ                        Y&Q FOOD INC                         18495 E COLIMA RD, UNIT 8,                         ROWLAND HEIGHTS, CA  91748-5200","","","","","2","1900","18495 E COLIMA RD, UNIT 8","ROWLAND HEIGHTS","19","91748","","","",""
"625446","REVPEN AUTREV","18 | 1","07/29/2021","06/30/2023","DBA: HEARTS + TALES BEVERAGE CO.                        HEARTS + TALES LLC                         975 NIMITZ AVE, STE 120,                         VALLEJO, CA  94592-1052","1175 NIMITZ AVE, BLDG 112; STE 100                              VALLEJO, CA  94592","","","","22","4807","975 NIMITZ AVE, STE 120","VALLEJO","48","94592","1175 NIMITZ AVE, BLDG 112; STE 100","VALLEJO","94592","CA"
"625446","REVPEN AUTREV","12 | 1","07/29/2021","06/30/2023","DBA: HEARTS + TALES BEVERAGE CO.                        HEARTS + TALES LLC                         975 NIMITZ AVE, STE 120,                         VALLEJO, CA  94592-1052","1175 NIMITZ AVE, BLDG 112; STE 100                              VALLEJO, CA  94592","","","","22","4807","975 NIMITZ AVE, STE 120","VALLEJO","48","94592","1175 NIMITZ AVE, BLDG 112; STE 100","VALLEJO","94592","CA"
"625636","ACTIVE REVPEN","41 | 0","08/17/2021","07/31/2023","DBA: Z GARDEN MEDITERRANEAN RESTAURANT                        ANCA, INC.                         2350 PICO BLVD,                         SANTA MONICA, CA  90704-1755","","","7","","3","1953","2350 PICO BLVD","SANTA MONICA","19","90704","","","",""
"625637","REVPEN AUTREV","41 | 0","07/16/2021","06/30/2023","DBA: UNDERGROUND GRILL KING                        PAOPAO                         2543 NORIEGA ST,                         SAN FRANCISCO, CA  94122-4126","","41-553281","","BUSINESS & ESCROW SERVICE CENTER 3031 TISCH WAY #301 SAN JOSE, CA  95218","24","3800","2543 NORIEGA ST","SAN FRANCISCO","38","94122","","","",""
"625708","REVPEN AUTREV","40 | 0","07/02/2021","06/30/2023","DBA: RAKU TERIYAKI                        YEAN KYUNG, INC.                         8945 DE SOTO AVE,                         CANOGA PARK, CA  91304-5901","","40-565571","7","HANA ESCROW COMPANY INC 3580 WILSHIRE BLVD STE 1170 LOS ANGELES, CA  90010","5","1933","8945 DE SOTO AVE","CANOGA PARK","19","91304","","","",""
"625789","REVPEN AUTREV","41 | 0","07/27/2021","06/30/2023","DBA: STUFFED INN THE                        LLOYD, DEVIN BRUCE                         1829 EUCLID AVE,                         BERKELEY, CA  94709","","","","","22","0103","1829 EUCLID AVE","BERKELEY","01","94709","","","",""
"625820","REVPEN AUTREV","41 | 0","07/29/2021","06/30/2023","DBA: OCEAN FRONT PIZZA                        9516 LLC                         156 1/2 OCEAN FRONT AVE,                         CAYUCOS, CA  93430-1649","2781 JUNIPER AVE                              MORRO BAY, CA  93442","41-569569","7","BUSINESS & ESCROW SERVICE CENTER 3031 TISCH WAY #310 SAN JOSE, CA  95113","13","4000","156 1/2 OCEAN FRONT AVE","CAYUCOS","40","93430","2781 JUNIPER AVE","MORRO BAY","93442","CA"
"625972","REVPEN AUTREV","02 | 1","07/14/2021","06/30/2023","DBA: ELIQS LLC                         ELIQS WEST COAST WINES LLC                         7830-40 ST HELENA HWY,                         OAKVILLE, CA  94562","411 157TH ST                              GARDENA, CA  90248-2118","","7","","27","2800","7830-40 ST HELENA HWY","OAKVILLE","28","94562","411 157TH ST","GARDENA","90248","CA"
"625972","REVPEN AUTREV","09 | 1","07/14/2021","06/30/2023","DBA: ELIQS LLC                         ELIQS WEST COAST WINES LLC                         7830-40 ST HELENA HWY,                         OAKVILLE, CA  94562","411 157TH ST                              GARDENA, CA  90248-2118","","7","","27","2800","7830-40 ST HELENA HWY","OAKVILLE","28","94562","411 157TH ST","GARDENA","90248","CA"
"626037","REVPEN AUTREV","26 | 0","04/30/2021","06/30/2023","DBA: AZPACK                        ARIZONA PRODUCTION AND PACKAGING, LLC                         7303 S KYRENE RD,                         TEMPE, AZ  85283","","","","","75","9999","7303 S KYRENE RD","TEMPE","","85283","","","",""
"626055","REVPEN AUTREV","85 | 0","07/14/2021","06/30/2023","DBA: DRINK EVENINGS LLC                        DRINK EVENINGS LLC                         57313 NEAGLES ST,                         YUCCA VALLEY, CA  92284-4125","5326 STRATFORD RD                              LOS ANGELES, CA  90042-1820","","7","","8","3624","57313 NEAGLES ST","YUCCA VALLEY","36","92284","5326 STRATFORD RD","LOS ANGELES","90042","CA"
"626416","REVPEN AUTREV","28 | 0","05/14/2021","06/30/2023","DBA: PLAICE COVE SPIRITS                        SEA HAGG DISTILLERY LLC, THE                         PO BOX 21 , 135 LAFAYETTE RD, UNIT 9,                         NORTH HAMPTON, NH  03862","119 BROADWAY                               DOVER, NH  03820","","","","75","9999","PO BOX 21 , 135 LAFAYETTE RD, UNIT 9","NORTH HAMPTON","","03862","119 BROADWAY","DOVER","03820","NH"
"626419","REVPEN AUTREV","28 | 0","05/13/2021","06/30/2023","VICTOR GEORGE SPIRITS, LLC                         1126 N FEDERAL HWY, STE 308,                         FORT LAUDERDALE, FL  33304","","","","","75","9999","1126 N FEDERAL HWY, STE 308","FORT LAUDERDALE","","33304","","","",""
"626460","REVPEN AUTREV","41 | 0","07/02/2021","06/30/2023","DBA: ZPIZZA TAP ROOM                         ZAK.RT PIZZA, LLC                          12930 DAY STREET , STE 107,                         MORENO VALLEY, CA  92553-7004","","","","","7","3321","12930 DAY STREET , STE 107","MORENO VALLEY","33","92553","","","",""
"626543","ACTIVE REVPEN","41 | 0","08/19/2021","07/31/2023","DBA: LA ESCONDIDA RESTAURANT                        CALDERON CORP                         11181 AZAHAR ST,                         VENTURA, CA  93004-1961","1830 KENNEDY PL                              OXNARD, CA  93033","","7","","12","5600","11181 AZAHAR ST","VENTURA","56","93004","1830 KENNEDY PL","OXNARD","93033","CA"
"626739","REVPEN AUTREV","41 | 0","07/19/2021","06/30/2023","DBA: NICK THE GREEK                        DUBLIN GREEK EATS LLC                         5246 DUBLIN BLVD,                         DUBLIN, CA  94568-7133","1659 SCOTT BLVD 27                              SANTA CLARA, CA  94568","","7","","22","0114","5246 DUBLIN BLVD","DUBLIN","01","94568","1659 SCOTT BLVD 27","SANTA CLARA","94568","CA"
"626825","REVPEN AUTREV","28 | 0","05/26/2021","06/30/2023","80 PROOF IMPORTS LLC                         25 NORTH MARKET ST,                         JACKSONVILLE, FL  32202","","","","","75","9999","25 NORTH MARKET ST","JACKSONVILLE","","32202","","","",""
"626854","REVPEN AUTREV","41 | 0","07/22/2021","06/30/2023","DBA: TRUE SEASONS KITCHEN                        TRUE SEASONS HOLDING INC                         5675 E LA PALMA AVE, STE 199,                         ANAHEIM, CA  92807-2121","2715 HIDDEN HILLS WAY                              CORONA, CA  92882","41-536068","","NEW CENTURY ESCROW INC 500 S KRAEMER BLVD STE 275 BREA, CA  92821-1711","11","3001","5675 E LA PALMA AVE, STE 199","ANAHEIM","30","92807","2715 HIDDEN HILLS WAY","CORONA","92882","CA"
"626890","REVPEN AUTREV","02 | 0","09/28/2021","06/30/2023","DBA: SAN GIORGIA OF CUCAMONGA WINERY                         WINE TRADITIONS, LLC                         10013 8TH ST, UNIT W,                         RANCHO CUCAMONGA, CA  91730-7008","","","","","7","3615","10013 8TH ST, UNIT W","RANCHO CUCAMONGA","36","91730","","","",""
"626900","ACTIVE REVPEN","41 | 0","08/05/2021","07/31/2023","DBA: RESTAURANT ON THE RANGE                        RAMIREZ GOMEZ, MARIA GUADALUPE                         221 5TH ST,                         COLUSA, CA  95932-2410","","","7","","23","0601","221 5TH ST","COLUSA","06","95932","","","",""
"627248","REVPEN AUTREV","26 | 0","07/01/2021","06/30/2023","DBA: HOOSIER BREWING                        OLD TOWN BREWING COMPANY LLC                         147 S MADISON AVE,                         GREENWOOD, IN  46142","","","","","75","9999","147 S MADISON AVE","GREENWOOD","","46142","","","",""
"627250","REVPEN AUTREV","26 | 0","06/14/2021","06/30/2023","DBA: EIGHTH STATE BREWING COMPANY, THE                        UPSTATE CRAFT BEER, LLC                         400 AUGUSTA ST, STE 140,                         GREENVILLE, SC  29601","","","","","75","9999","400 AUGUSTA ST, STE 140","GREENVILLE","","29601","","","",""
"627297","REVPEN AUTREV","41 | 0","07/16/2021","06/30/2023","DBA: VERN BAR AND GRILL THE                         STRONG ARM INVESTMENTS LLC                         2544-2546 S ALAMEDA ST,                         VERNON, CA  90058","14922 S KINGSLEY DR                              GARDENA, CA  90247-3124","","","","2","1959","2544-2546 S ALAMEDA ST","VERNON","19","90058","14922 S KINGSLEY DR","GARDENA","90247","CA"
"627302","ACTIVE REVPEN","20 | 0","08/31/2021","07/31/2023","DBA: TELLOS MEXICAN RESTAURANT                        ALONSO VALENCIA, MARIA  GUADALUPE                         415-417 MOORPARK AVE,                         MOORPARK, CA  93021-1850","5908 DOVETAIL DR                              AGOURA HILLS, CA  91301-1406","20-461102","7","","12","5610","415-417 MOORPARK AVE","MOORPARK","56","93021","5908 DOVETAIL DR","AGOURA HILLS","91301","CA"
"627335","REVPEN AUTREV","02 | 0","08/19/2021","06/30/2023","DBA: EHRENBERG CELLARS                        EHRENBERG CELLARS, INC.                         476 LINDBERGH AVE,                         LIVERMORE, CA  94551-9553","4478 EWING RD                              CASTRO VALLEY, CA  94546","02-595353","7","","22","0107","476 LINDBERGH AVE","LIVERMORE","01","94551","4478 EWING RD","CASTRO VALLEY","94546","CA"
"627396","ACTIVE REVPEN","41 | 0","08/25/2021","07/31/2023","DBA: LINDEN & LAGUNA                        LINDEN & LAGUNA LLC                         528 LAGUNA ST,                         SAN FRANCISCO, CA  94102-5014","","41-571321","7","MCGOVERN ESCROW SERVICE 436 14TH ST SUITE 1015 OAKLAND, CA  94612","24","3800","528 LAGUNA ST","SAN FRANCISCO","38","94102","","","",""
"627419","ACTIVE REVPEN","20 | 0","08/24/2021","07/31/2023","WINE 4 WINNERS LLC                          1129 STATE ST, STE 25,                         SANTA BARBARA, CA  93101-6769","PO BOX 1242                              CARPINTERIA, CA  93014","","7,I","","12","4203","1129 STATE ST, STE 25","SANTA BARBARA","42","93101","PO BOX 1242","CARPINTERIA","93014","CA"
"627419","ACTIVE REVPEN","17 | 1","08/24/2021","07/31/2023","WINE 4 WINNERS LLC                          1129 STATE ST, STE 25,                         SANTA BARBARA, CA  93101-6769","PO BOX 1242                              CARPINTERIA, CA  93014","","7","","12","4203","1129 STATE ST, STE 25","SANTA BARBARA","42","93101","PO BOX 1242","CARPINTERIA","93014","CA"
"627419","ACTIVE REVPEN","09 | 1","08/24/2021","07/31/2023","WINE 4 WINNERS LLC                          1129 STATE ST, STE 25,                         SANTA BARBARA, CA  93101-6769","PO BOX 1242                              CARPINTERIA, CA  93014","","7","","12","4203","1129 STATE ST, STE 25","SANTA BARBARA","42","93101","PO BOX 1242","CARPINTERIA","93014","CA"
"627444","ACTIVE REVPEN","41 | 0","08/02/2021","07/31/2023","DBA: EL CALAMAR                        DM GONZALES CORPORATION                         2317 S EL CAMINO REAL,                         SAN MATEO, CA  94403-2213","","","","","25","4113","2317 S EL CAMINO REAL","SAN MATEO","41","94403","","","",""
"627475","REVPEN AUTREV","26 | 0","07/01/2021","06/30/2023","DBA: MAIN & MILL BARRELWORKS LLC                        MAIN & MILL BARRELWORKS LLC                         10 E MAIN ST,                         FESTUS, MO  63028","240 E MAIN ST                              FESTUS, MO  63028","","","","75","9999","10 E MAIN ST","FESTUS","","63028","240 E MAIN ST","FESTUS","63028","MO"
"627531","ACTIVE REVPEN","41 | 0","08/18/2021","07/31/2023","DBA: WHISPERS CAFE AND CREPERIE                        WHISPERS CAFE & CREPERIE INC                         390 EL CAMINO REAL, STE V,                         BELMONT, CA  94002-2065","","","7","","25","4102","390 EL CAMINO REAL, STE V","BELMONT","41","94002","","","",""
"627554","REVPEN AUTREV","02 | 0","08/09/2021","06/30/2023","DBA: BP WINE.COM                        BLICKER PIERCE WAGNER WINE MERCHANTS, LLC                         22985 BURNDALE RD, STE A & B,                         SONOMA, CA  95476-9807","607 AIRPARK RD                              NAPA, CA  94558-6272","","","","27","4900","22985 BURNDALE RD, STE A & B","SONOMA","49","95476","607 AIRPARK RD","NAPA","94558","CA"
"627557","REVPEN AUTREV","79 | 0","07/26/2021","06/30/2023","DBA: WYLDE WORKS @ CAMINO REAL MARKETPLACE CFM                        WYLDE WORKS LLC                          7004 MARKETPLACE DR,                         GOLETA, CA  93117","PO BOX 31032                              SANTA BARBARA, CA  93130-1032","","","","12","4208","7004 MARKETPLACE DR","GOLETA","42","93117","PO BOX 31032","SANTA BARBARA","93130","CA"
"627560","REVPEN AUTREV","79 | 0","07/26/2021","06/30/2023","DBA: WYLDE WORKS @ SANTA BARBARA CFM                        WYLDE WORKS LLC                          119 E COTA ST,                         SANTA BARBARA, CA  93101","PO BOX 31032                              SANTA BARBARA, CA  93130-1032","","","","12","4203","119 E COTA ST","SANTA BARBARA","42","93101","PO BOX 31032","SANTA BARBARA","93130","CA"
"627561","REVPEN AUTREV","02 | 1","08/27/2021","06/30/2023","DBA: SATTICUS CELLARS                        BAINS, SATWINDER SINGH                         216 BEL FLORA CT,                         ROSEVILLE, CA  95747","","","","","23","3105","216 BEL FLORA CT","ROSEVILLE","31","95747","","","",""
"627561","REVPEN AUTREV","81 | 1","08/27/2021","06/30/2023","DBA: SATTICUS CELLARS                        BAINS, SATWINDER SINGH                         216 BEL FLORA CT,                         ROSEVILLE, CA  95747","","","","","23","3105","216 BEL FLORA CT","ROSEVILLE","31","95747","","","",""
"627651","REVPEN AUTREV","02 | 0","08/20/2021","06/30/2023","DBA: TAYLORED WINE                         TAYLORED WINE L.L.C                         5055 SOLANO AVE,                         NAPA, CA  94558-1326","1001 BANNOCK ST, #438                              DENVER, CO  80204","","","","27","2800","5055 SOLANO AVE","NAPA","28","94558","1001 BANNOCK ST, #438","DENVER","80204","CO"
"627727","ACTIVE REVPEN","41 | 0","08/28/2021","07/31/2023","DBA: BURRITOS EL POTOSINO                        BURRITOS EL POTOSINO LLC                         157 IRON POINT RD,                         FOLSOM, CA  95630-9000","","","7","","23","3401","157 IRON POINT RD","FOLSOM","34","95630","","","",""
"627765","ACTIVE REVPEN","41 | 0","08/24/2021","07/31/2023","DBA: WILDBIRD                        REMBAO VENTURES LLC                         6374 W SUNSET BLVD, STE D,                         LOS ANGELES, CA  90028-7358","1311 N CAHUENGA BLVD, #1611                              LOS ANGELES, CA  90028","","7","","4","1933","6374 W SUNSET BLVD, STE D","LOS ANGELES","19","90028","1311 N CAHUENGA BLVD, #1611","LOS ANGELES","90028","CA"
"627803","REVPEN AUTREV","02 | 0","09/08/2021","06/30/2023","DBA: WINE AWESOMENESS, LLC                        WINE AWESOMENESS, LLC.                         1033 HIGHWAY 49,                         SAN ANDREAS, CA  95249-9584","150 CHERRY CREEK RD                              CLOVERDALE, CA  95425-3808","02-572775","","","29","0500","1033 HIGHWAY 49","SAN ANDREAS","05","95249","150 CHERRY CREEK RD","CLOVERDALE","95425","CA"
"628027","ACTIVE REVPEN","41 | 0","08/19/2022","07/31/2023","DBA: YORDANOS ETHIOPIAN RESTAURANT                         YORDANOS ETHIOPIAN RESTAURANT INC                         4020 W MARTIN LUTHER KING JR BLVD,                         LOS ANGELES, CA  90008-1716","4508 W MARTIN LUTHER KING JR BLVD, #21                              LOS ANGELES, CA  90016","","7","","4","1933","4020 W MARTIN LUTHER KING JR BLVD","LOS ANGELES","19","90008","4508 W MARTIN LUTHER KING JR BLVD, #21","LOS ANGELES","90016","CA"
"628053","ACTIVE REVPEN","41 | 0","08/23/2021","07/31/2023","DBA: COUNTRY WAFFLES                        ECE GROUP USA INC.                         6049 NORTHFRONT RD,                         LIVERMORE, CA  94551-9628","1957 MONTEREY DR                              LIVERMORE, CA  94551","","","","22","0107","6049 NORTHFRONT RD","LIVERMORE","01","94551","1957 MONTEREY DR","LIVERMORE","94551","CA"
"628105","ACTIVE REVPEN","82 | 0","08/13/2021","07/31/2023","DBA: SECOND CITY MEADERY                        SECOND CITY MEADERY, INC                         4465 N ELSTON AVE,                         CHICAGO, IL  60630","","","","","75","9999","4465 N ELSTON AVE","CHICAGO","","60630","","","",""
"628160","ACTIVE REVPEN","23 | 0","02/16/2022","07/31/2023","DBA: FICKS & CO.                        WHITE HORSE BRANDS LLC                         2055 S 7TH ST, STE A,                         SAN JOSE, CA  95112-6143","1904 FILBERT ST, STE A                              SAN FRANCISCO, CA  94123-3504","","","","25","4313","2055 S 7TH ST, STE A","SAN JOSE","43","95112","1904 FILBERT ST, STE A","SAN FRANCISCO","94123","CA"
"628266","REVPEN AUTREV","28 | 0","07/23/2021","06/30/2023","AGAVE DISTILLATE TRADE COMPANY S.A. DE C.V.                         ARMANDO BIRLAIN SHAFFER #2001, TOWER 2, FLOOR 16,                         CENTRO SUR, CP 76090, QUERETARO, MEXICO","","","","","75","9999","ARMANDO BIRLAIN SHAFFER #2001, TOWER 2, FLOOR 16","","","","","","",""
"628277","REVPEN AUTREV","28 | 0","07/16/2021","06/30/2023","BLUEGRASS BOTTLING, LLC                         1065 KY-78,                         STANFORD, KY  40484","","","","","75","9999","1065 KY-78","STANFORD","","40484","","","",""
"628419","REVPEN AUTREV","02 | 0","09/09/2021","06/30/2023","DBA: MANIC WINES                        MANIC WINES LLC                         136 KERNS CT,                         NAPA, CA  94558-4152","","","7","","27","2802","136 KERNS CT","NAPA","28","94558","","","",""
"628648","ACTIVE REVPEN","47 | 1","08/01/2022","07/31/2023","DBA: CHEFS OF NEW YORK                        BAR WATER ASSOCIATES, INC.                         918 13TH ST,                         MODESTO, CA  95354","1310 ROCKEFELLER DR., STE B                              CERES, CA  95307","47-577978","7","CALIFORNIA BUSINESS ESCROW INC 1748 MAIN ST ESCALON, CA  95320-1927","29","5002","918 13TH ST","MODESTO","50","95354","1310 ROCKEFELLER DR., STE B","CERES","95307","CA"
"628648","ACTIVE REVPEN","58 | 1","08/01/2022","07/31/2023","DBA: CHEFS OF NEW YORK                        BAR WATER ASSOCIATES, INC.                         918 13TH ST,                         MODESTO, CA  95354","1310 ROCKEFELLER DR., STE B                              CERES, CA  95307","47-577978","7","CALIFORNIA BUSINESS ESCROW INC 1748 MAIN ST ESCALON, CA  95320-1927","29","5002","918 13TH ST","MODESTO","50","95354","1310 ROCKEFELLER DR., STE B","CERES","95307","CA"
"628650","REVPEN AUTREV","28 | 0","07/28/2021","06/30/2023","COPPER SKY DISTILLERY                         1115 COLORADO AVE, STE C,                         LONGMONT, CO  80501","110 EMERY ST. UNIT C                              LONGMONT, CO  80501-6041","","","","75","9999","1115 COLORADO AVE, STE C","LONGMONT","","80501","110 EMERY ST. UNIT C","LONGMONT","80501","CO"
"628651","REVPEN AUTREV","28 | 0","07/28/2021","06/30/2023","SPRINGBROOK HOLLOW FARM DISTILLERY LLC                         133 CLEMENTS RD,                         QUEENSBURY, NY  12804","","","","","75","9999","133 CLEMENTS RD","QUEENSBURY","","12804","","","",""
"628843","REVPEN AUTREV","41 | 0","07/29/2022","06/30/2023","DBA: ALADION'S PIZZA                        BUISON ENTERPRISE INC                         1324 SUNSET DR,                         ANTIOCH, CA  94509-2853","967 DAINTY AVE                              BRENTWOOD, CA  94513","41-617014/ 41-647653","","","22","0701","1324 SUNSET DR","ANTIOCH","07","94509","967 DAINTY AVE","BRENTWOOD","94513","CA"
"628978","ACTIVE REVPEN","82 | 0","08/17/2021","07/31/2023","ANDREW TODD WINES, LLC                         21080 N HWY 99W,                         DUNDEE, OR  97128","1175 NE 18TH ST                              MCMINNVILLE, OR  97128","","","","75","9999","21080 N HWY 99W","DUNDEE","","97128","1175 NE 18TH ST","MCMINNVILLE","97128","OR"
"629358","REVPEN AUTREV","79 | 0","09/30/2021","06/30/2023","DBA: SIX SIGMA WINERY @FRIDAY MIDDLETOWN CFM                        SIX SIGMA WINERY LLC                         21249 WASHINGTON ST, MIDDLETOWN SQUARE PARK,                         MIDDLETOWN, CA  95461","PO BOX 1053                              MIDDLETOWN, CA  95461","","","","27","1700","21249 WASHINGTON ST, MIDDLETOWN SQUARE PARK","MIDDLETOWN","17","95461","PO BOX 1053","MIDDLETOWN","95461","CA"
"629421","REVPEN AUTREV","02 | 0","10/26/2021","06/30/2023","DBA: CASTIEL ESTATE                        CASTIEL ESTATE, LLC                         6484 WASHINGTON ST, STE G,                         YOUNTVILLE, CA  94599-1451","5 WHITE PINE CANYON RD                              PARK CITY, UT  84060","","7","","27","2804","6484 WASHINGTON ST, STE G","YOUNTVILLE","28","94599","5 WHITE PINE CANYON RD","PARK CITY","84060","UT"
"629550","REVPEN AUTREV","26 | 0","08/29/2021","06/30/2023","MIGHTY SWELL COCKTAIL COMPANY, LLC                         706 GUADALUPE ST,                         AUSTIN, TX  78701","","","","","75","9999","706 GUADALUPE ST","AUSTIN","","78701","","","",""
"629593","REVPEN AUTREV","02 | 0","01/05/2022","06/30/2023","DANATI COLLECTION LLC THE                         21 E ELM ST,                         LODI, CA  95240","22067 WINDHAM WY                              SANTA CLARITA, CA  91350","","","","29","3902","21 E ELM ST","LODI","39","95240","22067 WINDHAM WY","SANTA CLARITA","91350","CA"
"629996","ACTIVE REVPEN","41 | 0","08/19/2022","07/31/2023","OPEN GATE RECORDS                         5911 HOLLYWOOD BLVD,                         LOS ANGELES, CA  90028-5409","","41-531873","","CAPITAL TRUST ESCROW 280 BEVERLY DR STE 300 BEVERLY HILLS, CA  90212","4","1933","5911 HOLLYWOOD BLVD","LOS ANGELES","19","90028","","","",""
"630212","PEND ACTIVE","21 | 0","10/16/2023","09/30/2024","DBA: HAMILTON EURO MARKET                         NENADIC, DUSAN                         445 W MAIN ST ,                         ALHAMBRA, CA  91801-3433","1390 DARRYL DR                               SAN JOSE, CA  95130-1314","","5","","2","1901","445 W MAIN ST","ALHAMBRA","19","91801","1390 DARRYL DR","SAN JOSE","95130","CA"
"630290","REVPEN AUTREV","02 | 0","05/03/2022","06/30/2023","DBA: ORGULLO WINE GROUP LLC                        ORGULLO WINE GROUP LLC                         140 INDUSTRIAL WAY,                         BUELLTON, CA  93427-9507","1300 EASTMAN AVE                              VENTURA, CA  93003","","7","","13","4207","140 INDUSTRIAL WAY","BUELLTON","42","93427","1300 EASTMAN AVE","VENTURA","93003","CA"
"631903","REVPEN AUTREV","02 | 0","12/17/2021","06/30/2023","BRIAN DAVID WINES LLC                         7830-40 ST HELENA HWY,                         OAKVILLE, CA  94562","1640 SAN VICENTE AVE                              NAPA, CA  94558-1934","","","","27","2800","7830-40 ST HELENA HWY","OAKVILLE","28","94562","1640 SAN VICENTE AVE","NAPA","94558","CA"
"632005","REVPEN AUTREV","28 | 0","10/06/2021","06/30/2023","O'CONNELL WHISKEY MERCHANTS                         THE WORKHORSE, UNION ROAD, KILMACTHOMAS,                         CO WATERFORD, IRELAND","","","","","75","9999","THE WORKHORSE, UNION ROAD, KILMACTHOMAS","","","","","","",""
"632134","REVPEN AUTREV","17 | 1","07/01/2022","06/30/2023","DBA: ELEVENTWELVE                        ELEVEN TWELVE INC.                         1981 E 213TH ST,                         CARSON, CA  90810-1202","","17-616219","7","","3","1977","1981 E 213TH ST","CARSON","19","90810","","","",""
