"547295","REVPEN AUTREV","81 | 1","08/19/2015","06/30/2023","DBA: CHATEAU BELLEVUE                        CHATEAU BELLEVUE 1881 ESTATE LLC                         51 E VALLECITOS RD,                         LIVERMORE, CA  94550-9603","","","","","22","0107","51 E VALLECITOS RD","LIVERMORE","01","94550","","","",""
"548066","REVPEN AUTREV","02 | 0","02/25/2015","06/30/2023","DBA: LONE GRAPE WINERY                        TUSCAN WINE VILLAGE LLC                         12470 LOCKE RD, STE 600,                         LOCKEFORD, CA  95237","12470 LOCKE RD, STE 100                              LOCKEFORD, CA  95237","","","","29","3900","12470 LOCKE RD, STE 600","LOCKEFORD","39","95237","12470 LOCKE RD, STE 100","LOCKEFORD","95237","CA"
"548095","REVPEN AUTREV","02 | 0","03/12/2015","06/30/2023","DBA: BRIAN ARDEN WINES                        BRIAN ARDEN WINES HOLDINGS INC                         331 SILVERADO TRL,                         CALISTOGA, CA  94515","331 SILVERADO TRL                              CALISTOGA, CA  94515","02-502371","","","27","2801","331 SILVERADO TRL","CALISTOGA","28","94515","331 SILVERADO TRL","CALISTOGA","94515","CA"
"548806","ACTIVE REVPEN","41 | 0","08/27/2015","07/31/2023","DBA: MOUNTAIN MIKES PIZZA                        AMIROMINA INC                         2306 ALMADEN RD, # 170,                         SAN JOSE, CA  95125-2138","","41-506778","","NORTHERN CALIFORNIA ESCROW SERVICES INC 2099 GATEWAY PL #100 SAN JOSE, CA  95110","25","4313","2306 ALMADEN RD, # 170","SAN JOSE","43","95125","","","",""
"549554","REVPEN AUTREV","26 | 0","09/18/2014","06/30/2023","BELTWAY BREWING COMPANY LLC                         22620 DAVIS DR, STE 110,                         STERLING, VA  20164","","","","","75","9999","22620 DAVIS DR, STE 110","STERLING","","20164","","","",""
"550280","REVPEN AUTREV","02 | 0","02/05/2015","06/30/2023","DBA: SEGASSIA VINEYARDS LLC                        SEGASSIA VINEYARDS LLC                         90 ROCK CREEK RD, UNIT 9,                         COPPEROPOLIS, CA  95228","150 CHERRY CREEK RD                              CLOVERDALE, CA  95425-3808","","","","29","0500","90 ROCK CREEK RD, UNIT 9","COPPEROPOLIS","05","95228","150 CHERRY CREEK RD","CLOVERDALE","95425","CA"
"551180","REVPEN AUTREV","41 | 0","07/07/2015","06/30/2023","DBA: ORIGINAL DAVES COSMIC SUBS THE                        CAL COSMIC HOLDINGS INC.                         981 PACIFIC COAST HWY,                         SEAL BEACH, CA  90740-6244","221 MAIN ST, UNIT 636                              SEAL BEACH, CA  90740-5126","","7","","11","3018","981 PACIFIC COAST HWY","SEAL BEACH","30","90740","221 MAIN ST, UNIT 636","SEAL BEACH","90740","CA"
"551852","REVPEN AUTREV","41 | 0","07/02/2015","06/30/2023","DBA: MT. HUFF GOLF COURSE                        RUTLEDGE, ASHLEY ANN                         15301 HWY 89,                         CRESCENT MILLS, CA  95934","PO BOX 129                              CRESCENT MILLS, CA  95934","41-519647","7","CAL SIERRA TITLE COMPANY 295 MAIN ST QUINCY, CA  95971","31","3200","15301 HWY 89","CRESCENT MILLS","32","95934","PO BOX 129","CRESCENT MILLS","95934","CA"
"552036","REVPEN AUTREV","41 | 0","02/23/2015","06/30/2023","DBA: TIJUANA FISH TACO                        TIJUANA FISH TACO                         3120 MAIN ST,                         CHULA VISTA, CA  91911-5706","","41-475682","7,8","","10","3702","3120 MAIN ST","CHULA VISTA","37","91911","","","",""
"553411","ACTIVE CANCEL","21 | 0","02/20/2015","01/31/2024","DBA: NORCO MARKET & LIQUOR LLC                        NORCO MARKET & LIQUOR LLC                         816 6TH ST,                         NORCO, CA  92860-1545","","21-461320/ 21-650697","","CORONERSTONE ESCROW INC 110 N LINCOLN AVE STE 303 CORONA, CA  92882","7","3315","816 6TH ST","NORCO","33","92860","","","",""
"553647","REVPEN AUTREV","02 | 0","03/05/2015","06/30/2023","DBA: MOSELEY FAMILY CELLARS                        MARTIN MOSELEY WINES LLC                         4712 MOUNTAIN LAKES BLVD, STE 300,                         REDDING, CA  96003","1688 BRAEBURN CT                              REDDING, CA  96003-7060","02-509759","","NO ESCROW","31","4502","4712 MOUNTAIN LAKES BLVD, STE 300","REDDING","45","96003","1688 BRAEBURN CT","REDDING","96003","CA"
"554524","ACTIVE REVPEN","23 | 1","08/28/2015","07/31/2023","DBA: STRAND BREWING CO                        STRAND BREWING CO LLC                         2201 DOMINGUEZ ST,                         TORRANCE, CA  90501-1418","","","","","3","1958","2201 DOMINGUEZ ST","TORRANCE","19","90501","","","",""
"554524","ACTIVE REVPEN","77 | 1","08/28/2015","07/31/2023","DBA: STRAND BREWING CO                        STRAND BREWING CO LLC                         2201 DOMINGUEZ ST,                         TORRANCE, CA  90501-1418","","","","","3","1958","2201 DOMINGUEZ ST","TORRANCE","19","90501","","","",""
"555125","ACTIVE REVPEN","41 | 0","08/21/2015","07/31/2023","DBA: BIDWELL PERK                        POWER, MICHELLE MARIE                         664 E 1ST AVE, #10,                         CHICO, CA  95926-3523","","","7","","31","0402","664 E 1ST AVE, #10","CHICO","04","95926","","","",""
"555826","ACTIVE REVPEN","47 | 0","08/04/2015","07/31/2023","DBA: LA HUACA                        PYRAMID INVESTMENT, LLC                         9213 SIERRA COLLEGE BLVD, STE 140,                         ROSEVILLE, CA  95661-5919","","47-501231","","ABC ESCROW 2222 DAMON STREET  LOS ANGELES, CA  90021","23","3105","9213 SIERRA COLLEGE BLVD, STE 140","ROSEVILLE","31","95661","","","",""
"556193","REVPEN NREN","41 | 0","08/07/2015","07/31/2023","DBA: WINGSTOP 844                        CENCAL WINGS II, INC.                         1375 W HENDERSON AVE, STE C-2B,                         PORTERVILLE, CA  93257-1456","5177 E KINGS CANYON RD                              FRESNO, CA  93727-3937","","","","21","5404","1375 W HENDERSON AVE, STE C-2B","PORTERVILLE","54","93257","5177 E KINGS CANYON RD","FRESNO","93727","CA"
"556318","REVPEN AUTREV","23 | 0","05/22/2015","06/30/2023","DBA: BEAR REPUBLIC BREWING COMPANY INC                        BEAR REPUBLIC BREWING COMPANY INC                         26972 ASTI RD,                         CLOVERDALE, CA  95425-9731","110 SANDHOLM LN                              CLOVERDALE, CA  95425-4439","","7,R","","27","4900","26972 ASTI RD","CLOVERDALE","49","95425","110 SANDHOLM LN","CLOVERDALE","95425","CA"
"556383","ACTIVE REVPEN","42 | 0","08/28/2015","07/31/2023","DBA: VINE AND GRAIN                        VINE AND GRAIN LLC                         2475 SAND CREEK RD, UNIT 112,                         BRENTWOOD, CA  94513-7178","","","7","","22","0702","2475 SAND CREEK RD, UNIT 112","BRENTWOOD","07","94513","","","",""
"556605","ACTIVE REVPEN","47 | 1","08/20/2015","07/31/2023","DBA: BIG T'S SEAFOOD MARKET BAR                        TIRONE & TUAN INVESTMENTS INC                         1694 TULLY RD, STE B,                         SAN JOSE, CA  95122-2537","","47-483461","7","GREEN ESCROW SERVICES","25","4313","1694 TULLY RD, STE B","SAN JOSE","43","95122","","","",""
"556605","ACTIVE REVPEN","58 | 1","08/20/2015","07/31/2023","DBA: BIG T'S SEAFOOD MARKET BAR                        TIRONE & TUAN INVESTMENTS INC                         1694 TULLY RD, STE B,                         SAN JOSE, CA  95122-2537","","47-483461","7","GREEN ESCROW SERVICES","25","4313","1694 TULLY RD, STE B","SAN JOSE","43","95122","","","",""
"556631","ACTIVE REVPEN","47 | 1","08/13/2015","07/31/2023","DBA: GABBYS GRILL AND CAFE                        GABBY'S GRILL & CAFE LLC                         21168 HIGHWAY 46,                         LOST HILLS, CA  93249","PO BOX 35                              LOST HILLS, CA  93249","48-430186","7","ABC ESCROW 2222 DAMON STREET  LOS ANGELES, CA  90021","6","1500","21168 HIGHWAY 46","LOST HILLS","15","93249","PO BOX 35","LOST HILLS","93249","CA"
"556631","ACTIVE REVPEN","58 | 1","08/13/2015","07/31/2023","DBA: GABBYS GRILL AND CAFE                        GABBY'S GRILL & CAFE LLC                         21168 HIGHWAY 46,                         LOST HILLS, CA  93249","PO BOX 35                              LOST HILLS, CA  93249","48-430186","7","ABC ESCROW 2222 DAMON STREET  LOS ANGELES, CA  90021","6","1500","21168 HIGHWAY 46","LOST HILLS","15","93249","PO BOX 35","LOST HILLS","93249","CA"
"557148","REVPEN AUTREV","48 | 1","07/06/2015","06/30/2023","DBA: FIESTA NIGHTCLUB                        DAGIO, JAVIER SAUCEDO                         2435 S K ST,                         TULARE, CA  93274","PO BOX 754                              WOODLAKE, CA  93286-0754","48-316428","","TULARE COUNTY ESCROW 308 W OAK AVE VISALIA, CA  93291","21","5405","2435 S K ST","TULARE","54","93274","PO BOX 754","WOODLAKE","93286","CA"
"557148","REVPEN AUTREV","58 | 1","07/06/2015","06/30/2023","DBA: FIESTA NIGHTCLUB                        DAGIO, JAVIER SAUCEDO                         2435 S K ST,                         TULARE, CA  93274","PO BOX 754                              WOODLAKE, CA  93286-0754","48-316428","","TULARE COUNTY ESCROW 308 W OAK AVE VISALIA, CA  93291","21","5405","2435 S K ST","TULARE","54","93274","PO BOX 754","WOODLAKE","93286","CA"
"557213","ACTIVE CANCEL","47 | 0","10/09/2015","09/30/2024","DBA: MARISCOS LOS ALTOS #2                        EL PATIO TRACY, LLC                         1005 E PESCADERO AVE, UNIT 123,                         TRACY, CA  95304-8504","1852 W 11TH ST, #191                              TRACY, CA  95376","47-554269/ 47-649017","","","29","3906","1005 E PESCADERO AVE, UNIT 123","TRACY","39","95304","1852 W 11TH ST, #191","TRACY","95376","CA"
"557568","ACTIVE REVPEN","41 | 1","08/30/2016","07/31/2023","DBA: WALL THE                        PS80 PARTNERS LLC                         80 PLAZA SQ,                         ORANGE, CA  92866-1433","","","7","","11","3014","80 PLAZA SQ","ORANGE","30","92866","","","",""
"557568","ACTIVE REVPEN","58 | 1","08/30/2016","07/31/2023","DBA: WALL THE                        PS80 PARTNERS LLC                         80 PLAZA SQ,                         ORANGE, CA  92866-1433","","","7","","11","3014","80 PLAZA SQ","ORANGE","30","92866","","","",""
"557663","SUREND REVPEN","41 | 0","08/06/2015","07/31/2023","DBA: UGO                        UGODTLA LLC                         502 W 6TH ST,                         LOS ANGELES, CA  90014-1203","1400 3RD ST PROMENADE                              SANTA MONICA, CA  90401-2322","41-510005","7","CALIFORNIA BUSINESS ESCROW INC 1748 MAIN STREET ESCALON, CA  95320","4","1933","502 W 6TH ST","LOS ANGELES","19","90014","1400 3RD ST PROMENADE","SANTA MONICA","90401","CA"
"557823","REVPEN AUTREV","41 | 0","08/11/2015","06/30/2023","DBA: PULGARCITO QUERIDO RESTAURANT                        PULGARCITO QUERIDO EN EL VALLE, INC.                         13864 1/2 CHASE ST,                         PANORAMA CITY, CA  91402-3302","6205 CLYBOURN AVE                              NORTH HOLLYWOOD, CA  91606-3914","41-467642","7,8","","5","1933","13864 1/2 CHASE ST","PANORAMA CITY","19","91402","6205 CLYBOURN AVE","NORTH HOLLYWOOD","91606","CA"
"557986","REVPEN AUTREV","02 | 0","07/09/2015","06/30/2023","DBA: HEMISPHERE WINE COMPANY                        HEMISPHERE WINE COMPANY INC                         5055 SOLANO AVE,                         NAPA, CA  94558-1326","PO BOX 608                              RUTHERFORD, CA  94573-0608","02-465801","","","27","2800","5055 SOLANO AVE","NAPA","28","94558","PO BOX 608","RUTHERFORD","94573","CA"
"558097","ACTIVE REVPEN","41 | 0","08/18/2015","07/31/2023","DBA: SNO-WHITE                        BORGES, ANTHONY LEO JR                         420 N YOSEMITE AVE,                         OAKDALE, CA  95361","","","","","29","5004","420 N YOSEMITE AVE","OAKDALE","50","95361","","","",""
"558335","ACTIVE REVPEN","41 | 0","08/24/2015","07/31/2023","DBA: BAJAS CATCH                        BAJAS CATCH LLC                         32459 STATE HIGHWAY 79, UNIT D107,                         TEMECULA, CA  92592-9667","","41-538999","","CALIFORNIA BUSINESS ESCROW INC 1748 MAIN ST ESCALON, CA  95320-1927","7","3322","32459 STATE HIGHWAY 79, UNIT D107","TEMECULA","33","92592","","","",""
"558469","ACTIVE REVPEN","41 | 0","08/17/2015","07/31/2023","DBA: JOURNEY COFFEE CO                        JOURNEY CAFE INC                         896B ALAMO DR,                         VACAVILLE, CA  95687","896B ALAMO DR                              VACAVILLE, CA  95687","","","","22","4806","896B ALAMO DR","VACAVILLE","48","95687","896B ALAMO DR","VACAVILLE","95687","CA"
"558536","REVPEN AUTREV","02 | 0","06/29/2015","06/30/2023","DBA: VAN DER VIJVER ESTATE                        VANDERVIJVER, ROBERT                         7451 FAIRPLAY RD,                         SOMERSET, CA  95684-9539","","02-346564","","","23","0900","7451 FAIRPLAY RD","SOMERSET","09","95684","","","",""
"558777","REVPEN AUTREV","02 | 0","12/02/2015","06/30/2023","DBA: TYGE WILLIAM CELLARS                        TYGE WILLIAM CELLARS, LLC                         21692 8TH ST E, BLDG B STE 340,                         SONOMA, CA  95476-2805","","","","","27","4900","21692 8TH ST E, BLDG B STE 340","SONOMA","49","95476","","","",""
"558920","ACTIVE REVPEN","41 | 0","08/06/2015","07/31/2023","DBA: SZECHUAN SPICY HOUSE                        AZM ENTERPRISE, LLC                         6914 65TH STREET, SUITE 301,                         SACRAMENTO, CA  95823-2339","","41-547493","7","","23","3400","6914 65TH STREET, SUITE 301","SACRAMENTO","34","95823","","","",""
"558951","ACTIVE REVPEN","41 | 0","08/26/2015","07/31/2023","DBA: HOT SPOT THE                        GOURMET ROOTS HOSPITALITY INC                         15034 FOOTHILL BLVD, STE D,                         FONTANA, CA  92335-7050","","41-503355","7","INLAND EMPIRE ESCROW INC 12794 CENTRAL AVE CHINO, CA  91710","7","3604","15034 FOOTHILL BLVD, STE D","FONTANA","36","92335","","","",""
"559167","ACTIVE REVPEN","17 | 0","08/06/2015","07/31/2023","DBA: FRANCES OWEN & GRACE LLC                        FRANCES OWEN & GRACE LLC                         1134 RUTHERFORD RD,                         RUTHERFORD, CA  94573","2443 FILLMORE ST, #380-16572                              SAN FRANCISCO, CA  94115-1814","","7","","27","2800","1134 RUTHERFORD RD","RUTHERFORD","28","94573","2443 FILLMORE ST, #380-16572","SAN FRANCISCO","94115","CA"
"559167","ACTIVE REVPEN","20 | 0","08/06/2015","07/31/2023","DBA: FRANCES OWEN & GRACE LLC                        FRANCES OWEN & GRACE LLC                         1134 RUTHERFORD RD,                         RUTHERFORD, CA  94573","2443 FILLMORE ST, #380-16572                              SAN FRANCISCO, CA  94115-1814","","7,I","","27","2800","1134 RUTHERFORD RD","RUTHERFORD","28","94573","2443 FILLMORE ST, #380-16572","SAN FRANCISCO","94115","CA"
"559314","ACTIVE REVPEN","74 | 0","08/08/2016","07/31/2023","DBA: CUTLERS ARTISAN SPIRITS                        CUTLER'S ARTISAN SPIRITS, INC.                         137 ANACAPA ST, STE D,                         SANTA BARBARA, CA  93101-1860","","","","","12","4203","137 ANACAPA ST, STE D","SANTA BARBARA","42","93101","","","",""
"560301","REVPEN AUTREV","02 | 0","06/13/2016","06/30/2023","DBA: SETTING SUN SAKE BREWING CO                        PREBREE LLC                         8680 MIRALANI DR, STE 120,                         SAN DIEGO, CA  92126-6391","","","7","","9","3710","8680 MIRALANI DR, STE 120","SAN DIEGO","37","92126","","","",""
"560421","REVPEN AUTREV","26 | 0","08/17/2015","06/30/2023","J WAKEFIELD BREWING LLC                          120 NW 24TH ST,                         MIAMI, FL  33127","","","","","75","9999","120 NW 24TH ST","MIAMI","","33127","","","",""
"561827","REVPEN AUTREV","23 | 0","07/25/2016","06/30/2023","DBA: PARAISO BREWERY                        DE LA PAZ ENTERPRISE, INC                         80 G ST, UNIT C,                         LOS BANOS, CA  93635","1002 E 17TH ST, STE H                              SANTA ANA, CA  92701","","","","29","2405","80 G ST, UNIT C","LOS BANOS","24","93635","1002 E 17TH ST, STE H","SANTA ANA","92701","CA"
"563916","ACTIVE REVPEN","20 | 0","08/04/2016","07/31/2023","DBA: MISSION SQUARE MARKET                        FRESH START MARKET INC                         6171 MISSION GORGE RD, STE 111-112,                         SAN DIEGO, CA  92120-3426","","","7","","10","3710","6171 MISSION GORGE RD, STE 111-112","SAN DIEGO","37","92120","","","",""
"564103","REVPEN AUTREV","28 | 0","11/17/2015","06/30/2023","SANTA MARIA IMPORTS LLC                         401 E LAS OLAS BLVD, STE 1400,                         FT LAUDERDALE, FL  33301","200 PARK AVE, STE 1700                              NEW YORK , NY  10166","","","","75","9999","401 E LAS OLAS BLVD, STE 1400","FT LAUDERDALE","","33301","200 PARK AVE, STE 1700","NEW YORK","10166","NY"
"564207","REVPEN AUTREV","20 | 0","07/25/2016","06/30/2023","DBA: B J OIL INC                        B J OIL INC.                          847 W HIGHLAND AVE,                         SAN BERNARDINO, CA  92405","8631 E CANYON VISTA DR                              ANAHEIM, CA  92808","20-220048","","AMERICAN CLASSIC ESCROW 13215 SOUTH ST CERRITOS, CA  90703","7","3610","847 W HIGHLAND AVE","SAN BERNARDINO","36","92405","8631 E CANYON VISTA DR","ANAHEIM","92808","CA"
"564323","REVPEN AUTREV","02 | 0","04/18/2016","06/30/2023","DBA: ORIT TEJ                        ORIT TEJ, LLC                         100 CORPORATE PL , STE B,                         VALLEJO, CA  94590","100 CORPORATE PL , STE B                              VALLEJO, CA  94590","","","","22","4807","100 CORPORATE PL , STE B","VALLEJO","48","94590","100 CORPORATE PL , STE B","VALLEJO","94590","CA"
"564630","ACTIVE REVPEN","41 | 0","08/24/2016","07/31/2023","DBA: SHABU HOUSE                        WONG, JOSHUA RODNEY                         1191 E CALAVERAS BLVD,                         MILPITAS, CA  95035-5502","","41-539059","","BUSINESS & ESCROW SERVICE CENTER 3031 TISCH WAY 310 SAN JOSE, CA  95128","25","4308","1191 E CALAVERAS BLVD","MILPITAS","43","95035","","","",""
"564762","REVPEN AUTREV","02 | 0","03/22/2016","06/30/2023","DBA: SAINT K WINES                        KIRANBAY, CHRISTOPHER SAMIH                         1227 PASO ROBLES ST,                         PASO ROBLES, CA  93446-5607","PO BOX 4585                              PASO ROBLES, CA  93447-4585","","7","","13","4002","1227 PASO ROBLES ST","PASO ROBLES","40","93446","PO BOX 4585","PASO ROBLES","93447","CA"
"564990","REVPEN AUTREV","28 | 0","12/15/2015","06/30/2023","TERRA SANCTA TRADING COMPANY LLC                         2909 ST JOHNS AVE, 5A,                         JACKSONVILLE , FL  32205","","","","","75","9999","2909 ST JOHNS AVE, 5A","JACKSONVILLE","","32205","","","",""
"565110","ACTIVE REVPEN","41 | 0","08/01/2016","07/31/2023","DBA: IKE'S PLACE                        IKES PLACE #6                         1010 UNIVERSITY AVE, STE C101,                         SAN DIEGO, CA  92103-3353","","","7","","10","3710","1010 UNIVERSITY AVE, STE C101","SAN DIEGO","37","92103","","","",""
"565457","REVPEN AUTREV","02 | 0","03/29/2016","06/30/2023","DBA: 13TH & THIRD WINES                        HAPPY FAIL, LLC                         2540 & 2550 DRY CREEK RD,                         PASO ROBLES, CA  93446-8550","","","","","13","4002","2540 & 2550 DRY CREEK RD","PASO ROBLES","40","93446","","","",""
"566454","ACTIVE REVPEN","17 | 0","08/01/2016","07/31/2023","DBA: SPIRIT HORSE WINE CO.                        SPIRIT HORSE WINE CORPORATION                         6695 N DICKENSON AVE, SUITE 20,                         FRESNO, CA  93723-9453","","","7","","21","1005","6695 N DICKENSON AVE, SUITE 20","FRESNO","10","93723","","","",""
"566454","ACTIVE REVPEN","20 | 0","08/01/2016","07/31/2023","DBA: SPIRIT HORSE WINE CO.                        SPIRIT HORSE WINE CORPORATION                         6695 N DICKENSON AVE, SUITE 20,                         FRESNO, CA  93723-9453","","","7,I","","21","1005","6695 N DICKENSON AVE, SUITE 20","FRESNO","10","93723","","","",""
"566805","REVPEN AUTREV","26 | 0","02/19/2016","06/30/2023","FLYING FISH BREWING CO LLC                         900 KENNEDY BLVD,                         SOMERDALE, NJ  08083","","","","","75","9999","900 KENNEDY BLVD","SOMERDALE","","08083","","","",""
"566944","REVPEN AUTREV","75 | 1","07/25/2016","06/30/2023","DBA: STEELE & HOPS PUBLIC HOUSE                        CTB HOSPITALITY, INC.                         1901 MENDOCINO AVE,                         SANTA ROSA, CA  95401-3630","","","7","","27","4904","1901 MENDOCINO AVE","SANTA ROSA","49","95401","","","",""
"566944","REVPEN AUTREV","77 | 1","07/25/2016","06/30/2023","DBA: STEELE & HOPS PUBLIC HOUSE                        CTB HOSPITALITY, INC.                         1901 MENDOCINO AVE,                         SANTA ROSA, CA  95401-3630","","","7","","27","4904","1901 MENDOCINO AVE","SANTA ROSA","49","95401","","","",""
"567160","ACTIVE CANCEL","47 | 0","08/09/2016","11/30/2023","DBA: MARYS PIZZA SHACK                        MARYS PIZZA SHACK                         8 & 14 W SPAIN ST,                         SONOMA, CA  95472-5601","19327 HWY 12, STE 200                              SONOMA, CA  95476-5482","47-404993/ 47-651559","","","27","4906","8 & 14 W SPAIN ST","SONOMA","49","95472","19327 HWY 12, STE 200","SONOMA","95476","CA"
"567585","ACTIVE REVPEN","41 | 0","08/23/2016","07/31/2023","BIGG DANE & BEALES TEXAS BBQ, LLC                          7373 EAST AVE , STE A,                         FONTANA, CA  92366-5490","16400 PACIFIC COAST HIGHWAY, UNIT 130                              HUNTINGTON BEACH, CA  92649","","","","7","3604","7373 EAST AVE , STE A","FONTANA","36","92366","16400 PACIFIC COAST HIGHWAY, UNIT 130","HUNTINGTON BEACH","92649","CA"
"567601","REVPEN AUTREV","41 | 0","07/21/2016","06/30/2023","DBA: SHED THE                        LUJAN ENTERPRISES, INC                         333 E TEHACHAPI BLVD,                         TEHACHAPI, CA  93561","28700 DELAWARE PL                              TEHACHAPI, CA  93561-5540","41-540078","","NONE","6","1507","333 E TEHACHAPI BLVD","TEHACHAPI","15","93561","28700 DELAWARE PL","TEHACHAPI","93561","CA"
"567833","REVPEN AUTREV","26 | 0","03/22/2016","06/30/2023","DBA: EX NOVO BREW, LLC                        EX NOVO BREWING COMPANY                          2326 N FLINT AVE,                         PORTLAND, OR  97227","","","","","75","9999","2326 N FLINT AVE","PORTLAND","","97227","","","",""
"568157","ACTIVE REVPEN","41 | 1","08/08/2016","07/31/2023","DBA: RUSSIAN RENAISSANCE RESTAURANT                        RUSSIAN RENAISSANCE                         5241 GEARY BLVD,                         SAN FRANCISCO, CA  94118-2817","","","7","","24","3800","5241 GEARY BLVD","SAN FRANCISCO","38","94118","","","",""
"568157","ACTIVE REVPEN","58 | 1","08/08/2016","07/31/2023","DBA: RUSSIAN RENAISSANCE RESTAURANT                        RUSSIAN RENAISSANCE                         5241 GEARY BLVD,                         SAN FRANCISCO, CA  94118-2817","","","7","","24","3800","5241 GEARY BLVD","SAN FRANCISCO","38","94118","","","",""
"568262","ACTIVE CANCEL","41 | 0","05/26/2016","04/30/2024","DBA: TAMAEN                        K PLUS UNITED INC                         1935 PACIFIC COAST HWY,                         LOMITA, CA  90717","","41-402858/ 41-648154","","UNIVERSAL ESCROW 1025 W 190TH ST STE 160 GARDENA, CA  90248-4317","3","1976","1935 PACIFIC COAST HWY","LOMITA","19","90717","","","",""
"568272","ACTIVE REVPEN","18 | 1","08/26/2016","07/31/2023","DBA: TRIPLE CROWN LIQUOR & WINE                        TRIPLE CROWN LIQUOR & WINE INC                         7055 VINELAND AVE,                         NORTH HOLLYWOOD, CA  91605-6414","","","","","5","1933","7055 VINELAND AVE","NORTH HOLLYWOOD","19","91605","","","",""
"568272","ACTIVE REVPEN","17 | 1","08/26/2016","07/31/2023","DBA: TRIPLE CROWN LIQUOR & WINE                        TRIPLE CROWN LIQUOR & WINE INC                         7055 VINELAND AVE,                         NORTH HOLLYWOOD, CA  91605-6414","","","","","5","1933","7055 VINELAND AVE","NORTH HOLLYWOOD","19","91605","","","",""
"568272","ACTIVE REVPEN","12 | 1","08/26/2016","07/31/2023","DBA: TRIPLE CROWN LIQUOR & WINE                        TRIPLE CROWN LIQUOR & WINE INC                         7055 VINELAND AVE,                         NORTH HOLLYWOOD, CA  91605-6414","","","","","5","1933","7055 VINELAND AVE","NORTH HOLLYWOOD","19","91605","","","",""
"568272","ACTIVE REVPEN","09 | 1","08/26/2016","07/31/2023","DBA: TRIPLE CROWN LIQUOR & WINE                        TRIPLE CROWN LIQUOR & WINE INC                         7055 VINELAND AVE,                         NORTH HOLLYWOOD, CA  91605-6414","","","","","5","1933","7055 VINELAND AVE","NORTH HOLLYWOOD","19","91605","","","",""
"568674","ACTIVE CANCEL","41 | 0","07/19/2016","06/30/2024","DBA: STAND THE                        STAND NEWPORT BEACH LLC, THE                         1332 BISON AVE,                         NEWPORT BEACH, CA  92660-9071","17000 VENTURA BLVD, STE 204                              ENCINO, CA  91316-4167","","","","11","3013","1332 BISON AVE","NEWPORT BEACH","30","92660","17000 VENTURA BLVD, STE 204","ENCINO","91316","CA"
"568744","REVPEN AUTREV","20 | 0","07/12/2016","06/30/2023","DBA: MARLY MART                         MARLY INC, INC                          41539 KALMIA ST, #101,                         MURRIETA, CA  92562-6512","","20-546136/ 20-635627","","TRANSAMERICAN ESCROW COMPANY  41593 WINCHESTER DR  STE 200 TEMECULA, CA  92590","7","3323","41539 KALMIA ST, #101","MURRIETA","33","92562","","","",""
