"596669","ACTIVE REVPEN","82 | 0","08/30/2018","07/31/2023","DBA: WILLS CREEK VINEYARDS                        COPPEY, JAHN M                         10522 DUCK SPRINGS RD,                         ATTALLA, AL  35954","","","","","75","9999","10522 DUCK SPRINGS RD","ATTALLA","","35954","","","",""
"597522","SUREND REVPEN","48 | 2","01/03/2019","07/31/2023","DBA: RED BARN THE                        ENTERTAINMENT GAME INC                         73290 HWY 111,                         PALM DESERT, CA  92260-3903","","48-520199/ 47-648550","7","","8","3318","73290 HWY 111","PALM DESERT","33","92260","","","",""
"597522","SUREND REVPEN","58 | 2","01/03/2019","07/31/2023","DBA: RED BARN THE                        ENTERTAINMENT GAME INC                         73290 HWY 111,                         PALM DESERT, CA  92260-3903","","48-520199/ 47-648550","7","","8","3318","73290 HWY 111","PALM DESERT","33","92260","","","",""
"597522","SUREND REVPEN","77 | 2","01/03/2019","07/31/2023","DBA: RED BARN THE                        ENTERTAINMENT GAME INC                         73290 HWY 111,                         PALM DESERT, CA  92260-3903","","48-520199/ 47-648550","7","","8","3318","73290 HWY 111","PALM DESERT","33","92260","","","",""
"598194","REVPEN AUTREV","26 | 0","09/20/2018","06/30/2023","DBA: FOUNTAIN BEVERAGE CO/ EBBS BEER CO                        SEMB CF LLC                         123-01 ROOSEVELT AVE,                         FLUSHING, NY  11368","","","","","75","9999","123-01 ROOSEVELT AVE","FLUSHING","","11368","","","",""
"598612","ACTIVE CANCEL","41 | 0","11/09/2018","10/31/2024","DBA: PAUL'S PLACE                         LORRONCO FOODS, INC                         2991 G ST,                         MERCED, CA  95340","110 W ALEXANDER AVE                              MERCED, CA  95348","41-268981/ 41-650569","","OLD REPUBLIC TITLE 1000 BURNETT AVE STE 400 CONCORD, CA  94520-2088","29","2406","2991 G ST","MERCED","24","95340","110 W ALEXANDER AVE","MERCED","95348","CA"
"598852","SUREND REVPEN","47 | 0","08/21/2020","07/31/2023","DBA: 20/20 BAR & GRILL THE                        AVILA, MARTHA DIANNA                         8228 FIRESTONE BLVD,                         DOWNEY, CA  90241-4810","20123 FLALLON AVE                              LAKEWOOD, CA  90715-1035","","5","","2","1916","8228 FIRESTONE BLVD","DOWNEY","19","90241","20123 FLALLON AVE","LAKEWOOD","90715","CA"
"599848","PEND ACTIVE","47 | 0","11/01/2023","10/31/2024","DBA: CIPOLLINE OSTERIA                         CIPOLLINE OSTERIA                          1260 S PALM CANYON DR,                         PALM SPRINGS, CA  92264-8336","140 E PALM CANYON DR                              PALM SPRINGS, CA  92264-8822","47-535453","","CHICAGO TITLE COMPANY 78000 FRED WARING DR  STE 103 PALM DESERT, CA  92211","8","3310","1260 S PALM CANYON DR","PALM SPRINGS","33","92264","140 E PALM CANYON DR","PALM SPRINGS","92264","CA"
"600062","REVPEN AUTREV","02 | 0","03/04/2019","06/30/2023","DBA: CEUNANT WINES                        CEUNANT WINES LLC                         2910 LIMESTONE WAY,                         PASO ROBLES, CA  93446-5989","4245 BROADMOOR AVE                              ALBUQUERQUE, NM  87108","","","","13","4000","2910 LIMESTONE WAY","PASO ROBLES","40","93446","4245 BROADMOOR AVE","ALBUQUERQUE","87108","NM"
"600238","REVPEN AUTREV","41 | 0","07/01/2020","06/30/2023","DBA: CHINA IMPRESSION                        TRINITI INTERACTIVE INC                         1505 MESA VERDE EAST DR, STE B-D,                         COSTA MESA, CA  92626-5264","","41-581723","","PRECISE ESCROW 960 E LAS TUNAS DR SAN GABRIEL, CA  91776","11","3004","1505 MESA VERDE EAST DR, STE B-D","COSTA MESA","30","92626","","","",""
"600427","REVPEN AUTREV","28 | 0","10/26/2018","06/30/2023","BEEHIVE DISTILLING                         2245 S WEST TEMPLE,                         SALT LAKE CITY, UT  84115","","","","","75","9999","2245 S WEST TEMPLE","SALT LAKE CITY","","84115","","","",""
"600769","REVPEN AUTREV","26 | 0","11/05/2018","06/30/2023","DBA: WAKE BREWING                        BROTHERS PARRIS LLC                         2529 5TH AVE,                         ROCK ISLAND, IL  61201","3528 ROCKINGHAM RD                              DAVENPORT, IA  52802","","","","75","9999","2529 5TH AVE","ROCK ISLAND","","61201","3528 ROCKINGHAM RD","DAVENPORT","52802","IA"
"600775","REVPEN AUTREV","28 | 0","11/05/2018","06/30/2023","DBA: SOURLAND MOUNTAIN SPIRITS                        DISCH & SONS DISTILLERS LLC                         130 HOPEWELL ROCKY HILL RD,                         HOPEWELL, NJ  08525","","","","","75","9999","130 HOPEWELL ROCKY HILL RD","HOPEWELL","","08525","","","",""
"600977","REVPEN CANCEL","41 | 0","08/22/2019","07/31/2023","DBA: WE OLIVE                        OLIVE US CO.                          221 YALE AVE,                         CLAREMONT, CA  91711-4725","1275 REIMS ST                              CLAREMONT, CA  91711-3005","","","","2","1911","221 YALE AVE","CLAREMONT","19","91711","1275 REIMS ST","CLAREMONT","91711","CA"
"601028","REVPEN AUTREV","26 | 0","11/14/2018","06/30/2023","DANCING GNOME, LLC                         925 MAIN ST,                         PITTSBURGH, PA  15215","","","","","75","9999","925 MAIN ST","PITTSBURGH","","15215","","","",""
"601051","REVPEN AUTREV","28 | 0","11/14/2018","06/30/2023","SOUTH TEXAS DISTILLERY, LLC                         642 FM 1540,                         SANDIA, TX  78383","","","","","75","9999","642 FM 1540","SANDIA","","78383","","","",""
"601991","ACTIVE REVPEN","47 | 0","08/16/2019","07/31/2023","DBA: HOLY COW BBQ                        HOLYCOWBBQ CULVER CITY LLC                         4130 SEPULVEDA BLVD, UNIT B,                         CULVER CITY, CA  90230-4737","","47-577405","","ABC ESCROW 2222 DAMON STREET  LOS ANGELES, CA  90021","4","1914","4130 SEPULVEDA BLVD, UNIT B","CULVER CITY","19","90230","","","",""
"601997","ACTIVE CANCEL","41 | 0","10/02/2019","09/30/2024","DBA: TOWN HOF RESTAURANT                        CHO, SANG WON                         1144 S WESTERN AVE, #107 & 108,                         LOS ANGELES, CA  90006-2378","","","7","","4","1933","1144 S WESTERN AVE, #107 & 108","LOS ANGELES","19","90006","","","",""
"602472","REVPEN AUTREV","42 | 0","07/02/2019","06/30/2023","DBA: MES AMIES NAILS & BEAUTY LOUNGE                        MES AMIES NAILS & BEAUTY LOUNGE, INC.                          13334 LIMONITE AVE , STE 110,                         EASTVALE, CA  92880-7257","","","7","","7","3300","13334 LIMONITE AVE , STE 110","EASTVALE","33","92880","","","",""
"602624","REVPEN AUTREV","26 | 0","01/16/2019","06/30/2023","DBA: GREAT SOUTH BAY BREWERY                        GREAT SOUTH BAY BREWERY CORP                         25 DREXEL DR,                         BAY SHORE, NY  11706","","","","","75","9999","25 DREXEL DR","BAY SHORE","","11706","","","",""
"602627","REVPEN AUTREV","26 | 0","01/16/2019","06/30/2023","DBA: RESIDENT CULTURE BREWING COMPANY                        RESIDENT CULTURE BREWING COMPANY LLC                         2101 CENTRAL AVE,                         CHARLOTTE, NC  28205","","","","","75","9999","2101 CENTRAL AVE","CHARLOTTE","","28205","","","",""
"602813","ACTIVE REVPEN","23 | 1","08/27/2019","07/31/2023","DBA: MEXCA BREW CO                        MEXCA BREW  CO LLC                          612 & 614 W MAIN ST,                         EL CENTRO, CA  92243-2920","614 W MAIN ST                              EL CENTRO, CA  92243-2920","","","","8","1304","612 & 614 W MAIN ST","EL CENTRO","13","92243","614 W MAIN ST","EL CENTRO","92243","CA"
"602813","ACTIVE REVPEN","77 | 1","08/27/2019","07/31/2023","DBA: MEXCA BREW CO                        MEXCA BREW  CO LLC                          612 & 614 W MAIN ST,                         EL CENTRO, CA  92243-2920","614 W MAIN ST                              EL CENTRO, CA  92243-2920","","","","8","1304","612 & 614 W MAIN ST","EL CENTRO","13","92243","614 W MAIN ST","EL CENTRO","92243","CA"
"603230","REVPEN AUTREV","02 | 0","07/01/2019","06/30/2023","DBA: COMMON CIDER COMPANY                        COMMON CIDER COMPANY                         2015 AIRPARK CT,                         AUBURN, CA  95602-9068","260 FREEPORT BLVD, STE 1                              SPARKS, NV  89431-6246","","","","23","3100","2015 AIRPARK CT","AUBURN","31","95602","260 FREEPORT BLVD, STE 1","SPARKS","89431","NV"
"603718","ACTIVE REVPEN","17 | 0","08/17/2022","07/31/2023","DBA: VERVET LLC                        VERVET LLC                         15751-55 TAPIA ST,                         IRWINDALE, CA  91706-2177","750 N WILTON PLACE                              LOS ANGELES, CA  90038","","","","2","1928","15751-55 TAPIA ST","IRWINDALE","19","91706","750 N WILTON PLACE","LOS ANGELES","90038","CA"
"603772","REVPEN AUTREV","28 | 0","02/25/2019","06/30/2023","WORLDWIDE LIBATIONS, LLC                         1099 WALL STREET WEST , SUITE 136,                         LYNDHURST, NJ  07071","","","","","75","9999","1099 WALL STREET WEST , SUITE 136","LYNDHURST","","07071","","","",""
"603790","ACTIVE REVPEN","41 | 0","08/02/2019","07/31/2023","DBA: POKE GO                        HELLO DELICIOUS, INC                         17090 BERNARDO CENTER DR, STE 125,                         SAN DIEGO, CA  92128-2500","","41-567760","7","PACIFIC HOMELAND ESCROW 4655 RUFFNER ST STE 270 SAN DIEGO, CA  92111","9","3710","17090 BERNARDO CENTER DR, STE 125","SAN DIEGO","37","92128","","","",""
"603871","ACTIVE REVPEN","41 | 0","08/25/2020","07/31/2023","DBA: EL GALLO DE ORO                        AGUAYO NOYOLA, JESUS                         5901 INTERNATIONAL BLVD,                         OAKLAND, CA  94621-4202","","","","","22","0109","5901 INTERNATIONAL BLVD","OAKLAND","01","94621","","","",""
"603975","SUREND REVPEN","47 | 0","08/19/2019","07/31/2023","DBA: RUBENS MEXICAN AND SEAFOOD                        GUTIERREZ, ALICIA T                         3807 AUBURN ST,                         BAKERSFIELD, CA  93306-2760","11315 MARTINSVILLE AVE                              BAKERSFIELD, CA  93312","47-379100/ 47-649946","","TICOR TITLE COMPANY 10000 STOCKDALE HWY STE 101 BAKERSFIELD, CA  93311","6","1501","3807 AUBURN ST","BAKERSFIELD","15","93306","11315 MARTINSVILLE AVE","BAKERSFIELD","93312","CA"
"603976","REVPEN AUTREV","41 | 0","07/22/2019","06/30/2023","BO AO, INC.                         121 EL CAMINO REAL,                         MILLBRAE, CA  94030-2605","","41-596220","","LAW OFFICES OF FRANKIE F YEUNG 1121 VICENTE ST SAN FRANCISCO, CA  94116","25","4108","121 EL CAMINO REAL","MILLBRAE","41","94030","","","",""
"604145","REVPEN AUTREV","02 | 0","05/06/2019","06/30/2023","SHARPEI MOON WINES LLC                         2850 RANCHITA CANYON RD,                         SAN MIGUEL, CA  93451-9027","5225 SANTA RITA RD                              TEMPLETON, CA  93465-8746","","","","13","4000","2850 RANCHITA CANYON RD","SAN MIGUEL","40","93451","5225 SANTA RITA RD","TEMPLETON","93465","CA"
"604293","ACTIVE REVPEN","41 | 0","08/26/2019","07/31/2023","DBA: PIZZA TIME                        PIZZA TIME PIZZA LLC                         501 W FELICITA AVE, STE 103,                         ESCONDIDO, CA  92025-5639","","","7","","9","3705","501 W FELICITA AVE, STE 103","ESCONDIDO","37","92025","","","",""
"604487","REVPEN AUTREV","02 | 0","05/23/2019","06/30/2023","DBA: J WINSTON WINERY                        J WINSTON WINERY LLC                         1480 E MAIN AVE,                         MORGAN HILL, CA  95037-3201","536 LIVE OAK AVE                              MORGAN HILL, CA  95037-9240","02-582622","","","25","4300","1480 E MAIN AVE","MORGAN HILL","43","95037","536 LIVE OAK AVE","MORGAN HILL","95037","CA"
"604527","REVPEN AUTREV","02 | 0","05/17/2019","06/30/2023","DBA: BENTON FAMILY WINES                        BFW ENTERPRISES LLC                         880 VALLEJO ST,                         NAPA, CA  94559-1823","2121 MADISON ST                              YOUNTVILLE, CA  94599-1245","","7","","27","2802","880 VALLEJO ST","NAPA","28","94559","2121 MADISON ST","YOUNTVILLE","94599","CA"
"604681","REVPEN AUTREV","02 | 0","05/17/2019","06/30/2023","DBA: COPIA VINEYARDS                        COPIA VINEYARDS AND WINERY, LLC                         840 13TH ST, STE F,                         PASO ROBLES, CA  93446-7201","1000 KILER CANYON RD                              PASO ROBLES, CA  93446-3712","","","","13","4002","840 13TH ST, STE F","PASO ROBLES","40","93446","1000 KILER CANYON RD","PASO ROBLES","93446","CA"
"604687","REVPEN AUTREV","41 | 1","07/09/2019","06/30/2023","DBA: HAM STAND LLC, THE                        HAM STAND RESTAURANT GROUP LLC, THE                         821 ZION ST , STE C,                         NEVADA CITY, CA  95959-2943","11852 BLACK OAK DR                              NEVADA CITY, CA  95959","","7","","23","2902","821 ZION ST , STE C","NEVADA CITY","29","95959","11852 BLACK OAK DR","NEVADA CITY","95959","CA"
"604687","REVPEN AUTREV","58 | 1","07/09/2019","06/30/2023","DBA: HAM STAND LLC, THE                        HAM STAND RESTAURANT GROUP LLC, THE                         821 ZION ST , STE C,                         NEVADA CITY, CA  95959-2943","11852 BLACK OAK DR                              NEVADA CITY, CA  95959","","7","","23","2902","821 ZION ST , STE C","NEVADA CITY","29","95959","11852 BLACK OAK DR","NEVADA CITY","95959","CA"
"604735","ACTIVE REVPEN","41 | 0","08/22/2019","07/31/2023","DBA: BURGERIM                        HHH INVEST, INC                         38713 TIERRA SUBIDA AVE , 215-220,                         PALMDALE, CA  93551-4562","44117 37TH ST W                              LANCASTER, CA  93536","","7","","5","1974","38713 TIERRA SUBIDA AVE , 215-220","PALMDALE","19","93551","44117 37TH ST W","LANCASTER","93536","CA"
"604822","REVPEN AUTREV","41 | 0","07/16/2019","06/30/2023","DBA: CHICAGO FOR RIBS                        TOMAGA BBQ RIBS INC                         8311-13 LINCOLN BLVD,                         LOS ANGELES, CA  90045-2413","","41-329727","7","ADVANTAGE ONE ESCROW 19671 BEACH BLVD STE 103 HUNTINGTON BEACH, CA  92648","3","1933","8311-13 LINCOLN BLVD","LOS ANGELES","19","90045","","","",""
"605031","REVPEN AUTREV","02 | 0","07/23/2019","06/30/2023","DBA: COMMON CIDER COMPANY                        COMMON CIDER COMPANY                         12856 EARHART AVE, STE 101,                         AUBURN, CA  95602-9014","260 FREEPORT BLVD, STE 1                              SPARKS, NV  89431-6246","","","","23","3101","12856 EARHART AVE, STE 101","AUBURN","31","95602","260 FREEPORT BLVD, STE 1","SPARKS","89431","NV"
"605073","REVPEN NREN","41 | 0","08/25/2019","07/31/2023","DBA: NEW YORK PIZZA PLEASANTON                        NEW YORK PIZZA PLEASANTON, LLC                         690 MAIN ST,                         PLEASANTON, CA  94566-6066","","","7","","22","0111","690 MAIN ST","PLEASANTON","01","94566","","","",""
"605164","ACTIVE REVPEN","48 | 0","08/26/2019","07/31/2023","DBA: JASPER'S                        JASPERS LLC                         6957 SEBASTOPOL AVE,                         SEBASTOPOL, CA  95472-3410","125 S MAIN ST #341                              SEBASTOPOL, CA  95472-4258","48-588522","","THE HERITAGE ESCROW COMPANY 2550 FIFTH AVE SUITE 800 SAN DIEGO, CA  92103","27","4905","6957 SEBASTOPOL AVE","SEBASTOPOL","49","95472","125 S MAIN ST #341","SEBASTOPOL","95472","CA"
"605218","REVPEN AUTREV","48 | 0","07/25/2019","06/30/2023","DBA: OTHER PLACE THE                        MACILLUS, CHRISTINA ANN                         2003 YOSEMITE BLVD,                         MODESTO, CA  95354","","48-207914","7","CAPITOL CITY ESCROW INC 3838 WATT AVE #F610 SACRAMENTO, CA  95821","29","5002","2003 YOSEMITE BLVD","MODESTO","50","95354","","","",""
"605258","REVPEN AUTREV","41 | 0","07/05/2019","06/30/2023","DBA: YUKGA KOREAN CUISINE                        HAN, SIMON JIN                         608 S NEW HAMPSHIRE AVE, UNIT A,                         LOS ANGELES, CA  90005-1341","","","7","","4","1933","608 S NEW HAMPSHIRE AVE, UNIT A","LOS ANGELES","19","90005","","","",""
"605324","ACTIVE CANCEL","10 | 0","11/20/2019","10/31/2023","DBA: SWISH BEVERAGES LLC                        SWISH BEVERAGES LLC                         3813 EFFIE ST,                         LOS ANGELES, CA  90026-1009","1 BUSCH PL, 202-7                              ST LOUIS, MO  63118","","7","","4","1933","3813 EFFIE ST","LOS ANGELES","19","90026","1 BUSCH PL, 202-7","ST LOUIS","63118","MO"
"605521","ACTIVE REVPEN","82 | 0","08/22/2019","07/31/2023","DBA: ARMSTRONG FAMILY WINERY                        ARMSTRONG FAMILY WINERY LLC                         19151 144TH AVE, STE I,                         WOODINVILLE, WA  98072-4374","PO BOX 3112                              WALLA WALLA, WA  99362","","","","75","9999","19151 144TH AVE, STE I","WOODINVILLE","","98072","PO BOX 3112","WALLA WALLA","99362","WA"
"605529","REVPEN AUTREV","41 | 0","07/11/2019","06/30/2023","DBA: LOUS TAKEAWAY                        RIZZI, ANTHONY STEVEN                         621 A DEL GANADO RD,                         SAN RAFAEL, CA  94903-2300","1814 ILLINOIS ST                              VALLEJO, CA  94590","","","","27","2108","621 A DEL GANADO RD","SAN RAFAEL","21","94903","1814 ILLINOIS ST","VALLEJO","94590","CA"
"605815","REVPEN AUTREV","41 | 0","07/21/2019","06/30/2023","CHEESEWALLA, INC                         5 E CITRUS AVE , STE 106,                         REDLANDS, CA  92373-4720","","","","","7","3608","5 E CITRUS AVE , STE 106","REDLANDS","36","92373","","","",""
"605874","REVPEN AUTREV","02 | 0","08/21/2019","06/30/2023","DBA: ANNAS CIDER                        ANNA'S CIDER LLC                         11902 KOENIGSTEIN RD,                         SANTA PAULA, CA  93060-9668","","02-584551","","","12","5600","11902 KOENIGSTEIN RD","SANTA PAULA","56","93060","","","",""
"605932","ACTIVE REVPEN","07 | 0","08/22/2019","07/31/2023","DBA: MONTEVERDI SPIRITS                        MONTEVERDI SPIRITS, LLC                         110-122 CAMINO ORUGA,                         NAPA, CA  94558-6214","1116 WOODMONT DR                              NAPA, CA  94558","","","","27","2800","110-122 CAMINO ORUGA","NAPA","28","94558","1116 WOODMONT DR","NAPA","94558","CA"
"605995","ACTIVE REVPEN","70 | 0","08/12/2019","07/31/2023","DBA: HAMPTON INN                         ALM GOLETA LLC                          5665 HOLLISTER AVE,                         GOLETA, CA  93117-3423","566 W. LAKE STREET , SUITE 320                              CHICAGO, IL  60661","70-565990","","","12","4208","5665 HOLLISTER AVE","GOLETA","42","93117","566 W. LAKE STREET , SUITE 320","CHICAGO","60661","IL"
"606036","REVPEN AUTREV","41 | 0","07/19/2019","06/30/2023","DBA: ANGRY RAMEN INC                        ANGRY RAMEN INC                         15555 E 14TH ST , # 199,                         SAN LEANDRO, CA  94578-1942","","","","","22","0112","15555 E 14TH ST , # 199","SAN LEANDRO","01","94578","","","",""
"606037","ACTIVE REVPEN","41 | 0","08/28/2019","07/31/2023","DBA: RANCH KITCHEN                        MEDINA-BAEZ, PATRICIA                         240 N EAST ST,                         WOODLAND, CA  95776","","","","","23","5703","240 N EAST ST","WOODLAND","57","95776","","","",""
"606132","REVPEN AUTREV","28 | 0","05/15/2019","06/30/2023","DBA: CATARINA                        FIORAVANTI INDUSTRIA, COMERCIO, IMPORTACAO E EXPOR                         FAZENDA SANTA CATARINA, S/N BAIRRO TIGRE, ZONA RURAL,                         DRACENA, SAO PAULO, BRAZIL","PO BOX 5064                              BERKELEY, CA  94705-0064","","","","75","9999","FAZENDA SANTA CATARINA, S/N BAIRRO TIGRE, ZONA RURAL","","","","PO BOX 5064","BERKELEY","94705","CA"
"606136","REVPEN AUTREV","28 | 0","05/15/2019","06/30/2023","CASA BUCCO LTDA                         BR 470 KM194, 3, TUIUTY,                         BENTO GONCALVES, RS, BRAZIL","PO BOX 5064                              BERKELEY, CA  94705-0064","","","","75","9999","BR 470 KM194, 3, TUIUTY","","","","PO BOX 5064","BERKELEY","94705","CA"
"606473","REVPEN AUTREV","41 | 0","07/15/2019","06/30/2023","DBA: TACOS N MICHES                        TACOS N MICHES, LLC                         12913 PHILADELPHIA ST,                         WHITTIER, CA  90601-4120","900 W WILSON ST                               COSTA MESA, CA  92627-3336","","","","2","1961","12913 PHILADELPHIA ST","WHITTIER","19","90601","900 W WILSON ST","COSTA MESA","92627","CA"
"606475","ACTIVE REVPEN","41 | 0","08/15/2019","07/31/2023","DBA: BEACH HUT DELI                        BHD SLT LLC                         1072 EMERALD BAY RD,                         SOUTH LAKE TAHOE, CA  96150-6200","","41-460752","","","23","0902","1072 EMERALD BAY RD","SOUTH LAKE TAHOE","09","96150","","","",""
"606504","REVPEN AUTREV","02 | 0","03/09/2021","06/30/2023","DBA: GROUND EFFECT WINE CO                        GROUND EFFECT WINE CO., LLC                         140 INDUSTRIAL WAY,                         BUELLTON, CA  93427-9507","5662 CALLE REAL, #253                              GOLETA, CA  93111","02-572703","7","","13","4207","140 INDUSTRIAL WAY","BUELLTON","42","93427","5662 CALLE REAL, #253","GOLETA","93111","CA"
"606549","REVPEN AUTREV","02 | 0","08/23/2019","06/30/2023","DBA: VINE SUPPLY LLC                        VINE SUPPLY LLC                         3066 ADOBE RD,                         PETALUMA, CA  94954-9570","","","","","27","4900","3066 ADOBE RD","PETALUMA","49","94954","","","",""
"606728","REVPEN AUTREV","41 | 0","07/16/2019","06/30/2023","DBA: DALAT RESTAURANT                        DALAT NOODLE CO                         72 S PARK VICTORIA DR,                         MILPITAS, CA  95035-5723","","41-593126","7","BUSINESS & ESCROW SERVICE CENTER 3031 TISCH WAY 310 SAN JOSE, CA  95128","25","4308","72 S PARK VICTORIA DR","MILPITAS","43","95035","","","",""
"606757","ACTIVE REVPEN","47 | 0","08/01/2019","07/31/2023","DBA: PARADISE WATERFRONT RESTAURANT & BAR                        PARADISE BUSINESS INVESTMENTS, INC                         17641 SHERMAN ISLAND EAST LE RD,                         RIO VISTA, CA  94571-9706","35971 BRONZE ST                              UNION CITY, CA  94587","47-555472","","CALIFORNIA BUSINESS ESCROW INC 1748 MAIN ST ESCALON, CA  95320-1927","23","3400","17641 SHERMAN ISLAND EAST LE RD","RIO VISTA","34","94571","35971 BRONZE ST","UNION CITY","94587","CA"
"607272","ACTIVE REVPEN","41 | 0","08/14/2019","07/31/2023","DBA: LANDON'S GOURMET KITCHEN                        A.H.S.V. LLC                         1020 W SAN MARCOS BLVD, STE 138,                         SAN MARCOS, CA  92078-4031","","41-579405","7","","9","3712","1020 W SAN MARCOS BLVD, STE 138","SAN MARCOS","37","92078","","","",""
"607281","ACTIVE REVPEN","41 | 0","08/02/2019","07/31/2023","DBA: URBAN CATE                        JHERA, INC.                          300 S MARIPOSA AVE,                         LOS ANGELES, CA  90020-2603","","","7","","4","1933","300 S MARIPOSA AVE","LOS ANGELES","19","90020","","","",""
"607307","REVPEN CANCEL","17 | 0","08/26/2019","07/31/2023","CASTON FAMILY WINES LLC                         1206 4TH ST,                         SANTA ROSA, CA  95404-4012","1948 GOLDPAN CIR                              SANTA ROSA, CA  95407","","7","","27","4904","1206 4TH ST","SANTA ROSA","49","95404","1948 GOLDPAN CIR","SANTA ROSA","95407","CA"
"607307","REVPEN CANCEL","20 | 0","08/26/2019","07/31/2023","CASTON FAMILY WINES LLC                         1206 4TH ST,                         SANTA ROSA, CA  95404-4012","1948 GOLDPAN CIR                              SANTA ROSA, CA  95407","","7,I","","27","4904","1206 4TH ST","SANTA ROSA","49","95404","1948 GOLDPAN CIR","SANTA ROSA","95407","CA"
"607371","ACTIVE REVPEN","41 | 0","08/29/2019","07/31/2023","DBA: MOOYAH BURGERS, FRIES & SHAKES                        ARIBELLA INC.                         5194 COMMONS DR, STE 110,                         ROCKLIN, CA  95677-3916","3241 KENSINGTON DR                              EL DORADO HILLS, CA  95762-6928","","7","","23","3104","5194 COMMONS DR, STE 110","ROCKLIN","31","95677","3241 KENSINGTON DR","EL DORADO HILLS","95762","CA"
"607480","REVPEN AUTREV","02 | 0","12/03/2019","06/30/2023","DBA: ANIMO                        ANIMO L-PSHIP                         3125 ST HELENA HWY N,                         SAINT HELENA, CA  94574-9706","550 GATEWAY DR, STE 220                              NAPA, CA  94558-7578","02-547713","","","27","2800","3125 ST HELENA HWY N","SAINT HELENA","28","94574","550 GATEWAY DR, STE 220","NAPA","94558","CA"
"607504","ACTIVE REVPEN","41 | 0","08/26/2019","07/31/2023","DBA: BETTYS KABOB                        KHAMOU, FEREIDOUN                         1300 SYLVAN AVE, STE B3,                         MODESTO, CA  95355","","","","","29","5002","1300 SYLVAN AVE, STE B3","MODESTO","50","95355","","","",""
"607712","ACTIVE REVPEN","41 | 0","08/21/2019","07/31/2023","DBA: TASTE OF THAI RESTAURANT                        T.O.T INC.                         1180 E HIGHLAND AVE,                         SAN BERNARDINO, CA  92404-4606","","41-604403","","ESCROW MART INC 1255 E HIGHLAND AVE STE 102 SAN BERNARDINO, CA  92404","7","3610","1180 E HIGHLAND AVE","SAN BERNARDINO","36","92404","","","",""
"607792","ACTIVE REVPEN","85 | 0","08/06/2020","07/31/2023","DBA: MICROWINE GROUP NAPA                        MICROWINE GROUP NAPA INC                         23026 RIO LOBOS RD,                         DIAMOND BAR, CA  91765-4197","3 POINTE DR, STE 206                              BREA, CA  92821","","7","","2","1986","23026 RIO LOBOS RD","DIAMOND BAR","19","91765","3 POINTE DR, STE 206","BREA","92821","CA"
