"648441","PEND WITHDRAWN","47 | 0","","","DBA: MOOSTACHE                        CHOI PARK, KYUNG HEE                         9902 GARDEN GROVE BLVD,                         GARDEN GROVE, CA  92844-1645","9836 GARDEN GROVE BLVD, UNIT A                              GARDEN GROVE, CA  92844-1643","338291","7","","11","3009","9902 GARDEN GROVE BLVD","GARDEN GROVE","30","92844","9836 GARDEN GROVE BLVD, UNIT A","GARDEN GROVE","92844","CA"
"648527","PEND ACTIVE","47 | 0","07/07/2023","06/30/2024","DBA: HI LO CAFE                        OM SAINATH HOSPITALITY LLC                         88 S WEED BLVD,                         WEED, CA  96094","","47-619366","","CAL-SIERRA TITLE COMPANY 295 MAIN ST QUINCY, CA  95971","31","4709","88 S WEED BLVD","WEED","47","96094","","","",""
"648653","PEND ACTIVE","41 | 0","07/10/2023","06/30/2024","DBA: LA CARRETA TAQUERIA                        ESMA FOOD INC                         2160 MARINA BLVD,                         SAN LEANDRO, CA  94577-3210","","","","","22","0112","2160 MARINA BLVD","SAN LEANDRO","01","94577","","","",""
"648666","PEND ACTIVE","41 | 0","07/07/2023","06/30/2024","DBA: BRAZUCA CAFE                        BRAZUCA CAFE LLC                         901 S COAST DR, STE C160,                         COSTA MESA, CA  92626-1774","","","","","11","3004","901 S COAST DR, STE C160","COSTA MESA","30","92626","","","",""
"648675","PEND ACTIVE","21 | 0","07/07/2023","06/30/2024","DBA: Z MARKETPLACE                        Z MARKET                         12716 NORTHWOODS BLVD,                         TRUCKEE, CA  96161-5300","PO BOX 9598                              TRUCKEE, CA  96162","21-489262","","CAPITOL CITY ESCROW INC 3838 WATT AVE #F610 SACRAMENTO, CA  95821","23","2903","12716 NORTHWOODS BLVD","TRUCKEE","29","96161","PO BOX 9598","TRUCKEE","96162","CA"
"648694","PEND ACTIVE","41 | 0","07/07/2023","06/30/2024","DBA: URBAN PUNJAB                        CHARDI KALA INC                         12549 HARBOR BLVD,                         GARDEN GROVE, CA  92840-5802","115 S STATE COLLEGE BLVD, #305                              BREA, CA  92821","","","","11","3009","12549 HARBOR BLVD","GARDEN GROVE","30","92840","115 S STATE COLLEGE BLVD, #305","BREA","92821","CA"
"648743","PEND ACTIVE","41 | 0","07/07/2023","06/30/2024","DBA: CHUCK E. CHEESE'S                        CEC ENTERTAINMENT, LLC                         3037 SISK RD, STE J,                         MODESTO, CA  95350","1707 MARKET PLACE BLVD, STE 200                              C/O LICENSING DEPT , IRVING, TX  75063-8049","41-429537","","","29","5002","3037 SISK RD, STE J","MODESTO","50","95350","1707 MARKET PLACE BLVD, STE 200","IRVING","75063","TX"
"648770","PEND ACTIVE","47 | 0","07/07/2023","06/30/2024","DBA: WIND LOUNGE                        WIND LLC                         14541 BROOKHURST ST, STE A3,                         WESTMINSTER, CA  92683-5751","","47-623700","7","APEX ESCROW INC 15440 BEACH BLVD STE 131 WESTMINSTER, CA  92683-6240","11","3021","14541 BROOKHURST ST, STE A3","WESTMINSTER","30","92683","","","",""
"649851","PEND ACTIVE","28 | 0","07/07/2023","06/30/2024","LUSTY CLAW INTERNATIONAL LLC                         55 LUMBER ROAD SUITE 265,                         ROSLYN, NY  11576","","","","","75","9999","55 LUMBER ROAD SUITE 265","ROSLYN","","11576","","","",""
"649865","PEND ACTIVE","28 | 0","07/07/2023","06/30/2024","DOUBLE BREW LLC                         135 W 29TH ST, STE 602,                         NEW YORK, NY  10001","","","","","75","9999","135 W 29TH ST, STE 602","NEW YORK","","10001","","","",""
"649869","PEND ACTIVE","28 | 0","07/07/2023","06/30/2024","BAESANGMYUN BREWERY CO LTD                         512 HWAHYUN-RI, HWAHYUN-MYUN,                         POCHUN-CITY, KYUNGGI-DO, KOREA","","","","","75","9999","512 HWAHYUN-RI, HWAHYUN-MYUN","","","","","","",""
"649873","PEND ACTIVE","28 | 0","07/07/2023","06/30/2024","BOTTLE & PRESS LLC                         55 NE FARRAGUT,                         PORTLAND, OR  97211","901 SE HAWTHORNE BLVD                              PORTLAND, OR  97214","","","","75","9999","55 NE FARRAGUT","PORTLAND","","97211","901 SE HAWTHORNE BLVD","PORTLAND","97214","OR"
"649900","PEND ACTIVE","26 | 0","07/10/2023","06/30/2024","DBA: MELVIN BREWING COMPANY                        GET DOWN LLC                         624 COUNTY ROAD 101,                         ALPINE, WY  83128","PO BOX 3314                              ALPINE, WY  83128","","","","75","9999","624 COUNTY ROAD 101","ALPINE","","83128","PO BOX 3314","ALPINE","83128","WY"
"649911","PEND ACTIVE","28 | 0","07/10/2023","06/30/2024","STERLING HEMINGWAY LLC                         12410 DOE LN,                         INDIANAPOLIS, IN  46236","","","","","75","9999","12410 DOE LN","INDIANAPOLIS","","46236","","","",""
"649933","PEND WITHDRAWN","41 | 0","","","DBA: CANCUN AUTHEUTIC MEXICAN FOOD                        D AND D FOODS LLC                         7011 WARNER AVE, STE I,                         HUNTINGTON BEACH, CA  92647-5471","","601065","","NEW CENTURY ESCROW INC 500 S KRAEMER BLVD STE 275 BREA, CA  92821-1711","11","3010","7011 WARNER AVE, STE I","HUNTINGTON BEACH","30","92647","","","",""