"653637","PEND ACTIVE","48 | 2","01/09/2024","12/31/2024","DBA: TOUCANS                        TOUCANS LLC                         2100 N PALM CANYON DR, STE A100,                         PALM SPRINGS, CA  92262-2800","","48-596534","","THE ESCROW CONNECTION  1111 E TAHQUITZ CANYON WAY  STE 101 PALM SPRINGS, CA  92262","8","3310","2100 N PALM CANYON DR, STE A100","PALM SPRINGS","33","92262","","","",""
"653637","PEND ACTIVE","77 | 2","01/09/2024","12/31/2024","DBA: TOUCANS                        TOUCANS LLC                         2100 N PALM CANYON DR, STE A100,                         PALM SPRINGS, CA  92262-2800","","48-596534","","THE ESCROW CONNECTION  1111 E TAHQUITZ CANYON WAY  STE 101 PALM SPRINGS, CA  92262","8","3310","2100 N PALM CANYON DR, STE A100","PALM SPRINGS","33","92262","","","",""
"653637","PEND ACTIVE","58 | 2","01/09/2024","12/31/2024","DBA: TOUCANS                        TOUCANS LLC                         2100 N PALM CANYON DR, STE A100,                         PALM SPRINGS, CA  92262-2800","","48-596534","","THE ESCROW CONNECTION  1111 E TAHQUITZ CANYON WAY  STE 101 PALM SPRINGS, CA  92262","8","3310","2100 N PALM CANYON DR, STE A100","PALM SPRINGS","33","92262","","","",""
"653671","PEND ACTIVE","41 | 0","01/09/2024","12/31/2024","DBA: NEW RED JADE                        DAMAI GROUP INC                         245 CHURCH ST,                         SAN FRANCISCO, CA  94114","","41-213183","7","LAW OFFICES OF VIVIAN ZHANG 353 KEARNY ST SAN FRANCISCO, CA  94108","24","3800","245 CHURCH ST","SAN FRANCISCO","38","94114","","","",""
"653689","PEND ACTIVE","40 | 0","01/09/2024","12/31/2024","DBA: CROW, THE                        717 PRODUCTIONS, LLC                         2525 MICHIGAN AVE, #F4,                         SANTA MONICA, CA  90404-4014","833 15TH ST, #4                              SANTA MONICA, CA  90403","","","","3","1953","2525 MICHIGAN AVE, #F4","SANTA MONICA","19","90404","833 15TH ST, #4","SANTA MONICA","90403","CA"
"653691","PEND ACTIVE","48 | 0","01/09/2024","12/31/2024","DBA: BADLANDS SAN FRANCISCO                        BLSF2                         4121 18TH ST,                         SAN FRANCISCO, CA  94114","","48-350635","","MCGOVERN ESCROW SERVICES 436 14TH ST OAKLAND, CA  94612","24","3800","4121 18TH ST","SAN FRANCISCO","38","94114","","","",""
"653723","PEND ACTIVE","20 | 0","01/09/2024","12/31/2024","DBA: CHEVRON                        TRACY STATION LLC                         1124 NORTH INTERNATIONAL PARKWAY,                         TRACY, CA  95376","2648 GAYLEY PL                              SAN JOSE, CA  95135","20-629952","","","29","3906","1124 NORTH INTERNATIONAL PARKWAY","TRACY","39","95376","2648 GAYLEY PL","SAN JOSE","95135","CA"
"653731","PEND ACTIVE","41 | 0","01/10/2024","12/31/2024","DBA: GOLDEN HUNAN CHINESE RESTAURANT                        TEAM LIU LLC                         10334 RESEDA BLVD,                         NORTHRIDGE, CA  91326-3433","","41-541779","7","UNITED ESCROW CO 3440 WILSHIRE BLVD STE 600 LOS ANGELES, CA  90010","5","1933","10334 RESEDA BLVD","NORTHRIDGE","19","91326","","","",""
"653853","PEND ACTIVE","41 | 0","01/10/2024","12/31/2024","CHANG ANA STYLE KITCHEN INC                         15840 SOQUEL CANYON PKWY, #A,                         CHINO HILLS, CA  91709","1748 HUMMINGBIRD WAY                              CHINO HILLS, CA  91709","","","","7","3623","15840 SOQUEL CANYON PKWY, #A","CHINO HILLS","36","91709","1748 HUMMINGBIRD WAY","CHINO HILLS","91709","CA"
"653920","PEND ACTIVE","41 | 0","01/09/2024","12/31/2024","SMBATYAN, VOLODYA                         7330 FAIR OAKS BLVD, STE 10,                         CARMICHAEL, CA  95608-1771","","41-572852","","OLD REPUBLIC TITLE 1000 BURNETT AVE STE 400 CONCORD, CA  94520-2088","23","3400","7330 FAIR OAKS BLVD, STE 10","CARMICHAEL","34","95608","","","",""
"653929","PEND ACTIVE","41 | 0","01/09/2024","12/31/2024","DBA: BLACK BEAR DINER SUNNYVALE                        CUBS AA INC                         415 E EL CAMINO REAL,                         SUNNYVALE, CA  94087-1939","800 AIRPORT BLVD, #418                              BURLINGAME, CA  94010","41-602290","","","25","4316","415 E EL CAMINO REAL","SUNNYVALE","43","94087","800 AIRPORT BLVD, #418","BURLINGAME","94010","CA"
"653943","PEND ACTIVE","41 | 0","01/10/2024","12/31/2024","DBA: BLACK BEAR DINER MILPITAS                        CUBS AA INC                         174 W CALAVERAS BLVD,                         MILPITAS, CA  95035-5202","800 AIRPORT BLVD, #418                              BURLINGAME, CA  94010","41-602294","","","25","4308","174 W CALAVERAS BLVD","MILPITAS","43","95035","800 AIRPORT BLVD, #418","BURLINGAME","94010","CA"
"654107","PEND ACTIVE","02 | 0","01/10/2024","06/30/2024","DBA: DOGFARM                        DOGFARM LLC                         1299 MAIN ST, STE A,                         SAINT HELENA, CA  94574-1957","PO BOX 1006                              COBB, CA  95426-1006","","7","","27","2803","1299 MAIN ST, STE A","SAINT HELENA","28","94574","PO BOX 1006","COBB","95426","CA"
"654268","PEND ACTIVE","41 | 0","01/09/2024","12/31/2024","DBA: UMI SUSHI                        HNL RESTAURANT, INC.                         1300 SYLVAN AVE, #C9,                         MODESTO, CA  95355-1351","","41-588128","","BUSINESS & ESCROW SERVICE CENTER INC 3031 TISCH WAY STE 310 SAN JOSE, CA  95128","29","5002","1300 SYLVAN AVE, #C9","MODESTO","50","95355","","","",""
"654296","PEND ACTIVE","41 | 0","01/10/2024","12/31/2024","DBA: ZEN CURRY AND GRILL                        ZEN CURRY AND GRILL LLC                         41653 MARGARITA RD , STE 103,                         TEMECULA, CA  92591-3000","","","","","7","3322","41653 MARGARITA RD , STE 103","TEMECULA","33","92591","","","",""
"654327","PEND ACTIVE","48 | 0","01/10/2024","12/31/2024","DBA: JOANNIES CANTINA                        JL7 INC                         24750 WASHINGTON AVE,                         MURRIETA, CA  92562","23905 CLINTON KEITH RD, STE 114-205                              WILDOMAR, CA  92595","48-633458","7","STEWART TITLE GUARANTY COMPANY 1200 CALIFORNIA ST #140 REDLANDS, CA  92374","7","3323","24750 WASHINGTON AVE","MURRIETA","33","92562","23905 CLINTON KEITH RD, STE 114-205","WILDOMAR","92595","CA"
"654336","PEND ACTIVE","20 | 0","01/09/2024","12/31/2024","DBA: CARNICERIA ROSITA                        CARNICERIA ROSITA, INC.                         1080 N MAIN ST,                         MANTECA, CA  95336-3745","","20-556440","","","29","3903","1080 N MAIN ST","MANTECA","39","95336","","","",""
"654378","PEND ACTIVE","47 | 0","01/09/2024","12/31/2024","DBA: DIVINE SWINE                        ZABERTALO ENTERPRISE, LLC                         825 W ROSEBURG AVE,                         MODESTO, CA  95350","931 10TH ST , STE 2601                              MODESTO, CA  95354","47-560300","7","OLD REPUBLIC TITLE COMPANY 1000 BURNETT AVE #400 CONCORD, CA  94520","29","5002","825 W ROSEBURG AVE","MODESTO","50","95350","931 10TH ST , STE 2601","MODESTO","95354","CA"
"654405","PEND ACTIVE","17 | 0","01/09/2024","12/31/2024","DBA: LIBBY WINES                        POW POW WINES, LLC                         217 S MONTGOMERY ST,                         NAPA, CA  94559-4422","217 CESAR E CHAVEZ AVE, SW, STE 401                              GRAND RAPIDS, MI  49503","","7","","27","2802","217 S MONTGOMERY ST","NAPA","28","94559","217 CESAR E CHAVEZ AVE, SW, STE 401","GRAND RAPIDS","49503","MI"
"654440","PEND ACTIVE","48 | 1","01/09/2024","12/31/2024","DBA: DEL MAR                        DEL MAR SF, INC.                         2125 LOMBARD ST,                         SAN FRANCISCO, CA  94123","566 10TH AVE                              SAN FRANCISCO, CA  94118-3638","48-267280","","","24","3800","2125 LOMBARD ST","SAN FRANCISCO","38","94123","566 10TH AVE","SAN FRANCISCO","94118","CA"
"654440","PEND ACTIVE","58 | 1","01/09/2024","12/31/2024","DBA: DEL MAR                        DEL MAR SF, INC.                         2125 LOMBARD ST,                         SAN FRANCISCO, CA  94123","566 10TH AVE                              SAN FRANCISCO, CA  94118-3638","48-267280","","","24","3800","2125 LOMBARD ST","SAN FRANCISCO","38","94123","566 10TH AVE","SAN FRANCISCO","94118","CA"
"654584","PEND ACTIVE","41 | 0","01/09/2024","12/31/2024","DBA: EUREKA NATURAL FOODS                        EUREKA NATURAL FOODS, INC.                         1450 BROADWAY ST,                         EUREKA, CA  95501-0134","1450 BROADWAY ST                              EUREKA, CA  95501-0134","41-453849","","","28","1203","1450 BROADWAY ST","EUREKA","12","95501","1450 BROADWAY ST","EUREKA","95501","CA"
"654594","PEND ACTIVE","41 | 0","01/09/2024","06/30/2024","DBA: EUREKA NATURAL FOODS                        EUREKA NATURAL FOODS, INC.                         2165 CENTRAL AVE,                         MCKINLEYVILLE, CA  95519-3623","1450 BROADWAY ST                              EUREKA, CA  95501-0134","41-564819","8","","28","1200","2165 CENTRAL AVE","MCKINLEYVILLE","12","95519","1450 BROADWAY ST","EUREKA","95501","CA"
"654618","PEND ACTIVE","41 | 0","01/09/2024","12/31/2024","DBA: DRUNKEN FISH                         MLS DINING GROUP, INC                         12222 WILSHIRE BLVD, STE 101,                         LOS ANGELES, CA  90025-1169","18585 COLIMA RD , APT A                               ROWLAND HEIGHTS, CA  91748","41-500486","7","TIME ESCROW IN 3055 WILSHIRE BLVD STE 1150 LOS ANGELES, CA  90010-1176","4","1933","12222 WILSHIRE BLVD, STE 101","LOS ANGELES","19","90025","18585 COLIMA RD , APT A","ROWLAND HEIGHTS","91748","CA"
"654706","PEND ACTIVE","41 | 0","01/09/2024","12/31/2024","DBA: TUCK BOX                        LETOWT, JEFFREY FERRILL                         DOLORES BTW OCEAN & SEVENTH E/S,                         CARMEL, CA  93921","PO BOX TT                              CARMEL, CA  93921","41-331130","7","","26","2701","DOLORES BTW OCEAN & SEVENTH E/S","CARMEL","27","93921","PO BOX TT","CARMEL","93921","CA"
"654772","PEND ACTIVE","20 | 0","01/10/2024","03/31/2024","DBA: 4700 SLAUSON AVE, INC.                        4700 SLAUSON AVE, INC.                         4700 SLAUSON AVE,                         MAYWOOD, CA  90270-3017","10409 LAKEWOOD BLVD, UNIT 39340                              DOWNEY, CA  90239-2541","20-578310","7","","2","1936","4700 SLAUSON AVE","MAYWOOD","19","90270","10409 LAKEWOOD BLVD, UNIT 39340","DOWNEY","90239","CA"
"654923","PEND ACTIVE","41 | 0","01/09/2024","12/31/2024","DBA: AZIZAM                        MC RESTAURANT CONCEPTS LLC                          2943 W SUNSET BLVD,                         LOS ANGELES, CA  90026-2127","5043 MERIDIAN ST                              LOS ANGELES, CA  90026","41-624667","","GLEN OAKS ESCROW 8447 WILSHIRE BLVD STE 450 BEVERLY HILLS, CA  90211","4","1933","2943 W SUNSET BLVD","LOS ANGELES","19","90026","5043 MERIDIAN ST","LOS ANGELES","90026","CA"