"License Number","Status Changed From/To","Type| Dup","Original Issue Date","Expir. Date","Primary Owner and Premises Addr.","Mailing Addr.","Transfer-From/To","Conditions","Escrow","District Code","Geo Code","Prem Street","City","County","Zip Code","Mailing Street","Mailing City","Mailing Zip Code","Mailing State"
"380425","SUREND CANCEL","21 | 0","03/12/2004","09/30/2024","DBA: STAR MARKET & LIQUOR                        IBRAHIM, SHAHIRA                         4400 3RD ST,                         SAN FRANCISCO, CA  94124-2104","","21-312388/ 21-644502","7","","24","3800","4400 3RD ST","SAN FRANCISCO","38","94124","","","",""
"385372","PEND ACTIVE","02 | 0","12/14/2023","06/30/2024","DBA: GORDON BIERSCH BREWING COMPANY                        GORDON BIERSCH BREWING COMPANY                         357 E TAYLOR ST,                         SAN JOSE, CA  95112-3105","357 E TAYLOR ST                              SAN JOSE, CA  95112-3105","","","","25","4313","357 E TAYLOR ST","SAN JOSE","43","95112","357 E TAYLOR ST","SAN JOSE","95112","CA"
"409376","ACTIVE CANCEL","21 | 0","04/19/2004","03/31/2024","DBA: KORKER LIQUORS                        D & Y OF LA MIRADA INC                         2229 E COAST HWY,                         NEWPORT BEACH, CA  92625","","21-269075/ 21-651900","","","11","3013","2229 E COAST HWY","NEWPORT BEACH","30","92625","","","",""
"479216","REVPEN ACTIVE","17 | 0","09/08/2009","08/31/2024","DBA: REMIX WINES                        REMIX WINES LLC                         405 14TH ST,                         PASO ROBLES, CA  93446-2230","PO BOX 2373                              YOUNTVILLE, CA  94599-2373","","","","13","4002","405 14TH ST","PASO ROBLES","40","93446","PO BOX 2373","YOUNTVILLE","94599","CA"
"479216","REVPEN ACTIVE","17 | 0","09/08/2009","08/31/2024","DBA: REMIX WINES                        REMIX WINES LLC                         405 14TH ST,                         PASO ROBLES, CA  93446-2230","PO BOX 2373                              YOUNTVILLE, CA  94599-2373","","","","13","4002","405 14TH ST","PASO ROBLES","40","93446","PO BOX 2373","YOUNTVILLE","94599","CA"
"505501","AUTREV ACTIVE","02 | 0","03/01/2011","06/30/2024","DBA: VISZLAY VINEYARDS                        VISZLAY VINEYARDS LLC                         851 LIMERICK LN,                         HEALDSBURG, CA  95448-9509","","","","","27","4900","851 LIMERICK LN","HEALDSBURG","49","95448","","","",""
"505501","AUTREV ACTIVE","02 | 0","03/01/2011","06/30/2024","DBA: VISZLAY VINEYARDS                        VISZLAY VINEYARDS LLC                         851 LIMERICK LN,                         HEALDSBURG, CA  95448-9509","","","","","27","4900","851 LIMERICK LN","HEALDSBURG","49","95448","","","",""
"544033","ACTIVE SUSPEN","48 | 0","04/28/2015","03/31/2024","DBA: ROUGE GENTLEMEN'S CLUB                         ROUGE GENTLEMEN'S CLUB INC                         14626 RAYMER ST,                         VAN NUYS, CA  91405-1217","1875 TANDEM WAY                              NORCO, CA  92860-3606","47-463334","7","GLEN OAKS ESCROW 6100 SAN FERNANDO RD GLENDALE, CA  91201","5","1933","14626 RAYMER ST","VAN NUYS","19","91405","1875 TANDEM WAY","NORCO","92860","CA"
"552067","ACTIVE SUREND","41 | 0","11/04/2015","10/31/2024","DBA: SENOR SOL RESTAURANTE MEXICANO                        LAS FUENTES MEXICAN FOOD, INC.                         9233 RESEDA BLVD,                         NORTHRIDGE, CA  91324","","","7","","5","1933","9233 RESEDA BLVD","NORTHRIDGE","19","91324","","","",""
"553808","REVPEN ACTIVE","40 | 0","09/21/2015","08/31/2024","DBA: PACIFICA CAGES                        PACIFICA CAGES, LLC THE                         640 A1 CRESPI DR,                         PACIFICA, CA  94044-3427","1467 SERRA DR                              PACIFICA, CA  94044-4252","","","","25","4109","640 A1 CRESPI DR","PACIFICA","41","94044","1467 SERRA DR","PACIFICA","94044","CA"
"553808","REVPEN ACTIVE","40 | 0","09/21/2015","08/31/2024","DBA: PACIFICA CAGES                        PACIFICA CAGES, LLC THE                         640 A1 CRESPI DR,                         PACIFICA, CA  94044-3427","1467 SERRA DR                              PACIFICA, CA  94044-4252","","","","25","4109","640 A1 CRESPI DR","PACIFICA","41","94044","1467 SERRA DR","PACIFICA","94044","CA"
"571300","ACTIVE CANCEL","02 | 0","03/29/2017","06/30/2024","DBA: WINC                        BWSC, LLC                         1525 E JAHANT RD,                         ACAMPO, CA  95220-9187","","","","","29","3900","1525 E JAHANT RD","ACAMPO","39","95220","","","",""
"571906","ACTIVE CANCEL","23 | 0","12/22/2016","11/30/2024","DBA: ASYLUM BREWING CO                        ASYLUM BREWING COMPANY                         2970 E LA PALMA AVE, STE D,                         ANAHEIM, CA  92806-2621","","","","","11","3001","2970 E LA PALMA AVE, STE D","ANAHEIM","30","92806","","","",""
"577338","ACTIVE CANCEL","47 | 0","03/24/2017","02/29/2024","DBA: RED ROOSTER                        2301 SM, LP                         2301 SANTA MONICA BLVD,                         SANTA MONICA, CA  90404-2040","8581 SANTA MONICA BLVD, C/O EMPOWERED BOOKS                              BOX 550, WEST HOLLYWOOD, CA  90069","47-203962/ 47-638975","7","UNIVERSAL ESCROW INC 1025 W 190TH ST STE 160 GARDENA, CA  90248-4317","3","1953","2301 SANTA MONICA BLVD","SANTA MONICA","19","90404","8581 SANTA MONICA BLVD, C/O EMPOWERED BOOKS","WEST HOLLYWOOD","90069","CA"
"589466","ACTIVE CANCEL","14 | 0","02/02/2018","01/31/2024","DBA: PLANET EXPRESS LLC                        PLANET EXPRESS SHIPPING LLC                         17224 S FIGUEROA ST,                         CARSON, CA  90248","17224 S FIGUEROA ST                              GARDENA, CA  90248","","","","3","1977","17224 S FIGUEROA ST","CARSON","19","90248","17224 S FIGUEROA ST","GARDENA","90248","CA"
"595423","REVPEN ACTIVE","28 | 0","06/28/2018","06/30/2024","DARK STAR WINE LLC                         150 W 28TH ST., STE 1403,                         NEW YORK, NY  10001","","","","","75","9999","150 W 28TH ST., STE 1403","NEW YORK","","10001","","","",""
"598049","SUREND CANCEL","47 | 0","08/26/2019","07/31/2024","DBA: BEARDED LADY                         3 GENERATIONS, LLC                         19010 SOLEDAD CANYON RD,                         SANTA CLARITA, CA  91351-3362","17538 GLEDHILL ST                              NORTHRIDGE, CA  91325","","5,7","","5","1985","19010 SOLEDAD CANYON RD","SANTA CLARITA","19","91351","17538 GLEDHILL ST","NORTHRIDGE","91325","CA"
"599890","ACTIVE SUREND","48 | 0","04/03/2019","03/31/2024","DBA: EMPORIUM OAKLAND                        EMPORIUM OAKLAND, LLC                         1805 TELEGRAPH AVE,                         OAKLAND, CA  94612","1366 N MILWAUKEE AVE                              CHICAGO, IL  60622","47-518993/ 48-649115","7,A","CALIFORNIA BUSINESS ESCROW INC 1748 MAIN ST ESCALON, CA  95320-1927","22","0109","1805 TELEGRAPH AVE","OAKLAND","01","94612","1366 N MILWAUKEE AVE","CHICAGO","60622","IL"
"600986","ACTIVE SUREND","20 | 0","01/10/2019","12/31/2023","DBA: HALLADAY MARKET                        ZAKERY, WILLIAM                         601 E CENTRAL AVE,                         SANTA ANA, CA  92707-3517","","20-461521","","LUCKY TEAM ESCROW INC 13305 BROOKHURST ST GARDEN GROVE, CA  92843-3117","11","3017","601 E CENTRAL AVE","SANTA ANA","30","92707","","","",""
"615816","AUTREV ACTIVE","02 | 0","08/10/2020","06/30/2024","DBA: COASTAL CRU WINES INC                         COASTAL CRU WINES INC                          65 LOS PADRES WAY, UNIT 8,                         BUELLTON, CA  93427-9577","305 CENTENNIAL ST PO BOX 94                              LOS ALAMOS, CA  93440","","","","13","4207","65 LOS PADRES WAY, UNIT 8","BUELLTON","42","93427","305 CENTENNIAL ST PO BOX 94","LOS ALAMOS","93440","CA"
"615816","AUTREV ACTIVE","02 | 0","08/10/2020","06/30/2024","DBA: COASTAL CRU WINES INC                         COASTAL CRU WINES INC                          65 LOS PADRES WAY, UNIT 8,                         BUELLTON, CA  93427-9577","305 CENTENNIAL ST PO BOX 94                              LOS ALAMOS, CA  93440","","","","13","4207","65 LOS PADRES WAY, UNIT 8","BUELLTON","42","93427","305 CENTENNIAL ST PO BOX 94","LOS ALAMOS","93440","CA"
"617411","ACTIVE CANCEL","20 | 0","07/03/2023","06/30/2024","DBA: 7-ELEVEN STORE #1045933                        7 ELEVEN INC                         1687 E 8TH ST,                         BEAUMONT, CA  92223","PO BOX 139044, ATTN: LICENSING DEPARTMENT                              DALLAS, TX  75313-9044","","7","","8","3302","1687 E 8TH ST","BEAUMONT","33","92223","PO BOX 139044, ATTN: LICENSING DEPARTMENT","DALLAS","75313","TX"
"621341","ACTIVE CANCEL","20 | 0","05/16/2023","06/30/2024","DBA: 7 ELEVEN STORE 38603H                        7 ELEVEN INC                         2904 VAN BUREN BLVD,                         RIVERSIDE, CA  92503","PO BOX 139044, ATTN: LICENSING DEPARTMENT                              DALLAS, TX  75313-9044","","","","7","3312","2904 VAN BUREN BLVD","RIVERSIDE","33","92503","PO BOX 139044, ATTN: LICENSING DEPARTMENT","DALLAS","75313","TX"
"638239","PEND WITHDRAWN","41 | 0","","","DBA: CHOPHOUSE 363                        CHOPHOUSE 363, INC                         490 HIDDEN VALLEY PKWY, #103,                         CORONA, CA  92879-8617","6939 SCHAEFER AVE, #D363                              CHINO, CA  91710","","","","7","3306","490 HIDDEN VALLEY PKWY, #103","CORONA","33","92879","6939 SCHAEFER AVE, #D363","CHINO","91710","CA"
"638337","PEND WITHDRAWN","21 | 0","","","DBA: MEADOW BROOK MARKET                        RASHID, IMAD                         27401 HWY 74,                         PERRIS, CA  92570","1104 KENDRICK CIR                              CORONA, CA  92881","312969","","","7","3300","27401 HWY 74","PERRIS","33","92570","1104 KENDRICK CIR","CORONA","92881","CA"
"638975","PEND ACTIVE","47 | 0","12/14/2023","11/30/2024","DBA: RED ROOSTER BAKERY CAFE                         B.A.M., LLC                         5135 W ADAMS BLVD,                         LOS ANGELES, CA  90016-2771","2215 WELLESLY AVE                               LOS ANGELES, CA  90064","47-577338","7","ABC ESCROW 2222 DAMON STREET  LOS ANGELES, CA  90021","4","1933","5135 W ADAMS BLVD","LOS ANGELES","19","90016","2215 WELLESLY AVE","LOS ANGELES","90064","CA"
"640246","ACTIVE CANCEL","41 | 0","10/19/2022","09/30/2024","DBA: MARISCOS COLIMA                        MUNOZREYNOSO, JOSE R                         101 E GLENN AVE, STE J,                         MODESTO, CA  95358-6131","","","","","29","5002","101 E GLENN AVE, STE J","MODESTO","50","95358","","","",""
"641271","R64B ACTIVE","47 | 0","06/13/2023","05/31/2024","DBA: MULLHOLLAND, THE                        PACIFIC RIM THE ART GALLERY                         23538 CALABASAS RD,                         CALABASAS, CA  91302-1310","23801 CALABASAS RD, STE 1036                              CALABASAS, CA  91302-3319","47-602551","","ABC ESCROW 2222 DAMON STREET  LOS ANGELES, CA  90021","5","1987","23538 CALABASAS RD","CALABASAS","19","91302","23801 CALABASAS RD, STE 1036","CALABASAS","91302","CA"
"641483","ACTIVE CANCEL","21 | 0","08/18/2023","06/30/2024","DBA: 7 ELEVEN #32787                        7 ELEVEN INC                         2437 MAIN ST,                         OAKLEY, CA  94561-1864","PO BOX 139044, ATTN: LICENSING DEPARTMENT                              DALLAS, TX  75313-9044","","5","","22","0719","2437 MAIN ST","OAKLEY","07","94561","PO BOX 139044, ATTN: LICENSING DEPARTMENT","DALLAS","75313","TX"
"644247","PEND WITHDRAWN","20 | 0","","","DBA: STELLAR SPIRITS AND WINES                        STELLAR SPIRITS AND WINES, INC.                         970 N TUSTIN AVE, STE 100,                         ANAHEIM, CA  92807-1761","","","","","11","3001","970 N TUSTIN AVE, STE 100","ANAHEIM","30","92807","","","",""
"644502","PEND ACTIVE","21 | 0","12/14/2023","09/30/2024","DBA: STAR MARKET & LIQUOR                        STAR MARKET AND LIQUOR INC                         4400 3RD ST,                         SAN FRANCISCO, CA  94124-2104","","21-380425","7","","24","3800","4400 3RD ST","SAN FRANCISCO","38","94124","","","",""
"644710","PEND WITHDRAWN","21 | 0","","","MR LIQUOR LAKE MERRITT INC                         401 MERRITT AVE,                         OAKLAND, CA  94610-5110","510 MYRTLE AVE , STE 209                              SOUTH SAN FRANCISCO, CA  94080-4562","502328","","CALIFORNIA BUSINESS ESCROW  1748 MAIN ST  ESCALON, CA  95320","22","0109","401 MERRITT AVE","OAKLAND","01","94610","510 MYRTLE AVE , STE 209","SOUTH SAN FRANCISCO","94080","CA"
"644842","PEND WITHDRAWN","21 | 0","","","DBA: CIRCLE S LIQUOR                        KAUR, SUKHJIT NANDHA                         16551 LEFFINGWELL RD,                         WHITTIER, CA  90603-3219","","600531","","ACT ONE ESCROW 17316 EDWARDS ROAD  STE B160  CERRITOS, CA  90703","2","1961","16551 LEFFINGWELL RD","WHITTIER","19","90603","","","",""
"646099","PEND ACTIVE","41 | 0","12/14/2023","11/30/2024","DBA: BANDOLEROS CAFE                        BANDOLEROS CAFE                         15059 GOLDENWEST ST,                         HUNTINGTON BEACH, CA  92647-2710","","","","","11","3010","15059 GOLDENWEST ST","HUNTINGTON BEACH","30","92647","","","",""
"647140","ACTIVE R64B","47 | 0","12/14/2023","11/30/2024","DBA: STAR LEAF                        BOWEN & BERLIN CORP                         641 E COLORADO BLVD,                         PASADENA, CA  91101-2005","","47-598049","","ABC ESCROW 2222 DAMON ST  LOS ANGELES, CA  90021","2","1943","641 E COLORADO BLVD","PASADENA","19","91101","","","",""
"647140","ACTIVE R64B","47 | 0","12/14/2023","11/30/2024","DBA: STAR LEAF                        BOWEN & BERLIN CORP                         641 E COLORADO BLVD,                         PASADENA, CA  91101-2005","","47-598049","","ABC ESCROW 2222 DAMON ST  LOS ANGELES, CA  90021","2","1943","641 E COLORADO BLVD","PASADENA","19","91101","","","",""
"648397","PEND ACTIVE","41 | 0","12/14/2023","11/30/2024","DBA: MAIN STREET PIZZA & TAP                        KEYSTONE RESTAURANT COMPANY LLC                         3399 MAIN ST , STE F,                         MAMMOTH LAKES, CA  93546","PO BOX 8511                              MAMMOTH LAKES, CA  93546-8511","","","","6","2601","3399 MAIN ST , STE F","MAMMOTH LAKES","26","93546","PO BOX 8511","MAMMOTH LAKES","93546","CA"
"648830","PEND ACTIVE","23 | 0","12/14/2023","11/30/2024","DBA: ASYLUM BREWING                        ASYLUM BREWING COMPANY                         180 W ELM ST, UNIT A & C,                         ANAHEIM, CA  92805-3809","180 W ELM ST, UNIT C                               ANAHEIM, CA  92805-3809","23-571906","","","11","3001","180 W ELM ST, UNIT A & C","ANAHEIM","30","92805","180 W ELM ST, UNIT C","ANAHEIM","92805","CA"
"648986","PEND WITHDRAWN","21 | 0","","","DBA: FOUNTAIN LIQUOR                        VALLEY LIQUOR STORES INC THE                         416 UNIVERSITY AVE,                         SAN DIEGO, CA  92103","581 N MOLLISON AVE                              EL CAJON, CA  92021-6148","486451","","","10","3710","416 UNIVERSITY AVE","SAN DIEGO","37","92103","581 N MOLLISON AVE","EL CAJON","92021","CA"
"649115","PEND WITHDRAWN","48 | 0","","","UPTOWN FORWARD, LLC                         1805 TELEGRAPH AVE,                         OAKLAND, CA  94612","2443 FILLMORE ST, STE 380-8010                              SAN FRANCISCO, CA  94115","599890","A, 7","MCGOVERN ESCROW SERVICE 436 14TH ST SUITE 1015 OAKLAND, CA  94612","22","0109","1805 TELEGRAPH AVE","OAKLAND","01","94612","2443 FILLMORE ST, STE 380-8010","SAN FRANCISCO","94115","CA"
"649166","PEND ACTIVE","70 | 0","12/14/2023","11/30/2024","DBA: HOME 2 SUITES SAN BERNARDINO                        GREENS INV 13, LLC                         837 E BRIER DR,                         SAN BERNARDINO, CA  92408-2837","8815 RESEARCH DR                              IRVINE, CA  92618-4296","","7","","7","3610","837 E BRIER DR","SAN BERNARDINO","36","92408","8815 RESEARCH DR","IRVINE","92618","CA"
"650510","PEND ACTIVE","41 | 0","12/14/2023","11/30/2024","DBA: CEDAR LOUNGE                        ALL AMERICAN TOBACCO VENTURES INC                         1201 THIRD AVE,                         CHULA VISTA, CA  91911-3202","","","7","","10","3702","1201 THIRD AVE","CHULA VISTA","37","91911","","","",""
"651356","PEND ACTIVE","21 | 0","12/14/2023","06/30/2024","DBA: 7 ELEVEN #32787                        7 ELEVEN INC                         2437 MAIN ST,                         OAKLEY, CA  94561-1864","","21-641483","5","","22","0719","2437 MAIN ST","OAKLEY","07","94561","","","",""
"651462","PEND ACTIVE","47 | 3","12/14/2023","11/30/2024","DBA: UCLA LAKE ARROWHEAD LODGE                        HAMMER F&B LLC                         850 WILLOW CREEK RD,                         LAKE ARROWHEAD, CA  92352","10899 WILSHIRE BLVD                              LOS ANGELES, CA  90024-4343","","A","","7","3600","850 WILLOW CREEK RD","LAKE ARROWHEAD","36","92352","10899 WILSHIRE BLVD","LOS ANGELES","90024","CA"
"651462","PEND ACTIVE","47 | 3","12/14/2023","11/30/2024","DBA: UCLA LAKE ARROWHEAD LODGE                        HAMMER F&B LLC                         850 WILLOW CREEK RD,                         LAKE ARROWHEAD, CA  92352","10899 WILSHIRE BLVD                              LOS ANGELES, CA  90024-4343","","A","","7","3600","850 WILLOW CREEK RD","LAKE ARROWHEAD","36","92352","10899 WILSHIRE BLVD","LOS ANGELES","90024","CA"
"651462","PEND ACTIVE","77 | 3","12/14/2023","11/30/2024","DBA: UCLA LAKE ARROWHEAD LODGE                        HAMMER F&B LLC                         850 WILLOW CREEK RD,                         LAKE ARROWHEAD, CA  92352","10899 WILSHIRE BLVD                              LOS ANGELES, CA  90024-4343","","A","","7","3600","850 WILLOW CREEK RD","LAKE ARROWHEAD","36","92352","10899 WILSHIRE BLVD","LOS ANGELES","90024","CA"
"651462","PEND ACTIVE","68 | 3","12/14/2023","11/30/2024","DBA: UCLA LAKE ARROWHEAD LODGE                        HAMMER F&B LLC                         850 WILLOW CREEK RD,                         LAKE ARROWHEAD, CA  92352","10899 WILSHIRE BLVD                              LOS ANGELES, CA  90024-4343","","A","","7","3600","850 WILLOW CREEK RD","LAKE ARROWHEAD","36","92352","10899 WILSHIRE BLVD","LOS ANGELES","90024","CA"
"651462","PEND ACTIVE","58 | 3","12/14/2023","11/30/2024","DBA: UCLA LAKE ARROWHEAD LODGE                        HAMMER F&B LLC                         850 WILLOW CREEK RD,                         LAKE ARROWHEAD, CA  92352","10899 WILSHIRE BLVD                              LOS ANGELES, CA  90024-4343","","A","","7","3600","850 WILLOW CREEK RD","LAKE ARROWHEAD","36","92352","10899 WILSHIRE BLVD","LOS ANGELES","90024","CA"
"651900","PEND ACTIVE","21 | 0","12/14/2023","11/30/2024","DBA: KORKER LIQUOR                        LOUIS, BASSAM FOUAD                         2229 E COAST HWY,                         NEWPORT BEACH, CA  92625","2916 HAWKS POINTE DR                              FULLERTON, CA  92833-5504","21-409376","","DETAIL ESCROW, NC. 13737 ARTESIA BLVD  #105 CERRITOS, CA  90703","11","3013","2229 E COAST HWY","NEWPORT BEACH","30","92625","2916 HAWKS POINTE DR","FULLERTON","92833","CA"
"653222","PEND ACTIVE","20 | 0","12/14/2023","06/30/2024","DBA: 7-ELEVEN STORE 41640A                        7 ELEVEN INC                         1687 E 8TH ST,                         BEAUMONT, CA  92223","PO BOX 139044, ATTN: LICENSING DEPARTMENT                              DALLAS, TX  75313-9044","20-617411","7","","8","3302","1687 E 8TH ST","BEAUMONT","33","92223","PO BOX 139044, ATTN: LICENSING DEPARTMENT","DALLAS","75313","TX"
"653254","PEND ACTIVE","20 | 0","12/14/2023","11/30/2024","DBA: SONNY'S CIGARS AND WINE AT RANCHO SANTA FE                        YAKO HANO, SINAN AZIZ                         6030 LA FLECHA,                         RANCHO SANTA FE, CA  92067","PO BOX 7314, 6030 LA FLECHA                              RANCHO SANTA FE, CA  92067-7314","","","","9","3700","6030 LA FLECHA","RANCHO SANTA FE","37","92067","PO BOX 7314, 6030 LA FLECHA","RANCHO SANTA FE","92067","CA"
"653420","PEND WITHDRAWN","09 | 1","","","NEWS SEAFOOD INC.                         1345 S HERBERT AVE,                         COMMERCE, CA  90023-4008","","","","","2","1967","1345 S HERBERT AVE","COMMERCE","19","90023","","","",""
"653420","PEND WITHDRAWN","17 | 1","","","NEWS SEAFOOD INC.                         1345 S HERBERT AVE,                         COMMERCE, CA  90023-4008","","","","","2","1967","1345 S HERBERT AVE","COMMERCE","19","90023","","","",""
"653779","PEND ACTIVE","41 | 0","12/14/2023","11/30/2024","DBA: SHRIMP SEAFOOD                        SILVER BEACH GRAND CORP                          10720 FOOTHILL BLVD, STE 100,                         RANCHO CUCAMONGA, CA  91730-3807","608 DEODAR LN                              BRADBURY, CA  91008-1109","","","","7","3615","10720 FOOTHILL BLVD, STE 100","RANCHO CUCAMONGA","36","91730","608 DEODAR LN","BRADBURY","91008","CA"
"653806","PEND ACTIVE","41 | 0","12/14/2023","11/30/2024","CHASE K HOSPITALITY GROUP LLC                         235 N SEPULVEDA BLVD,                         MANHATTAN BEACH, CA  90266","2011 MORGAN LN                              REDONDO BEACH, CA  90278","","7","","3","1935","235 N SEPULVEDA BLVD","MANHATTAN BEACH","19","90266","2011 MORGAN LN","REDONDO BEACH","90278","CA"
"654023","PEND ACTIVE","41 | 0","12/14/2023","11/30/2024","DBA: MARISCOS COLIMA SEAFOOD RESTAURANT                        SABORR INC                         101 E GLENN AVE, STE J,                         MODESTO, CA  95358-6131","","41-640246","","","29","5002","101 E GLENN AVE, STE J","MODESTO","50","95358","","","",""
"654035","PEND ACTIVE","02 | 0","12/14/2023","06/30/2024","DWELLEY FAMILY WINES, LLC                          800 BUSINESS PARK DR, STE G,                         DIXON, CA  95620","1525 PALMER CT                              DIXON, CA  95620","","","","22","4802","800 BUSINESS PARK DR, STE G","DIXON","48","95620","1525 PALMER CT","DIXON","95620","CA"
"654156","PEND ACTIVE","20 | 0","12/14/2023","06/30/2024","DBA: 7-ELEVEN STORE 38603A                        7 ELEVEN INC                         2904 VAN BUREN BLVD,                         RIVERSIDE, CA  92503","PO BOX 139044, ATTN: LICENSING DEPARTMENT                              DALLAS, TX  75313-9044","20-621341","","7 ELEVEN INC PO BOX 139044 ATTN: LICENSING DEPARTMENT DALLAS, TX  75313-9044","7","3312","2904 VAN BUREN BLVD","RIVERSIDE","33","92503","PO BOX 139044, ATTN: LICENSING DEPARTMENT","DALLAS","75313","TX"
"654216","PEND ACTIVE","14 | 0","12/14/2023","01/31/2024","DBA: PLANET EXPRESS LLC                        PLANET EXPRESS SHIPPING LLC                         1985 DEL AMO BLVD,                         TORRANCE, CA  90501","17224 S FIGUEROA ST                              GARDENA, CA  90248","14-589466","","","3","1958","1985 DEL AMO BLVD","TORRANCE","19","90501","17224 S FIGUEROA ST","GARDENA","90248","CA"
"654338","PEND WITHDRAWN","41 | 1","","","DBA: CDX HALL EVENTS                        CDX HALL EVENTS INC.                         280 W 3RD ST,                         POMONA, CA  91766-1712","1240 N PARK AVE                               POMONA, CA  91768-3029","","","","2","1945","280 W 3RD ST","POMONA","19","91766","1240 N PARK AVE","POMONA","91768","CA"
"654338","PEND WITHDRAWN","58 | 1","","","DBA: CDX HALL EVENTS                        CDX HALL EVENTS INC.                         280 W 3RD ST,                         POMONA, CA  91766-1712","1240 N PARK AVE                               POMONA, CA  91768-3029","","","","2","1945","280 W 3RD ST","POMONA","19","91766","1240 N PARK AVE","POMONA","91768","CA"
"654374","PEND WITHDRAWN","41 | 0","","","DBA: WANDERING FOX COFFEE HOUSE                        VIVIANO, GINA  MARIE                         18835 E HIGHWAY 26,                         LINDEN, CA  95236","PO BOX 255                              LINDEN, CA  95236","","","","29","3900","18835 E HIGHWAY 26","LINDEN","39","95236","PO BOX 255","LINDEN","95236","CA"
"654453","PEND WITHDRAWN","09 | 1","","","DBA: OGG LLC                        OGG LLC                         1655 N CALIFORNIA BLVD #247,                         WALNUT CREEK, CA  94596","","","7","","22","0711","1655 N CALIFORNIA BLVD #247","WALNUT CREEK","07","94596","","","",""
"654453","PEND WITHDRAWN","17 | 1","","","DBA: OGG LLC                        OGG LLC                         1655 N CALIFORNIA BLVD #247,                         WALNUT CREEK, CA  94596","","","7","","22","0711","1655 N CALIFORNIA BLVD #247","WALNUT CREEK","07","94596","","","",""
"654453","PEND WITHDRAWN","20 | 0","","","DBA: OGG LLC                        OGG LLC                         1655 N CALIFORNIA BLVD #247,                         WALNUT CREEK, CA  94596","","","7","","22","0711","1655 N CALIFORNIA BLVD #247","WALNUT CREEK","07","94596","","","",""