"653130","PEND ACTIVE","41 | 0","11/17/2023","10/31/2024","DBA: LY LUCK RESTAURANT                        HZ RESTAURANT LLC                         3537 FRUITVALE AVE,                         OAKLAND, CA  94602-2326","","41-644619","","OLD REPUBLIC TITLE 1000 BURNETT AVE STE 400 CONCORD, CA  94520-2088","22","0109","3537 FRUITVALE AVE","OAKLAND","01","94602","","","",""
"653148","PEND ACTIVE","47 | 0","11/17/2023","10/31/2024","DBA: CAMELIA                        SPROUT CAMELIA LLC                          1850 INDUSTRIAL ST, UNIT 100,                         LOS ANGELES, CA  90021-1244","","47-605926","7","ABC ESCROW 2222 DAMON STREET  LOS ANGELES, CA  90021","4","1933","1850 INDUSTRIAL ST, UNIT 100","LOS ANGELES","19","90021","","","",""
"653316","PEND ACTIVE","41 | 0","11/17/2023","10/31/2024","360 DEGREES GOURMET BURRITOS ALAMEDA, LLC                         951 MARINA VILLAGE PKWY,                         ALAMEDA, CA  94501","","","","","22","0101","951 MARINA VILLAGE PKWY","ALAMEDA","01","94501","","","",""
"653348","PEND ACTIVE","41 | 0","11/17/2023","10/31/2024","DBA: TOM SERVICES / VALENTINO PIZZA                        TOMER, ANKUSH                         5115 MING AVE,                         BAKERSFIELD, CA  93309-4620","6802 SAVANNAH FALLS DR                              BAKERSFIELD, CA  93312","","","","6","1501","5115 MING AVE","BAKERSFIELD","15","93309","6802 SAVANNAH FALLS DR","BAKERSFIELD","93312","CA"
"653372","PEND ACTIVE","41 | 0","11/17/2023","10/31/2024","DBA: KONGSARANG TOFU & BBQ                        HANSANG INC                         6180 JARVIS AVE, STE A,                         NEWARK, CA  94560-1200","","41-595371","7","CRESCENT LAND TITLE COMPANY 890 3RD ST CRESCENT CITY, CA  95531","22","0108","6180 JARVIS AVE, STE A","NEWARK","01","94560","","","",""
"653453","PEND ACTIVE","79 | 0","11/20/2023","06/30/2024","DBA: STRANGE FAMILY VINEYARDS @ MALIBU FARMERS MARKET                        RAILWAY, LLC                         23500 CIVIC CENTER WAY,                         MALIBU, CA  90265","12100 WILSHIRE BLVD STE 420                              LOS ANGELES, CA  90025-7136","","","","5","1988","23500 CIVIC CENTER WAY","MALIBU","19","90265","12100 WILSHIRE BLVD STE 420","LOS ANGELES","90025","CA"
"653513","PEND ACTIVE","41 | 0","11/17/2023","10/31/2024","DBA: STRAW HAT PIZZA                        KULLAR EXPRESS INC                         1240 N MAIN ST,                         MANTECA, CA  95336","20 CAKEBREAD CIR                              SACRAMENTO, CA  95834","41-617521","","FIRST AMERICAN TITLE COMPANY 415 CENTURY PARK DR STE A YUBA CITY, CA  95991","29","3903","1240 N MAIN ST","MANTECA","39","95336","20 CAKEBREAD CIR","SACRAMENTO","95834","CA"
"653543","PEND ACTIVE","41 | 0","11/17/2023","10/31/2024","DBA: EL CORA MEXICAN RESTAURANT                        ORDAZ, ALICIA                         445 CONGER ST, STE D,                         GARBERVILLE, CA  95542-3249","PO BOX 314                              GARBERVILLE, CA  95542-0314","","","","28","1200","445 CONGER ST, STE D","GARBERVILLE","12","95542","PO BOX 314","GARBERVILLE","95542","CA"
"653769","PEND ACTIVE","20 | 0","11/20/2023","10/31/2024","DBA: AMPLIFY                        SAINI FAMILY LLC                         12670 RAMONA BLVD,                         BALDWIN PARK, CA  91706-3548","","20-638885","7","UNITED ESCROW CO 3440 WILSHIRE BLVD # 600 LOS ANGELES, CA  90036","2","1905","12670 RAMONA BLVD","BALDWIN PARK","19","91706","","","",""