"654088","PEND ACTIVE","41 | 0","01/23/2024","12/31/2024","DBA: FRESH BROTHERS PIZZA                        GOLDEN ROAD FOOD SERVICES LLC                         720 FOOTHILL BLVD,                         LA CANADA FLINTRIDGE, CA  91011-3404","11120 HINDRY AVE UNIT C, ATTN: ACCOUNTING TEAM                              LOS ANGELES, CA  90045-6295","41-98140","","CALIFORNIA BUSINESS ESCROW 1748 MAIN ST ESCALON, CA  95320-1927","5","1979","720 FOOTHILL BLVD","LA CANADA FLINTRIDGE","19","91011","11120 HINDRY AVE UNIT C, ATTN: ACCOUNTING TEAM","LOS ANGELES","90045","CA"
"654124","PEND ACTIVE","41 | 0","01/23/2024","12/31/2024","DBA: PIZZA FACTORY 167                        TRI STAR VENTURES LLC                         2182 HWY 4 STE D300,                         ARNOLD, CA  95223","PO BOX 180                              ARNOLD, CA  95223","","","","29","0500","2182 HWY 4 STE D300","ARNOLD","05","95223","PO BOX 180","ARNOLD","95223","CA"
"654129","PEND ACTIVE","20 | 0","01/23/2024","12/31/2024","DBA: BRIGHTON STREET GROCERY                        SINGH, RAJA                         570 BRIGHTON ST,                         GRASS VALLEY, CA  95945-7143","9525 DUSTY TRAILS PL                              ELK GROVE, CA  95624","20-563315","7","CAPITAL CITY ESCROW 3838 WATT AVE STE F610 SACRAMENTO, CA  95821","23","2901","570 BRIGHTON ST","GRASS VALLEY","29","95945","9525 DUSTY TRAILS PL","ELK GROVE","95624","CA"
"654136","PEND ACTIVE","21 | 0","01/22/2024","12/31/2024","DBA: JACK'S GAS #5                        MOHAMED, YAKOOB NAGIB S                         1459 N ST,                         NEWMAN, CA  95360-1308","137 S VALENCIA BLVD                              WOODLAKE, CA  93286-1711","21-479743","","CALIFORNIA BUSINESS ESCROW 1748 MAIN ST ESCALON, CA  95320-1927","29","5003","1459 N ST","NEWMAN","50","95360","137 S VALENCIA BLVD","WOODLAKE","93286","CA"
"654226","PEND ACTIVE","48 | 0","01/22/2024","12/31/2024","DBA: GILLY'S BAR                        MODERN CLASSICS HOSPITALITY LLC                         2304-06 EL CAJON BLVD,                         SAN DIEGO, CA  92104-1106","4472 COPELAND AVE                              SAN DIEGO, CA  92104","48-482588","7","HERITAGE ESCROW 2550 5TH AVE STE 800 SAN DIEGO, CA  92103","10","3710","2304-06 EL CAJON BLVD","SAN DIEGO","37","92104","4472 COPELAND AVE","SAN DIEGO","92104","CA"
"654252","PEND ACTIVE","47 | 1","01/23/2024","12/31/2024","DBA: TOWN HALL                        FREMONT LIQUOR, LLC                         342 HOWARD ST,                         SAN FRANCISCO, CA  94105","600 MANZANITA AVE, #1                              CORTE MADERA, CA  94925","47-403901","","CALIFORNIA BUSINESS ESCROW INC 1748 MAIN ST ESCALON, CA  95320-1927","24","3800","342 HOWARD ST","SAN FRANCISCO","38","94105","600 MANZANITA AVE, #1","CORTE MADERA","94925","CA"
"654252","PEND ACTIVE","58 | 1","01/23/2024","12/31/2024","DBA: TOWN HALL                        FREMONT LIQUOR, LLC                         342 HOWARD ST,                         SAN FRANCISCO, CA  94105","600 MANZANITA AVE, #1                              CORTE MADERA, CA  94925","47-403901","","CALIFORNIA BUSINESS ESCROW INC 1748 MAIN ST ESCALON, CA  95320-1927","24","3800","342 HOWARD ST","SAN FRANCISCO","38","94105","600 MANZANITA AVE, #1","CORTE MADERA","94925","CA"
"654267","PEND ACTIVE","47 | 0","01/23/2024","12/31/2024","DBA: KIRKS STEAKBURGERS                        APEX FARMA LLC                         2509 S BASCOM AVE,                         SAN JOSE, CA  95124","2485 MARSHA WY                              SAN JOSE, CA  95125","47-462616","7","BUSINESS & ESCROW SERVICE CENTER INC 3031 TISCH WY STE 310 SAN JOSE, CA  95128","25","4313","2509 S BASCOM AVE","SAN JOSE","43","95124","2485 MARSHA WY","SAN JOSE","95125","CA"
"654356","PEND ACTIVE","21 | 0","01/23/2024","12/31/2024","DBA: KB KORNER                        SAI KIRPA 2610 INC                         402 E REDLANDS BLVD,                         REDLANDS, CA  92373-5227","","21-638473","","GLEN OAKS ESCROW 24018 LYONS AVE SANTA CLARITA, CA  91321","7","3608","402 E REDLANDS BLVD","REDLANDS","36","92373","","","",""
"654429","PEND ACTIVE","40 | 0","01/23/2024","12/31/2024","DBA: LIT FROM WITHIN                        LIT FROM WITHIN, LLC                         1475 PLACER ST STE D,                         REDDING, CA  96001","","","","","31","4502","1475 PLACER ST STE D","REDDING","45","96001","","","",""
"654443","PEND ACTIVE","41 | 0","01/23/2024","12/31/2024","DBA: PIRATE, THE                        KOREAN SEAFOOD BBQ INC                         19045 COLIMA RD,                         ROWLAND HEIGHTS, CA  91748-2922","","","","","2","1900","19045 COLIMA RD","ROWLAND HEIGHTS","19","91748","","","",""
"654472","PEND ACTIVE","21 | 0","01/22/2024","12/31/2024","DBA: GREEN MILL LIQUOR                        PINK PLUS, INC.                         3812 WHITTIER BLVD,                         LOS ANGELES, CA  90023-2402","","21-509541","","PRIME ESCROW INC 3600 WILSHIRE BLVD STE 1028 LOS ANGELES, CA  90010-2614","2","1900","3812 WHITTIER BLVD","LOS ANGELES","19","90023","","","",""
"654507","PEND ACTIVE","41 | 0","01/23/2024","12/31/2024","PMG RESTAURANT INC                         2555 KILBURN AVE,                         NAPA, CA  94558-5618","1415 JEFFERSON ST                              NAPA, CA  94559-1708","","7","","27","2802","2555 KILBURN AVE","NAPA","28","94558","1415 JEFFERSON ST","NAPA","94559","CA"
"654513","PEND ACTIVE","41 | 0","01/23/2024","12/31/2024","DBA: VARGAS PINAAS                        JIMENEZ GONZALEZ, JOSEFINA                         132 BEAR MOUNTAIN BLVD,                         ARVIN, CA  93203-1504","","41-626060","","CENTRAL CALIFORNIA ESCROW 9101 CAMINO MEDIA STE 200 BAKERSFIELD, CA  93311","6","1509","132 BEAR MOUNTAIN BLVD","ARVIN","15","93203","","","",""
"654557","PEND ACTIVE","41 | 0","01/22/2024","12/31/2024","DBA: 101 THAI WAY                        RAMIREZ, WARANGKHANA PHUNGSUKDAENG                         1198 S CLOVERDALE BLVD, # 3,                         CLOVERDALE, CA  95425-4483","","41-552381","","","27","4901","1198 S CLOVERDALE BLVD, # 3","CLOVERDALE","49","95425","","","",""
"654588","PEND ACTIVE","47 | 0","01/23/2024","12/31/2024","DBA: IL BARONE RISTORANTE                        F&D BARONE INC                         6700 W COAST HWY,                         NEWPORT BEACH, CA  92663-1824","","47-461062","7","R ESCROW 1205 E CHAPMAN AVE ORANGE, CA  92866","11","3013","6700 W COAST HWY","NEWPORT BEACH","30","92663","","","",""
"654630","PEND ACTIVE","41 | 0","01/22/2024","12/31/2024","DBA: DW'S CAFE                        DW'S CAFE LLC                         2855 JOHNSON DR, STE J,                         VENTURA, CA  93003-7254","PO BOX 5151                              VENTURA, CA  93005","41-604385","7","CONTACT ESCROW 2301 S VICTORIA AVE #B VENTURA, CA  93003","12","5606","2855 JOHNSON DR, STE J","VENTURA","56","93003","PO BOX 5151","VENTURA","93005","CA"
"654638","PEND ACTIVE","20 | 0","01/22/2024","06/30/2024","DBA: 7 ELEVEN #41973A                        7 ELEVEN INC                         1995 W OLIVE AVE,                         MERCED, CA  95348","PO BOX 139044, ATTEN: LICENSING DEPARTMENT                              DALLAS, TX  75313-9044","20-628386","","7 ELEVEN INC PO BOX 139044 ATTN: LICENSING DEPARTMENT DALLAS, TX  75313-9044","29","2406","1995 W OLIVE AVE","MERCED","24","95348","PO BOX 139044, ATTEN: LICENSING DEPARTMENT","DALLAS","75313","TX"
"654650","PEND ACTIVE","41 | 0","01/22/2024","12/31/2024","DBA: KALAMATA MEDITERRANEAN CUISINE                        AZUCAR RESTAURANTS LLC                         1224 OAK CIR, STE B,                         ARNOLD, CA  95223","140 MAIN ST                              MURPHYS, CA  95247","","","","29","0500","1224 OAK CIR, STE B","ARNOLD","05","95223","140 MAIN ST","MURPHYS","95247","CA"
"654679","PEND ACTIVE","41 | 0","01/22/2024","12/31/2024","DBA: COFFEE REPUBLIC                        HEAVENLY VIBE INC.                         6610 FOLSOM AUBURN RD , STE 2,                         FOLSOM, CA  95630","","","7","","23","3401","6610 FOLSOM AUBURN RD , STE 2","FOLSOM","34","95630","","","",""
"654700","PEND ACTIVE","41 | 0","01/23/2024","12/31/2024","DBA: PINOTS PALETTE                        GIANT PENNY, LLC                         7811 EDINGER AVE, STE 110,                         HUNTINGTON BEACH, CA  92647-7634","17440 SANTA MARIA ST                              FOUNTAIN VALLEY, CA  92708-3126","","","","11","3010","7811 EDINGER AVE, STE 110","HUNTINGTON BEACH","30","92647","17440 SANTA MARIA ST","FOUNTAIN VALLEY","92708","CA"
"654733","PEND ACTIVE","41 | 0","01/23/2024","12/31/2024","DBA: HOMETOWN TASTE                        CRANES FOOD SERVICE LLC                         16719 BERNARDO CENTER DR, STE B,                         SAN DIEGO, CA  92128-2509","","41-446142","","PACIFIC HOMELAND ESCROW INC 8799 BALBOA AVENUE STE 100 SAN DIEGO, CA  92123","9","3710","16719 BERNARDO CENTER DR, STE B","SAN DIEGO","37","92128","","","",""
"654781","PEND ACTIVE","20 | 0","01/22/2024","05/31/2024","DBA: 8904 LONG BEACH BLVD, INC.                        8904 LONG BEACH BLVD, INC.                         8904 LONG BEACH BLVD,                         SOUTH GATE, CA  90280-2808","10409 LAKEWOOD BLVD, UNIT 39340                              DOWNEY, CA  90239-2541","20-528005","","","2","1956","8904 LONG BEACH BLVD","SOUTH GATE","19","90280","10409 LAKEWOOD BLVD, UNIT 39340","DOWNEY","90239","CA"
"654869","PEND ACTIVE","41 | 0","01/23/2024","12/31/2024","DBA: HAWAIIAN HOT POT                        HAWAIIAN SHABU HOUSE LLC                         3848 MCHENRY AVE, STE 205,                         MODESTO, CA  95356-1580","2381 BRETON DR                              OAKDALE, CA  95361-8972","","","","29","5002","3848 MCHENRY AVE, STE 205","MODESTO","50","95356","2381 BRETON DR","OAKDALE","95361","CA"
"654987","PEND ACTIVE","41 | 0","01/22/2024","06/30/2024","DBA: TAQUERIA ZORRO                        TAQUERIA ZORRO INC.                         308 COLUMBUS AVE,                         SAN FRANCISCO, CA  94133-3908","","41-648874","","","24","3800","308 COLUMBUS AVE","SAN FRANCISCO","38","94133","","","",""
"655105","PEND ACTIVE","02 | 0","01/22/2024","06/30/2024","DBA: BUCKINGHAM WINES LLC                        BUCKINGHAM WINES LLC                         271 ALISON AVE,                         ROHNERT PARK, CA  94928-3112","","","7","","27","4907","271 ALISON AVE","ROHNERT PARK","49","94928","","","",""
"655188","PEND ACTIVE","41 | 0","01/23/2024","12/31/2024","DBA: BODEGA BIONDI                        BIONDIFAMREST LLC                         7984 CALIFORNIA AVE,                         FAIR OAKS, CA  95628-7140","","41-581565","7","CAPITOL CITY ESCROW INC 3838 WATT AVE #F610 SACRAMENTO, CA  95821","23","3400","7984 CALIFORNIA AVE","FAIR OAKS","34","95628","","","",""
"655224","PEND ACTIVE","41 | 0","01/23/2024","12/31/2024","DBA: EL CHILACATAZO RESTAURANT                         EL CHILACATAZO RESTAURANT INC                         337 MONTEREY ST,                         SALINAS, CA  93901-3410","","41-646505","","","26","2708","337 MONTEREY ST","SALINAS","27","93901","","","",""
"655889","PEND ACTIVE","20 | 0","01/22/2024","06/30/2024","DBA: NICO'S                         NICO'S SMALL MARKET LLC                          3111 GLENDALE BLVD, UNIT B,                         LOS ANGELES, CA  90039-1805","","20-616641","7","","4","1933","3111 GLENDALE BLVD, UNIT B","LOS ANGELES","19","90039","","","",""
"655889","PEND ACTIVE","42 | 1","01/22/2024","06/30/2024","DBA: NICO'S                         NICO'S SMALL MARKET LLC                          3111 GLENDALE BLVD, UNIT B,                         LOS ANGELES, CA  90039-1805","","42-616641","7","","4","1933","3111 GLENDALE BLVD, UNIT B","LOS ANGELES","19","90039","","","",""
"655889","PEND ACTIVE","58 | 1","01/22/2024","06/30/2024","DBA: NICO'S                         NICO'S SMALL MARKET LLC                          3111 GLENDALE BLVD, UNIT B,                         LOS ANGELES, CA  90039-1805","","42-616641","7","","4","1933","3111 GLENDALE BLVD, UNIT B","LOS ANGELES","19","90039","","","",""